title,link,published,published_parsed,article_content
Wie Gehirntraining gegen Angst und Depressionen helfen kann,https://www.srf.ch/wissen/mensch/summen-knurren-laufen-wie-gehirntraining-gegen-angst-und-depressionen-helfen-kann,"Tue, 21 Nov 2023 15:09:09 +0100","time.struct_time(tm_year=2023, tm_mon=11, tm_mday=21, tm_hour=14, tm_min=9, tm_sec=9, tm_wday=1, tm_yday=325, tm_isdst=0)","Die mentale Gesundheit vieler Schweizerinnen und Schweizer ist angeschlagen – das haben Befragungen in vergangener Zeit gezeigt. Fast die Hälfte der Bevölkerung ist gemäss einer Umfrage der Stiftung Pro Mente Sana psychisch belastet – besonders stark trifft es die Jugendlichen. Rund ein Drittel der 14- bis 19-Jährigen in der Schweiz ist von psychischen Problemen betroffen, wie auch eine Unicef-Studie zeigt. Klar ist, dass es bestenfalls nicht so weit kommt. Expertinnen wie die Berner Neurowissenschaftlerin Barbara Studer raten deshalb, das Wissen um mentale Gesundheit und Gehirn – der Ort, der die Psyche steuert – bereits in den Schulalltag zu integrieren: «Um die mentale Gesundheit von Jugendlichen und Erwachsenen zu stärken, braucht es Investitionen in die Sensibilisierung und Prävention», so Studer.  Tatsächlich bestätigen Studien, dass frühe Stressintervention den Auswirkungen der Dauerbelastung auf unsere Hirne – Depressionen oder Demenz etwa – entgegenwirken könnten. Heisst: Wenn wir bereits im jungen Alter lernen, unsere Hirne zu verstehen, können wir ihnen besser helfen.  «Eine Möglichkeit dafür sind Gehirnaktivierungs- und Gehirnberuhigungsübungen», so die Expertin. «Und ich rede nicht von Sudoku».  Bei Angst spielt vor allem die Amygdala eine wichtige Rolle. Dieser «Mandelkern» wird als Teil des limbischen Systems – dem Emotionszentrum – sofort aktiviert, wenn akute Gefahr droht. So werden wichtige Energiereserven aktiviert. Hält Stress zu lange an, schwächt dieser Mechanismus uns.  Zur Überstimulation der Amygdala (der Mandelkern) kommt, dass unser Gehirn Funktionen des Körpers hemmt, die bei akuter Gefahr nicht nötig sind. Die Folgen können Herz-Kreislauf-Probleme, Schlafstörungen, Appetitverlust und Verdauungsprobleme sein.  Die überstimulierte Amygdala schränkt auch Funktionen anderer Bereiche im Gehirn ein. Im Hippocampus, der etwa für Lernen und Erinnern zuständig ist, werden weniger Gehirnzellen produziert – so fällt uns Lernen und Erinnern schwer. Unsere Amygdala ist auch mit dem präfrontalen Cortex verbunden, der wichtig ist für die Kontrolle von Emotionen und Verhalten.  Dauerstress führt dazu, dass hier Nervenverbindungen verloren gehen, wodurch unser Urteilsvermögen beeinträchtigt wird. Situationen werden emotionaler bewertet als üblich. Wenn der präfrontale Kortex schrumpft, tun wir uns schwer, in Stresssituationen adäquate Entscheidungen zu treffen. «Eine Übung, die die Amygdala beruhigt, ist summendes Gehen», so Studer. Zuerst die Atmung verlangsamen. Das sei ideal, um die Aktivität des Angstzentrums zu dämmen. «Noch besser ist es, wenn wir ruhiges Atmen mit der Stimme kombinieren».  Unser Vagusnerv, der auch «Ruhenerv» genannt wird, soll sich durch Schwingungen der Stimmbänder aktivieren. Das wirke besänftigend auf das limbische System. Von vielen wird der Vagusnerv als regulierende Schaltstelle zwischen dem Gehirn und den Organen angesehen. Als zehnter Gehirnnerv verläuft er vom Hirnstamm im Kopf über Hals und Brust bis zum Bauchraum. Expertinnen gehen davon aus, dass der Nerv, der mit den Stimmbändern und Muskeln im Rachen und mit dem Innenohr verbunden sei, aktiviert wird, indem wir Geräusche von uns geben. Ist man zu aufgebracht zum Summen, empfehlen Forschende das Knurren. Sanftes Tierknurren während des Ausatmens könne der inneren Unruhe entgegenwirken. «Im besten Fall macht man das während eines Spaziergangs», so Studer. Dass Bewegung bei Unruhe, Depressionen oder Angstzuständen helfen könnte, darauf deuten Untersuchungen. Schaut man sich MRT-Aufnahmen von Menschen mit Depressionen an, zeigen die sich etwa durch Überaktivitäten im präfrontalen Kortex. «Wenn wir unsere kognitive Leistung nicht beanspruchen, sollte da wenig Aktivität sein. Bei depressiven Menschen ist aber mehr», so der Basler Neurologe Sebastian Ludyga in einem Interview mit dem Magazin «mdr». Eine Folge: Grübeln und Gedankenkreisen. Die Strukturen und Netzwerke im Gehirn reagieren auf Veränderungen ein Leben lang, indem sie sich neu formieren und anders organisieren. Ein anderes Anzeichen von Depressionen im Gehirn ist die geringere Neuroplastizität, die sich bei Betroffenen zeigt. Genau hier könnte Bewegung ansetzen (siehe Box). Bewegung könne im Gehirn an beiden oben genannten Stellen ansetzen und Symptome lindern, so Expertinnen: Bewegung beansprucht nämlich andere Teile des Gehirns und verlagert die neuronale Aktivität vom präfrontalen Kortex in den primären Motorcortex – dem Bewegungszentrum. Durch die veränderte Hirnaktivität soll Sport so helfen, Gedankenspiralen aus dem Gehirn zu manövrieren.  An der Uni Basel das gerade mit Betroffenen erforscht. «Es gibt Studien, die belegen, dass für Patienten mit depressiven Symptomen körperliche Aktivität gleich sein kann wie eine Behandlung mit Antidepressiva», erklärt Studienleiter Markus Gerber in einem Interview. Sport könne psychotherapeutische und medikamentöse Behandlungen ergänzen – ersetzen sollte Sport die Therapie allerdings nicht. An der Ruhr-Uni Bochum wiederum konnten Forschende zeigen, dass Sport die Neuroplastizität bei depressiven Menschen erhöhen und klinische Symptome von Depressionen mindern kann: «Es ist bekannt, dass körperliche Aktivität dem Gehirn guttut, da sie zum Beispiel die Neubildung von Verbindungen bei Nervenzellen fördert. Dies könnte durchaus auch hier eine Rolle spielen», so der Forschungsleiter im Abstract. Energydrinks und Chips: Dass diese Snacks dem Strandbody nicht helfen, dürfte klar sein. Doch dass der Verzehr einen Einfluss auf das Empfinden von Freude und Glück hat? «Dafür hat die Wissenschaft Hinweise», so Studer. Es sei aber schwierig, die Vorteile bestimmter Ernährungsgewohnheiten eindeutig nachzuweisen.  «Klar ist: Wenn man mehrere Energydrinks trinkt, sorgt das für Ups and Downs im Blutzuckerspiegel.» Zuerst kicken Koffein und Zucker das Belohnungssystem – dann fällt der Blutzuckerspiegel schnell und das Loch folgt. Das Gehirn will Nachschub. Das ist im Übrigen auch beim Gamen oder bei Likes in den Sozialen Medien so. «Wir haben festgestellt, dass es immer mehr Belege für einen Zusammenhang zwischen einer schlechten Ernährung und der Verschlimmerung von psychischen Störungen wie Angst und Depression gibt,» schreibt Erstautorin Suzanne Dickson von der Göteborg Universität in der Einleitung einer Übersichtsstudie: So könne ein Vitamin-B12-Mangel zu Müdigkeit, Gedächtnisstörungen und Niedergeschlagenheit führen.  Eine mediterrane Ernährung, die reich an Obst, Gemüse und Olivenöl ist, biete nach jetzigem Stand der Wissenschaft einen gewissen Schutz vor Angst und Depression. Im Gegensatz dazu ist die Datenlage zu einzelnen Lebensmitteln und Nahrungsergänzungen im Allgemeinen nicht verlässlich genug, so Expertinnen und Experten. Die Übungen kann man übrigens in jedem Alter machen. Ein Hoch auf die Neuroplastizität. Und, summen Sie schon? In der Serie Changemakers besucht Bigna Silberschmidt Menschen, die sozial, ökologisch oder ökonomisch zum Positiven in der Gesellschaft beitragen. Kennen Sie auch Changemakers? Schreiben Sie es uns."
Ein Femizid schlägt in Italien hohe Wellen,https://www.srf.ch/news/international/morde-an-frauen-ein-femizid-schlaegt-in-italien-hohe-wellen,"Tue, 21 Nov 2023 14:12:20 +0100","time.struct_time(tm_year=2023, tm_mon=11, tm_mday=21, tm_hour=13, tm_min=12, tm_sec=20, tm_wday=1, tm_yday=325, tm_isdst=0)","Darum geht es: Der Tod einer 22-jährigen Studentin bewegt Italien. Die junge Frau wurde von ihrem Ex-Freund in Norditalien getötet. Den mutmasslichen Täter nahm die Polizei nach Tagen der Fahndung schliesslich in Deutschland fest. Die beiden Studierenden waren Medienberichten zufolge eineinhalb Jahre lang ein Paar gewesen, bevor sich die junge Frau im vergangenen Sommer trennte; allerdings blieben die beiden in Kontakt. Es ist dies seit Jahresbeginn bereits der 102. Fall eines Femizids in Italien.  Die junge Frau war nach einem Treffen mit ihrem Ex-Freund vor mehr als einer Woche während Tagen vermisst worden. Am vergangenen Samstag wurde dann die Leiche der Frau aus der Region Venedig nach langer Suche in einer Schlucht unweit des Barcis-Stausees in der Region Friaul-Julisch Venetien im Norden Italiens gefunden. Die Behörden hatten einige Tage zuvor offiziell Ermittlungen gegen den Ex-Freund eingeleitet. (dpa) Weit verbreitetes Phänomen: «Man kann in der Tat von einer Epidemie sprechen», sagt die freie Journalistin und Autorin Margherita Bettoni. Sie befasst sich mit Tötungsdelikten an Frauen und Mädchen, sogenannten Femiziden. Bettoni meint mit der Epidemie aber nicht Italien im Speziellen. In Deutschland und anderen Ländern geschähen ähnlich viele Morde an Frauen, meist durch ihren Partner oder Angehörige. Femizide kommen in allen Ländern vor und ziehen sich durch alle Bevölkerungsschichten, Altersgruppen und Kulturen.  Mögliche Gründe: Es gibt strukturelle Faktoren, die die Wahrscheinlichkeit von Femiziden erhöhen. Dazu gehören laut Bettoni etwa Geschlechterstereotypen oder falsch verstandene Männlichkeit. Gerade diese beiden Faktoren führten dazu, dass manche Männer ihre Gefühle oder Probleme nur durch Gewalt ausdrücken könnten. Auch ungleiche Machtverhältnisse spielten eine wichtige Rolle. Hinzu kommen Risikofaktoren, die in Beziehungen vorkommen: häusliche Gewalt etwa. «Femizide sind das Resultat patriarchalisch geprägter Gesellschaften», so Bettoni.  Grosse Anteilnahme: Der neuste Fall eines Femizids hat in Italien ein grosses Echo ausgelöst, auch seitens Politikerinnen und Politikern. So haben zahlreiche von ihnen der Trauerfamilie ihr Beileid ausgesprochen, darunter auch Premierministerin Georgia Meloni. Die Chefin des sozialdemokratischen Partito Democratico, Elly Schlein, schlug der Regierung vor, ein neues Schulfach «emotionale Bindung» einzuführen. «Man ist sich überwiegend darüber einig, dass Femizide ein gesellschaftliches Problem sind», stellt die Journalistin Bettoni fest.  Das tut die Regierung: Ministerpräsidentin Meloni will nun die Reform des sogenannten Codice Rosso beschleunigen. Das Gesetz gilt seit 2019, doch die Revision, die Verbesserungen bringen soll – etwa, dass Fälle von häuslicher Gewalt schneller bearbeitet werden – muss noch vom Parlament genehmigt werden. Ziel der Revision ist, möglichst frühzeitig Massnahmen gegen notorische Gewalttäter im privaten Bereich verfügen zu können, etwa eine Wegweisung aus der gemeinsamen Wohnung. Langfristige Massnahmen nötig: Zur Bekämpfung von Femiziden sei aber mehr nötig als ein Gesetz, betont Bettoni. Dazu brauche es einen «radikalen Wandel auf allen Ebenen der Gesellschaft». Neben Notfallmassnahmen, um eine Frau umgehend aus einem Gefahrenbereich herauszubringen, und mehr Frauenhäusern spricht Bettoni von einer besseren Ausbildung der Polizei mit Gefährder-Ansprachen, aber auch mehr Forschung, mehr Täterarbeit oder Anti-Gewalt-Training. Und: «Es braucht Massnahmen, die dazu führen, dass ungleiche Machtverhältnisse abgebaut werden – das sollte schon im Kita- und Schulalter beginnen.» Die wichtigsten und spannendsten News jetzt bequem auf Whatsapp – einmal morgens (Montag bis Freitag), einmal abends (die ganze Woche): Abonnieren Sie den SRF-News-Kanal auf Ihrem Smartphone hier."
«Waffenpause zwischen Hamas und Israel ist in greifbarer Nähe»,https://www.srf.ch/news/international/ankuendigung-der-hamas-in-gaza-waffenpause-zwischen-hamas-und-israel-ist-in-greifbarer-naehe,"Tue, 21 Nov 2023 11:02:33 +0100","time.struct_time(tm_year=2023, tm_mon=11, tm_mday=21, tm_hour=10, tm_min=2, tm_sec=33, tm_wday=1, tm_yday=325, tm_isdst=0)","Die  Terrororganisation Hamas hat gerade erklärt, man stehe kurz vor einer Waffenruhe mit Israel. Vertreter der radikalislamischen Organisation hätten das so an die Vermittelnden aus Katar übergeben, sagte der Chef der Hamas. Weitere Informationen dazu gibt es nicht, und auch Israel hat sich bisher nicht dazu geäussert. Islamwissenschafter Reinhard Schulze schätzt die Ankündigung ein.                  Reinhard Schulze               Islamwissenschaftler      Reinhard Schulze ist emeritierter Professor für Islamwissenschaft und Direktor des Forum Islam und Naher Osten der Universität Bern. SRF News: Für wie glaubwürdig halten Sie es, dass eine Waffenruhe tatsächlich in greifbarer Nähe ist? Reinhard Schulze: Vielleicht ist das Wort Waffenruhe etwas hoch gegriffen. Man müsste von Waffenpause sprechen, weil bei allen Beteiligten klar ist, dass es sich zunächst um eine temporäre Massnahme handelt. Und wenn man den Aussagen der Hamas Glauben schenken kann, geht es um eine Waffenpause, die etwa fünf oder sieben Tage umfasst. Eine solche Waffenpause scheint tatsächlich in greifbarer Nähe zu sein und es wäre nicht verwunderlich, wenn heute im Laufe des Vormittags die Regierung in Katar tatsächlich eine solche Pause verkünden könnte. Die Hamas kündigt diese mögliche baldige Waffenpause quasi im Alleingang an. Welches Ziel verfolgt sie damit? Die Hamas möchte die Initiative behalten und zeigen, dass sie bereit ist, grundsätzlich eine Waffenruhe einzuhalten und durchzusetzen, und dass Israel das Land sei, das nicht bereit für eine Waffenpause ist. Damit ist der Schwarze Peter bei Israel und das ist genau das, was die Hamas will. Hamas möchte Israel zum Sündenbock machen und den ganzen Konflikt für sich positiv interpretieren.  Sie möchte die Weltöffentlichkeit auf die Seite von Hamas ziehen.                   Wurde der Druck auf die Hamas ganz einfach zu gross, dass sie nun so vorpreschen? Ich weiss nicht, ob die Hamas tatsächlich einen Druck empfindet. Der Druck ist sicherlich auch von der Weltöffentlichkeit auf Israel ausgerichtet. Die Hamas hat es geschafft, etwas vergessen zu machen, nämlich den Grund, warum der Krieg überhaupt stattfindet. Der 7. Oktober ist sozusagen aus der öffentlichen Diskussion herausgetreten und stattdessen steht eben das Leiden der Bevölkerung im Gaza im Vordergrund.  Damit kann sich Hamas zum Opfer machen und sich in dieser Opferrolle sehr viel stärker noch politisch positionieren. Das ist sicherlich der Grund dafür, weshalb Hamas eine solche Waffenpause als Sieg interpretiert und damit ein Dilemma für die israelische Regierung produziert. Denn die israelische Regierung müsste mit einer solchen Waffenpause auch die Kröte schlucken, dass Hamas in irgendeiner Art und Weise die fünf oder sieben Tage nutzen könnte, sich auch militärisch neu zu arrangieren.                   Vermittlerin in dieser Feuerpause ist Katar und Katar soll das Abkommen auch verkünden. Wie ist das Verhältnis zwischen der Hamas und Katar in dieser Frage? Katar hat sich inzwischen in eine Position bringen können, in der es gewissermassen als globaler Vermittler auftreten kann. Das kleine Emirat ist sozusagen verantwortlich für ein weltpolitisches Geschehen. Das hat es schon mit Afghanistan gemacht, mit den Taliban. Und jetzt wird eben Katar zur Drehscheibe auch der Debatten um eine mögliche Waffenpause oder gar Waffenruhe in Gaza. Und das ist für das Emirat viel wichtiger als eine direkte politische Parteinahme etwa für Hamas oder damals für die Taliban. Diese Rolle möchte Katar spielen, und im Augenblick gelingt es Katar ganz gut. Die Grossmächte sind sozusagen nur noch nachvollziehend.  Das Gespräch führte Vera Deragisch. Der Krieg im Nahen Osten hat bereits Tausende von Menschenleben gekostet, grösstenteils Zivilpersonen. Die Glückskette ruft zur Solidarität auf, um der Zivilbevölkerung zu helfen. Sie unterstützt ihre Schweizer Partnerorganisationen vor Ort – sie hilft dort, wo die humanitären Bedürfnisse am grössten sind. Zurzeit ist das Gaza. Spenden für die Sammlung «Humanitäre Krise im Nahen Osten» können auf der Webseite der Glückskette getätigt werden."
Im Gazastreifen wird auch um die Wahrheit gekämpft,https://www.srf.ch/news/international/faktencheck-zu-nahostkonflikt-im-gazastreifen-wird-auch-um-die-wahrheit-gekaempft-1,"Tue, 21 Nov 2023 13:41:04 +0100","time.struct_time(tm_year=2023, tm_mon=11, tm_mday=21, tm_hour=12, tm_min=41, tm_sec=4, tm_wday=1, tm_yday=325, tm_isdst=0)","Seit Wochen behauptet die israelische Armee, dass sich unter dem grössten Spital Gazas eine Zentrale der radikal-islamischen Hamas befinde. Jüngst hat Israels Armee die Kontrolle über die Klink erlangt. Posts auf verschiedensten Social-Media-Kanälen wollen diesen Fund beweisen. Unter den Beiträgen ist ein Video des israelischen Militärs (IDF), das offenbar auch von der israelischen Botschaft in Österreich veröffentlicht wurde. «Bei Videos vom IDF ist es wichtig, festzuhalten, dass dies die israelische Armee selber behauptet», erklärt Daniela Meyer vom Netzwerk Faktencheck von SRF. Die Informationen zum Krieg in Nahost sind zahlreich und zum Teil widersprüchlich. Die verlässlichsten Quellen sind unsere Korrespondentinnen und Korrespondenten vor Ort. Weitere wichtige Quellen neben Agenturmeldungen sind Augenzeugen, welche Informationen aus erster Hand liefern können. Wir verwenden grundsätzlich mindestens zwei voneinander unabhängige Quellen. Die Aussagen der verschiedenen Konfliktparteien ordnen wir entsprechend ein. Grundsätzlich gilt bei SRF: Je schwieriger und unzuverlässiger die Quellenlage, desto wichtiger ist Transparenz. Umstrittene Fakten und Informationen, die nicht unabhängig überprüfbar sind, werden als solche kenntlich gemacht.  Das Netzwerk Faktencheck von SRF bemüht sich zudem, zweifelhafte Inhalte auf Authentizität und Wahrheitsgehalt zu überprüfen. Hierbei spielen auch Plausibilitätschecks und die Arbeit mit international agierenden Fachgemeinschaften eine Rolle. Auch die BBC berichtete vor Ort: Lucy Williamson wurde im Anschluss an die mutmassliche Entdeckung durch die Räumlichkeiten geführt. Eigenen Angaben zufolge durfte sie weder mit dem Personal noch mit Patienten sprechen. Auffällig: Im Unterschied zum IDF-Video liegen die Waffen in den Aufnahmen der BBC teilweise nicht an der gleichen Stelle wie beim ursprünglichen Video. Fazit: «Zum Fund im Al-Schifa-Spital gibt es keine Bestätigung von unabhängiger Seite», so Meyer. Auf Plattformen wie Facebook und X war vor einigen Tagen ein angeblicher Beitrag von Gibson über Israel verbreitet worden. Der Post zeigte eine Flagge Israels mit einer Sanduhr anstelle des blauen Davidsterns. «Bald das Ende und sie wissen es», heisst es dazu unter dem Namen und Porträt des Schauspielers und Regisseurs («Braveheart»).  Der US-Schauspieler und Regisseur sei nicht in solchen Netzwerken im Internet unterwegs, antwortete sein Agent Alan Nierob auf eine Anfrage der Deutschen Presse-Agentur. «Er ist nicht in Sozialen Netzwerken und dies ist kein Post von ihm», so der Agent.  Fazit: Der angebliche Post von Mel Gibson ist eine Falschinformation. Das israelische Militär hat nach eigenen Angaben Hinweise auf verschleppte Geiseln in einer Kinderklinik in Gaza-Stadt gefunden. Armeesprecher Daniel Hagari veröffentlichte kürzlich Bilder, die zeigen sollen, dass die Hamas im Keller des Rantisi-Spitals Geiseln festgehalten hat. Die Hamas bezeichnete die Aufnahmen als gefälscht.  Hagari verweise auf einen «zufälligen Kalender» als Beweis für eine Liste mit mutmasslichen Geiselnehmern, so Muhammad Shehada auf X. Er ist Journalist, lebt in den palästinensischen Gebieten und schreibt für internationale Medien sowie verschiedene Organisationen. «Kritisiert wird insbesondere, dass nur Wochentage auf dem Kalender stehen», erklärt Meyer vom SRF-Faktencheckteam. «Der Kalender beginnt zwar tatsächlich mit dem 7. Oktober, dem Tag des Angriffs auf Israel, aber ein Kalender mit Wochentagen ist wohl noch kein Beweis für das Festhalten von Entführten.» Fragwürdig sei der angebliche Fund im Keller trotzdem. Fazit: Der Kalender betrifft den Angriff auf Israel, aber nicht zwingend die Geiselnahmen. Die israelische Armee hat am 30. Oktober auf X behauptet, eine ihrer Soldatinnen aus den Händen der Hamas befreit zu haben. Aber war Ori Megidish tatsächlich Gefangene der Hamas? Der populistische Medienschaffende Jackson Hinkle aus den USA stellt dies infrage. Denn: Am 12. Oktober, also zur Zeit der angeblichen Gefangenschaft, hat eine gleichnamige Person auf Facebook und Instagram ein Bild von sich gepostet. Mit der verschwommenen Aufnahme wollen Hinkle und ein Account namens @xpmov beweisen, dass Ori Megidish gar nicht in Gefangenschaft hat sein können.  Allerdingst stammt dieser Post nicht zwingend von der betroffenen israelischen Soldatin. Zudem ist @xpmov eine fragwürdige Quelle, die sich auf X selbst zur islamistischen Organisation Hisbollah bekennt («With Hezbollah in word and deed»). Dies legt die Annahme nahe, dass ein Fake-Account die israelische Armee bewusst als Lügnerin inszenieren will. Fazit: Das entsprechende Profil ist kein Beweis für eine falsche Darstellung Israels. Dieser Artikel wurde am 20. November 2023 erstmals publiziert. Am Folgetag wurde aus Gründen der Ausgewogenheit eines der Faktencheck-Beispiele ausgetauscht. Die wichtigsten und spannendsten News jetzt bequem auf Whatsapp – einmal morgens (Montag bis Freitag), einmal abends (die ganze Woche): Abonnieren Sie den SRF-News-Kanal auf Ihrem Smartphone hier."
