title,link,published,published_parsed,article_content
Tessiner Auto ging in Flammen auf: Gotthard-Tunnel wieder offen,https://www.blick.ch/schweiz/graubuenden/wegen-fahrzeugbrand-gotthard-tunnel-in-beide-richtungen-gesperrt-id19175806.html,"Fri, 24 Nov 2023 08:21:54 GMT","time.struct_time(tm_year=2023, tm_mon=11, tm_mday=24, tm_hour=8, tm_min=21, tm_sec=54, tm_wday=4, tm_yday=328, tm_isdst=0)","Am Freitagmorgen war der Gotthardtunnel in beide Richtungen gesperrt. Grund dafür war ein Autobrand, wie der TCS auf X mitteilte. Nach dem Mittag hob die Polizei die Sperrung in beiden Fahrtrichtungen auf, es gab jedoch zunächst weiterhin Wartezeiten. Der Vorfall ereignete sich um 8.30 Uhr, wie die Kantonspolizei Uri in einer Medienmitteilung schreibt. Der Lenker eines Personenwagens mit Tessiner Kontrollschildern war im Gotthard-Strassentunnel in Fahrtrichtung Nord unterwegs, als aus derzeit ungeklärten Gründen das Fahrzeug in Brand geriet, so die Polizei.  Der 47-jährige Lenker wurde mit leichten Verletzungen zur Kontrolle durch den Rettungsdienst Uri ins Kantonspital nach Altdorf gebracht. Die Schäden können derzeit noch nicht beziffert werden. Die genaue Brandursache ist Gegenstand der polizeilichen Ermittlungen. (dzc)"
Basler Forscher entdecken neue Geruchs-Neuronen: Schwangerschaft verändert das Gehirn,https://www.blick.ch/schweiz/basler-forscher-entdecken-neue-geruchs-neuronen-schwangerschaft-veraendert-das-gehirn-id19175760.html,"Fri, 24 Nov 2023 08:21:33 GMT","time.struct_time(tm_year=2023, tm_mon=11, tm_mday=24, tm_hour=8, tm_min=21, tm_sec=33, tm_wday=4, tm_yday=328, tm_isdst=0)","Einige Wochen nach der Geburt verschwinden die zusätzliche Neuronen wieder, wie eine am Donnerstagabend im Fachblatt «Science» publizierte Studie von Forschender der Universität Basel zeigte. Das Erkennen der Jungen am Geruch gewährleistet, dass Mütter ihre eigenen Jungen aufziehen. Das Basler Forschungsteam hat herausgefunden, dass während der Schwangerschaft im Hirn bestimmte Pools von Stammzellen werden, von denen sich einige normalerweise in einer Art Schlafzustand befinden. Das ermöglicht die Bildung der neuen Neuronen im Riechkolben, einer Region im Gehirn, die Informationen über Gerüche verarbeitet. Die verschiedenen Stammzellpools werden im Verlauf der Schwangerschaft wellenartig und zu unterschiedlichen Zeitpunkten stimuliert. In der Studie wurden Gehirne von Mäusen untersucht. Aber auch bei Menschen gibt es im gleichen Hirnareal Stammzellen, wie die Universität Basel in einer Mitteilung erklärte. Diese bilden aber eigentlich ab dem frühen Säuglingsalter keine Neuronen für den Riechkolben mehr aus. Da einige Frauen während der Schwangerschaft über Veränderungen des Geruchssinns berichten, vermutet Studienerstautorin Zayna Chaker aber, dass in Menschenhirnen ähnliche Prozesse ablaufen könnten wie bei Mäusen. «Auch hier könnte die Schwangerschaft Stammzellen aus ihrem Schaltzustand wecken», wurde Chaker in der Mitteilung zitiert. Die Forschenden planen nun, in weiteren Studien zu untersuchen, welche Signale die Rekrutierung von Stammzellen und die Neubildung von Nervenzellen während der Schwangerschaft auslösen, wie die Universität Basel mitteilte. Auch müsse noch geklärt werden, warum und wie die neu gebildeten Nervenzellen im Riechkolben wieder abgebaut werden und ob bei werdenden Vätern ähnliche Umbauprozesse im Gehirn stattfinden. (SDA)"
49 Tage in Hamas-Gefangenschaft: Wer sind die 13 freigelassenen israelischen Geiseln?,https://www.blick.ch/ausland/49-tage-in-hamas-gefangenschaft-wer-sind-die-13-freigelassenen-israelischen-geiseln-id19178694.html,"Fri, 24 Nov 2023 20:22:39 GMT","time.struct_time(tm_year=2023, tm_mon=11, tm_mday=24, tm_hour=20, tm_min=22, tm_sec=39, tm_wday=4, tm_yday=328, tm_isdst=0)","49 Tage nach ihrer Entführung endet für 13 israelische Geiseln der Albtraum. Nachdem sie am 7. Oktober aus dem Kibbuz Nir Oz entführt wurden und die Massaker der Hamas in der Siedlung miterlebt hatten, durften sie am Freitag heimkehren. Das bestätigten die Israelischen Verteidigungskräfte (IDF) am Freitagabend. Unter den Geiseln befanden sich neun Frauen und vier Kinder. Weitere sollen in den kommenden Tagen freigelassen werden. Sie sind Teil des Geiseldeals, den Israel mit der Hamas ausgehandelt hat. Im Gegenzug zu den insgesamt 50 Geiseln stimmte Israel zu, 150 Palästinenser freizulassen und vereinbarte eine viertägige Waffenruhe. Am Freitag durften bereits 39 Palästinenser die Gefängnisse verlassen – unter ihnen befanden sich nur Frauen und Minderjährige.  Eine Mutter und ihre beiden Töchter kehrten am Freitag wieder zurück nach Israel. Es handelt sich um deutsche Staatsbürger. Die Familie befand sich am 7. Oktober im Kibbuz und versteckte sich in einem Bunker. Die Grossmutter (†69) der kleinen Mädchen wurde getötet. Der Vater der beiden Kinder konnte auf seinem Smartphone mitverfolgen, wie seine Kinder und seine Frau nach Gaza gebracht wurden. Jetzt ist die Familie wieder vereint. Am Freitagabend äussert sich der Vater gegenüber dem israelischen Sender 12: «Meine Familie kam aus der Gefangenschaft zu mir nach Hause. Aber ich feiere nicht.» Stattdessen denkt der Familienvater an all die Geiseln, die noch festgehalten werden. «Ich werde nicht feiern, bis der letzte der Entführten zurückgekehrt ist.» Die Bilder von Yaffa Adar in einem Golfcart gingen um die Welt. Ihre Enkelin trat in den Medien auf und forderte die Freilassung der 85-Jährigen. «Das ist meine Grossmutter, sie wurde gefangen genommen und nach Gaza gebracht», schrieb sie auf Twitter. Jetzt wurde die Urgrossmutter mit ihrer grossen Familie vereint. Auch die ältere Dame Hanna Katzir befindet sich unter den 13 freigelassenen Geiseln, bestätigt ihre Familie. Dabei wurde sie vor zwei Tagen für tot erklärt. «Wir geben den Tod der Siedlerin Hannah Katzir bekannt, die wir zuvor aus humanitären Gründen freilassen wollten», hatte der Islamische Dschihad vermeldet. Und weiter: «Doch das Zögern des Feindes hat ihr das Leben gekostet.» Das stellt sich nun als Lüge heraus. Katzir ist wohlauf in Israel angekommen. Danielle Aloni und ihre Tochter Emilia wurden von der Hamas freigelassen. Aloni war eine der Frauen, die in einem Propaganda-Video der Hamas den Ministerpräsidenten Benjamin Netanyahu (74) aufforderten, einem Waffenstillstand zuzustimmen. Es war nicht klar, ob die Frauen von Terroristen zu diesen Aussagen gezwungen wurden. Nun wurde sie unter den 13 freigelassenen Geiseln erkannt. Ihre Schwester und deren dreijährigen Zwillinge befinden sich noch immer in Gefangenschaft der Hamas.  Der kleine Ohad feierte Ende Oktober seinen neunten Geburtstag, während er als Geisel gehalten wurde. Sein Onkel wurde bei dem Angriff der Hamas getötet. Ohad wurde mit seiner Mutter und seiner Grossmutter aus seiner Heimat entführt. Sein Grossvater befindet sich weiterhin in Gefangenschaft.  Die ältere Dame Margalit Mozes wurde aus dem Kibbutz Nor Oz entführt. Laut Familienangehörigen hat die ältere Frau gesundheitliche Probleme und muss dringend medizinisch versorgt werden. Bei der Frau handelt es sich um eine Deutsch-Israelin.  Die Familie von Adina Moshe erkannte sie auf einem Videoclip der Hamas, wo sie zwischen zwei Terroristen auf einem Motorrad zu sehen war. Sie hatte kürzlich eine Herz-OP und muss Medikamente nehmen. Ihr Mann und sie lebten nahe der Grenze zu Gaza – immer wieder kam es zu Anspannungen. Ihre Enkelin sagte im Interview mit ABC News über ihr Grosi: «Sie hat uns immer gesagt, wenn die Terroristen zu ihrem Haus kommen, wird sie Kaffee kochen und gutes Essen auf den Tisch stellen.» Doch es kam anders. Am 7. Oktober harrten Adina Moshe und ihr Mann Anat Moshe (†75) im Bunker aus. Die Hamas töteten den irakischen Ehemann und entführten Adina. Jetzt ist Adina Moshe wieder bei ihrer Familie. Die Israelin Hanna Peri (79) und ihr Sohn Nadav Popplewell (51) wurden ebenfalls nach Gaza verschleppt. Die Hamas hat der Tochter von Peri Bilder geschickt, auf denen sie ihre Familienangehörigen in Gefangenschaft erkannte. Im Hintergrund konnte sie bewaffnete Männer erkennen. Die Frau durfte nun nach Hause kehren. Ihr Sohn befindet sich weiterhin in Gefangenschaft."
Aus Kinderheim in Cherson entführt: Hat Putin-Freund ein ukrainisches Baby «adoptiert»?,https://www.blick.ch/ausland/aus-kinderheim-in-cherson-entfuehrt-hat-putin-freund-ein-ukrainisches-baby-adoptiert-id19178248.html,"Fri, 24 Nov 2023 18:24:39 GMT","time.struct_time(tm_year=2023, tm_mon=11, tm_mday=24, tm_hour=18, tm_min=24, tm_sec=39, tm_wday=4, tm_yday=328, tm_isdst=0)","Die kleine Margarita Prokopenko (2) war erst zehn Monate alt, als sie aus der Ukraine entführt wurde. Das Mädchen wurde nach Russland verschleppt und zur «Adoption» freigegeben, wie Tausende andere Kinder seit Beginn der russischen Invasion in der Ukraine. Lange Zeit wusste niemand, wo das kleine Mädchen steckt. Neuste Recherchen der BBC zeigen jetzt: Ein enger Vertrauter des russischen Präsidenten Wladimir Putin (71) ist offenbar eng in die «Adoption» von Margarita verwickelt. So steht auf der Adoptionsurkunde von Margarita ein prominenter Name: Sergej Mironow, der 70-jährige Vorsitzende der russischen politischen Partei «Gerechtes Russland», wird in Margaritas Adoptionsurkunde aufgeführt. Mironow ist mit der Frau verheiratet, die Margarita 2022 offiziell adoptiert hat. Die heute Zweijährige war unter den 48 Kindern, die aus einem Kinderheim in Cherson verschwanden. Die BBC arbeitete mit der ukrainischen Menschenrechtsforscherin Viktoria Nowikowa zusammen, um herauszufinden, was mit Margarita und den anderen Kindern geschehen ist. Laut Nachforschungen von Nowikowa hat Margaritas Mutter kurz nach ihrer Geburt das Sorgerecht für ihre kleine Tochter aufgegeben – sie wurde im Kinderheim von Cherson untergebracht. Wegen einer Bronchitis war das Kind im Sommer 2022 im Spital in Behandlung bei der Kinderärztin Natalja Ljutikowa. Das Rätsel über ihren Verbleib begann laut Ljutikowa, als eine Frau in einem lilafarbenen Kleid für einen kurzen Besuch in Spital auftauchte. Sie habe sich als die «Leiterin der Kinderabteilung» in Moskau vorgestellt. Cherson befand sich damals unter russischer Besetzung. Kurz nachdem die Frau wieder gegangen war, erhielt Ljutikowa nach eigenen Angaben wiederholt Anrufe von einer Beamtin, die kürzlich mit der Leitung des Kinderheims betraut worden war. Ljutikowa wurde angewiesen, Margarita auf eine «Reise» vorzubereiten – dann kreuzten russische Soldaten mit schwarzen Sonnenbrillen auf und nahmen Margarita mit. «Es war wie in einem Film», berichtete eine Krankenschwester der BBC. Ermittlerin Nowikowa entdeckte später ein Dokument, wonach das Mädchen für medizinische Tests in ein Moskauer Spital überstellt wurde. Auf dem Papier wurde auch eine Frau namens Inna Warlamowa genannt. Von der Ärztin wurde sie als die mysteriöse Frau im lila Kleid identifiziert, die im Kinderheim in Cherson aufgetaucht war. Verheiratet ist Warlamowa mit Mironow. Wie das russische Investigativ-Portal «Important Stories» berichtet, wurde Margarita im Dezember 2022 von Mironow und Warlamowa adoptiert, in Marina Mironowa umbenannt und erhielt die russische Staatsbürgerschaft.  Mironow selbst nannte den Bericht einen Fake. «Ich sehe keinen Sinn darin, auf eine weitere falsche Hysterie zu reagieren, die von den ukrainischen Sicherheitsdiensten und ihren westlichen Handlangern entfesselt wird», sagt er zu «RTVI».  Es wird vermutet, dass Russland mindestens rund 20'000 ukrainische Kinder systematisch verschleppt hat. Anfang dieses Jahres erliess der internationale Strafgerichtshof (IStGH) Haftbefehle gegen Präsident Putin und seine Beauftragte für Kinderrechte, Maria Lwowa-Belowa, wegen der mutmasslichen illegalen Deportation ukrainischer Kinder in die von Russland kontrollierten Gebiete, mit der Absicht, sie dauerhaft aus ihrem eigenen Land zu entfernen. Die russische Regierung deportiert nach eigenen Angaben keine ukrainischen Kinder, sondern evakuiert sie, um sie vor dem Krieg zu schützen. (ene/man)"
«Es war gespenstisch»: Berner (26) erlebt Krawall-Nacht von Dublin,https://www.blick.ch/ausland/es-war-gespenstisch-berner-26-erlebt-krawall-nacht-von-dublin-id19177808.html,"Fri, 24 Nov 2023 17:19:13 GMT","time.struct_time(tm_year=2023, tm_mon=11, tm_mday=24, tm_hour=17, tm_min=19, tm_sec=13, tm_wday=4, tm_yday=328, tm_isdst=0)","Autos wurden angezündet, Geschäfte verwüstet und geplündert. Dublin erlebte eine Nacht voller Gewalt. «Das sind Szenen, die wir seit Jahrzehnten nicht gesehen haben», sagte Irlands Premierminister Leo Varadkar (44) am Freitag. Randalierer hatten sich am Donnerstagabend Strassenschlachten mit der Polizei geliefert. Unter anderem flogen Flaschen und Feuerwerkskörper in Richtung der Beamte.  Auslöser der Proteste war ein Messerangriff vor einer Grundschule, bei dem drei Kinder und eine Frau verletzt wurden. Der Angreifer wurde noch am Tatort festgenommen, ersten Ermittlungen zufolge schlossen die Ermittler ein terroristisches Motiv aus. Nach der Attacke gab es vor allem in den sozialen Medien unzählige Spekulationen über die Nationalität des Täters – daraufhin versammelten sich vor allem rechtsradikale Hooligans im Zentrum von Dublin. Die Stimmung heizte sich auf. Währenddessen sass ein Berner (26) mit seinen Freunden in einem Pub. «Wir haben was getrunken, als der Wirt zu uns kam und meinte, dass wir gehen müssen. Alle mussten raus», sagt der 26-Jährige zu Blick. Die ganze Innenstadt wurde abgeriegelt. «Alle Bars und Geschäfte haben auf einmal dichtgemacht. Wir konnten auch nicht mehr zu unserer Unterkunft, die in der Innenstadt liegt. Die Polizei riet uns, weit wegzugehen.» Als sie den abgeriegelten Bereich verliessen, sahen sie schon, wie sich Vermummte in Richtung Innenstadt bewegten. Dass es eine der schlimmsten Krawallnächte für Dublin seit Jahrzehnten werden sollte, ahnten die Schweizer da noch nicht. «Wir sind dann in ein anderes Pub gegangen.» Nach drei Stunden durften sie schliesslich wieder zu ihrer Unterkunft. «Es war gespenstisch. Alles war zu und kaum Leute zu sehen, dabei ist da sonst die Hölle los.» Am nächsten Morgen sahen sie dann die Spuren der Nacht. Kaputte Geschäfte und ausgebrannte Busse. Sogar ein Polizeiauto wurde in Brand gesteckt. Nach Angaben von Polizeichef Drew Harris wurden 34 Menschen festgenommen. Mit dem Fortschreiten der Ermittlungen werde es noch viele weitere Festnahmen geben, sagte Harris und warnte vor neuer Gewalt."
Doris Liber wartet noch immer auf ihren Sohn – erste Geisel-Übergabe erfolgreich: Der Schmerz der Zurückgelassenen,https://www.blick.ch/ausland/doris-liber-wartet-noch-immer-auf-ihren-sohn-erste-geisel-uebergabe-erfolgreich-der-schmerz-der-zurueckgelassenen-id19178196.html,"Fri, 24 Nov 2023 16:47:16 GMT","time.struct_time(tm_year=2023, tm_mon=11, tm_mday=24, tm_hour=16, tm_min=47, tm_sec=16, tm_wday=4, tm_yday=328, tm_isdst=0)","24 von ungefähr 240. So viele Geiseln hat die Terrororganisation Hamas am Freitag freigelassen. Darunter vor allem Frauen und kleine Kinder. Im Gegenzug muss Israel inhaftierte Palästinenser begnadigen. Zumindest ist das die Abmachung, die im Rahmen der viertägigen Feuerpause gilt. In den kommenden Tagen sollen weitere Geiseln folgen – 50 insgesamt. Männliche Geiseln müssen aber immer noch warten, ihre Familienmitglieder müssen auf eine zweite Feuerpause hoffen. So auch Doris Liber (56). Ihr Sohn Guy Iluz (26) wurde in den frühen Morgenstunden des 7. Oktober von Hamas-Terroristen verschleppt. Er war zu diesem Zeitpunkt mit mehreren Freunden unterwegs. Zwei aus der Gruppe konnten sich in Sicherheit bringen, einer hingegen wird, wie Guy, vermisst, die anderen wurden von den Islamisten niedergemetzelt. «Ich habe die letzten zwei Wochen das Haus nur für Beerdigungen verlassen», erzählt die Mutter. Sie rechnete jeden Tag damit, Besuch von den Behörden zu bekommen. «Wenn jemand stirbt, dann kommt die Polizei mit einem Sozialarbeiter vorbei. Bislang kam niemand zu mir. Das macht mir Hoffnung. Aber es bleibt die grosse Ungewissheit.» Sie freut sich aber, dass zumindest einige Eltern nun Gewissheit bekommen. «Natürlich freue ich mich für alle Kinder und Frauen, die jetzt freikommen. Ganz Israel freut sich», erzählt sie im Gespräch mit Blick. In ihren Worten schwingt auch ein unausgesprochenes «Aber» mit. Denn sie weiss immer noch nicht, wo ihr Sohn ist – und ob er überhaupt noch lebt. «Es gibt seit dem 7. Oktober keine guten Tage mehr. Nur schlechte und noch schlechtere.» Immer wieder wacht sie nachts auf, liest die Nachrichten und hofft auf ein Lebenszeichen von ihrem Sohn Guy. Denn als wäre das alles nicht genug, tauchte Mitte Oktober ein Propaganda-Video der Hamas auf. Darin behauptet ein Islamist, Guy sei im Gazastreifen von israelischen Bomben getötet worden. Eine offizielle Bestätigung gibt es nicht. Ihre einzige Hoffnung: Zum Deal zwischen dem Staat Israel und der Terrororganisation Hamas gehört auch, dass humanitäre Hilfswerke in den Gazastreifen reisen und die Geiseln besuchen dürfen. «Ich bin sehr zuversichtlich, dass ich vom Roten Kreuz irgendeine Nachricht bekomme, dass er lebt», sagt Liber. «Ich brauche mehr Informationen, etwas, woran ich mich festhalten kann.» Das Internationale Rote Kreuz (IKRK) ist auch massgeblich am Geisel- und Gefangenenaustausch beteiligt. IKRK-Mitarbeiter werden es auch sein, die die Kinder und Frauen an die israelische Armee (IDF) übergeben. Für die Zeit während und nach der Befreiung hat das Gesundheitsministerium Israels strikte Protokolle zum Umgang mit den Geiseln herausgegeben. Auch wenn am Freitag alles gut kommt – die Angst lässt Doris Liber nicht los. «Diese ganze Sache basiert auf dem Vertrauen, dass wir der Terrororganisation Hamas geben. Sie haben sowieso die Kontrolle über alles. Ich glaube einfach nichts, was sie sagen.» Trotz ihrer Sorgen, dem Zweifel und der Ungewissheit, ob es eine weitere Feuerpause geben wird, verspricht die Mutter ihrem Sohn: «Ich werde dich holen.»"
Pech für Lotto-Millionär: Feuerteufel setzt Häuser von Chico in Brand,https://www.blick.ch/ausland/pech-fuer-lotto-millionaer-feuerteufel-setzt-haeuser-von-chico-in-brand-id19177930.html,"Fri, 24 Nov 2023 15:31:44 GMT","time.struct_time(tm_year=2023, tm_mon=11, tm_mday=24, tm_hour=15, tm_min=31, tm_sec=44, tm_wday=4, tm_yday=328, tm_isdst=0)","In Dortmund treibt ein Brandstifter sein Unwesen. Bereits über ein Dutzend Mal hat er zugeschlagen, vermuten die Ermittler. In der Nacht auf Freitag traf es zwei Häuser des bekannten Lotto-Millionärs Kürsat Y. (43), genannt Chico. Der Deutsche hatte als sichere Geldanlage mehrere Liegenschaften gekauft. Zwei von ihnen wurden nun vom Feuer beschädigt. «Ich habe das heute Morgen erfahren. Mein Bruder hat Bescheid gesagt, er wohnt ganz in der Nähe», sagt Chico zu «Bild». Der 43-Jährige eilte sofort zum Ereignisort. Dort standen Polizei und Feuerwehr bereits im Einsatz. «Ich war geschockt, als ich das gesehen habe. Zum Glück ist niemandem etwas passiert.» Die Bewohner konnten sich rechtzeitig in Sicherheit bringen. Rund 70 Feuerwehrleute konnten die Flammen unter Kontrolle bringen und verhindern, dass weitere Häuser in Brand gerieten. Allerdings brannten die Dächer der beiden Häuser aus. Nach Angaben der Feuerwehr mussten 23 Menschen die Häuser verlassen oder evakuiert werden. Vier Personen mussten mit Verdacht auf eine Rauchgasvergiftung in ärztliche Behandlung. Wie gross der Schaden ist, lässt sich laut Chico noch nicht sagen. «Aber wahrscheinlich sind alle Wohnungen heil geblieben, nur Dach und Keller sind stark beschädigt.» Die Polizei hat eine Ermittlungsgruppe ins Leben gerufen, um den Feuerteufel zu schnappen. Die Beamten werten Spuren aus und befragen Anwohner und Zeugen. Chico unterstützt die Ermittler nach Kräften: «Ich kenne hier in der Umgebung alle. Ich habe sofort meine Bekannten gefragt, ob sie vielleicht Videoaufzeichnungen haben, die den Täter zeigen. Viele Geschäfte haben hier Überwachungskameras.» (noo)"
«Ich schlug dem Messerstecher mit meinem Helm auf den Kopf»: Brasilianer Caio Benicio (43) ist der Held von Dublin,https://www.blick.ch/ausland/ich-schlug-dem-messerstecher-mit-meinem-helm-auf-den-kopf-brasilianer-caio-benicio-43-ist-der-held-von-dublin-id19177619.html,"Fri, 24 Nov 2023 14:36:43 GMT","time.struct_time(tm_year=2023, tm_mon=11, tm_mday=24, tm_hour=14, tm_min=36, tm_sec=43, tm_wday=4, tm_yday=328, tm_isdst=0)","Aus dem Nichts richtete ein Mann in Dublin am Donnerstag ein verstörendes Blutbad an. Er stach in der Nähe des Parnell Square mit einem Messer auf unschuldige Kinder ein. Seitdem befinden sich ein fünfjähriges Mädchen und eine Lehrerin, die dazwischen gehen wollte, in einem sehr ernsten Zustand. Caio Benicio (43), ein Essenlieferant der Firma «Deliveroo», verhinderte, dass bei dem brutalen Angriff noch mehr Menschen verletzt wurden. Der Brasilianer wird jetzt als Held von Dublin gefeiert. Als der Brasilianer die Tat beobachtete, sprang er sofort von seinem Töff und schlug mit seinem Helm auf den Täter ein. Dieser ging zu Boden. «Es war nicht einmal eine Entscheidung, es war einfach purer Instinkt», erzählt der Kurier der Zeitung «Daily Mail». Zuvor hatte er gesehen, wie der Täter das Kind und seine Lehrerin körperlich angriff. Plötzlich habe dieser dann das Messer gezückt. Er hoffe jetzt einfach, dass die Frau und das kleine Mädchen überleben werden. «Ich habe das Mädchen im Krankenwagen gesehen. Sie sah so verletzlich aus. Ich bete für die beiden.» Wenn die beiden Opfer es nicht schaffen, werde er sein Leben lang denken, er hätte etwas besser machen müssen, sagt Benicio. Die Polizei lobte die selbstlose Aktion des Zweifach-Vaters: «Wir müssen den Leuten, die eingeschritten sind, ein grosses Lob aussprechen. Sie haben den Mann so festgesetzt, dass er keine weiteren Menschen verletzen konnte. Ich kann ihnen sagen, dass sie Leben gerettet haben.» In den sozialen Medien tönt es ähnlich: «Dieser Mann muss nie mehr für ein Bier bezahlen», schrieb ein User. Einzelne Restaurantbesitzer versprachen dem Brasilianer lebenslanges Essen in ihrem Restaurant. Benicio kam nach Irland, um zu arbeiten, nachdem sein Restaurant in Brasilien niedergebrannt war. Seine Familie befindet sich noch in Brasilien, und der 43-Jährige hofft, dass sie bald zu ihm ziehen können. Die Nachricht, dass es sich beim Angreifer mutmasslich um einen algerischen Einwanderer handle, verbreitete sich in der Stadt wie ein Lauffeuer und mobilisierte Hunderte von Menschen. Sie randalierten und verwüsteten grosse Teile der Stadt. Die Sicherheitsbehörden machten rechtsextreme Unruhestifter für die Krawalle verantwortlich. Die Einsatzkräfte versuchten die Massen mit einem riesigen Aufgebot unter Kontrolle zu bringen – die Gewaltbereitschaft der Randalierer machte dies aber zu einer grossen Herausforderung. Benicio stimmen die Krawalle nachdenklich: «Es sieht so aus, als würden sie Einwanderer hassen. Nun, ich bin ein Einwanderer und habe getan, was ich konnte, um dieses kleine Mädchen zu retten.» Derweil ist das Motiv des Täters weiterhin unklar. Die Polizei ermittelt in alle Richtungen. «Wir schauen, wie und wann der Mann nach Irland gekommen ist. Die Beamten prüfen auch, ob es zwischen dem Täter und den angegriffenen Personen Verbindungen gibt», sagte ein Polizeisprecher. Offenbar wird auch abgeklärt, ob der Täter, eine «psychotische Episode» erlitten hat. (ene)"
