title,link,published,published_parsed,article_content
Dutzende Tote: Ukrainische Angriffe setzen den Russen zu,https://www.blick.ch/ausland/krieg-in-der-ukraine-die-entwicklungen-des-konflikts-live-im-ticker-id17193095.html,"Fri, 24 Nov 2023 06:00:00 GMT","time.struct_time(tm_year=2023, tm_mon=11, tm_mday=24, tm_hour=6, tm_min=0, tm_sec=0, tm_wday=4, tm_yday=328, tm_isdst=0)","Nach der neuesten Einschätzung des britischen Verteidigungsministeriums geht es den Truppen des russischen Präsidenten Wladimir Putin (71) je länger je mehr an den Kragen. Die russischen Truppen erleiden weiterhin zahlreiche Verluste durch ukrainische Präzisionsangriffe mit grosser Reichweite. So wurden am 10. November offenbar über 70 russische Soldaten bei einem Angriff auf einen Lastwagenkonvoi 23 Kilometer hinter der Frontlinie im Dorf Hladkiwka in der Oblast Cherson getötet. Neun Tage später vermutlich Dutzende weitere. Dabei soll es sich um einen Angriff auf russische Truppen gehandelt haben, die an einer Preisverleihung oder einem Konzert in Kumachove, 60 Kilometer innerhalb des von Russland kontrollierten Gebiets, teilnahmen. Russland hat nach Angaben des Verteidigungsministeriums in Moskau 16 ukrainische Drohnen über dem Süden des Landes und über der annektierten Halbinsel Krim zerstört. In der Nacht zum Freitag sei «ein Versuch des Regimes in Kiew» vereitelt worden, mit Drohnen «einen terroristischen Angriff auf das Territorium der Russischen Föderation zu verüben», erklärte das russische Verteidigungsministerium. Die Luftabwehrsysteme hätten 16 Drohnen zerstört, 13 davon über der Krim und drei über dem Territorium der Region Wolgograd im Süden Russlands, hiess es weiter. Angriffe auf russisches Territorium haben zugenommen Vor dem Hintergrund der im Juni von Kiew gestarteten Gegenoffensive haben ukrainische Angriffe auf russisches Territorium in den vergangenen Monaten zugenommen. Die 2014 von Russland annektierte Halbinsel Krim wird immer wieder ins Visier genommen. Sie ist Sitz der russischen Schwarzmeerflotte und wichtig für die Versorgung der russischen Truppen im Süden und Osten der Ukraine. Im Süden und im Osten der Ukraine sind durch russischen Beschuss erneut mehrere Menschen getötet worden. Alleine aus dem Dorf Tschornobajiwka im Gebiet Cherson meldete die regionale Militärverwaltung am Donnerstag drei Todesopfer und mindestens fünf Verletzte. Die Attacke sei mit Streubomben erfolgt, teilte Verwaltungschef Olexander Prokudin auf Telegram mit. Zudem seien bei einem anderen Angriff zwei Kinder verletzt worden.Im ostukrainischen Gebiet Donezk wurden Behördenangaben zufolge zwei Zivilisten durch Artilleriebeschuss getötet und ein weiterer verletzt. Aus dem benachbarten Gebiet Charkiw wurde ein weiterer Verletzter gemeldet. Insgesamt wurden ukrainischen Militärangaben zufolge innerhalb eines Tages mehr als 110 Orte entlang der Frontlinie und der russischen Grenze beschossen. Angaben aus dem Kriegsgebiet können oft nicht sofort unabhängig überprüft werden. Im umkämpften Gebiet Saporischschja im Süden der Ukraine ist nach Angaben aus Moskau ein Militärkorrespondent des staatlichen russischen Fernsehens durch Beschuss ums Leben gekommen. Den Tod des Korrespondenten Boris Maksudow teilte zuerst der Chef des Aussenausschusses im russischen Parlament, Leonid Sluzki, am Donnerstag auf seinem Telegram-Kanal mit. Maksudow erlag demnach Splitterverletzungen, die er bei Dreharbeiten am Vortag durch eine ukrainische Drohnenattacke erlitten hatte.  Wegen versuchter Brandanschläge gegen Militäreinrichtungen ist ein 17 Jahre alter Schüler in Russland zu sechs Jahren Straflager verurteilt worden.  Weil Jegor Balasejkin vor einigen Monaten aus Protest gegen Russlands Krieg in der Ukraine Molotow-Cocktails gegen die Gebäude von zwei Kreiswehrersatzämtern schmiss, befand das Gericht in St. Petersburg ihn am Mittwoch des «versuchten Terrors» für schuldig. Er leidet an chronischer Lebererkrankung Das harte Vorgehen der Justiz hatte zuvor bereits auch deshalb für Aufsehen gesorgt, weil der damals noch 16-jährige Jugendliche mit seinen Taten im Februar dieses Jahres kaum Schaden angerichtet hatte. In keinem der beiden Fälle brach in den Militäreinrichtungen ein Brand aus. Das Portal «Meduza» berichtete zudem unter Berufung auf die Mutter des Schülers, dass dieser an einer chronischen Lebererkrankung leide. Immer wieder verurteilen russische Gerichte Kriegsgegner zu teils drakonischen Haftstrafen. International gelten die meisten von ihnen als politische Gefangene. (SDA) In einem Interview mit dem amerikanischen Sender Fox News äusserte sich der ukrainische Präsident Wolodimir Selenksi (45) zu möglichen Verhandlungen mit Russland und einem potenziellen Kriegsausgang. Angesprochen auf die Aussage von Donald Trump (77), unter ihm würde ein Friedensplan sofort zustande kommen, antwortete SelenskI: «Ich bin bereit, mit Trump über konkrete Pläne sprechen. Ja, wir könnten den Krieg beenden, wenn wir Russland den Donbass und die Krim geben. aber ich glaube, dass unser Land dafür nicht bereit ist.» Aus ukrainischer Sicht sei dies kein Friedensplan. Selenski beobachte zudem die sich festigenden Beziehungen zwischen Russland, Nordkorea, China und Iran mit Sorge. Es bestünden globale Risiken, in deren Zentrum momentan die Ukraine steht. Die Ukraine soll am 19. November gezielt Raketen auf den Ort Kumachove in der Region Donezk geschossen haben.  Zu der Zeit fand offenbar ein Konzert zu Ehren der Marinesoldaten statt. 25 Soldaten sollen getötet worden sein. Auch die Musikerin Polina Menshih, die zu der Zeit auf der Bühne war, wurde getötet.  Die Ukraine hat weitere 1,5 Milliarden Euro von der Europäischen Union erhalten. «Das hilft uns, die ökonomische Stabilität unter Kriegsbedingungen zu wahren», schrieb Regierungschef Denys Schmyhal am Mittwoch auf Telegram. Insgesamt habe Kiew bereits über 16,5 Milliarden Euro in diesem Jahr von der EU erhalten. Zuvor hatte EU-Kommissionspräsidentin Ursula von der Leyen auf der Online-Plattform X über die Zahlung informiert. Ihren Angaben nach hat Brüssel die Ukraine seit dem russischen Einmarsch vor knapp 21 Monaten mit 85 Milliarden Euro unterstützt.  Von der Leyen stellte weitere Hilfen in Aussicht. Die EU-Kommissionspräsidentin hatte vorgeschlagen, dass der EU-Beitrittskandidat bis Ende 2027 50 Milliarden Euro erhalten solle. In der Ukraine sind seit Russlands Einmarsch vor 21 Monaten laut Angaben der Vereinten Nationen mindestens 10'000 Zivilisten getötet worden – darunter mehr als 560 Kinder. Da viele Leichen noch nicht identifiziert seien, dürfte die tatsächliche Todeszahl jedoch in Wirklichkeit noch «erheblich höher» sein, teilte das Büro des UN-Hochkommissariats für Menschenrechte in Genf am Dienstag mit. Zudem seien mithilfe der vor Ort stationierten Uno-Beobachter bislang mehr als 18'500 verletzte Zivilisten registriert worden.«10 000 getötete Zivilisten sind ein düsterer Meilenstein für die Ukraine», sagte die Leiterin der UN-Mission in der Ukraine, Danielle Bell, laut der Mitteilung. Russlands Angriffskrieg entwickele sich zu einem langwierigen Konflikt, «dessen hohe menschliche Verluste schwer zu begreifen sind». Viele Zivilisten würden weit weg von der Front durch russische Raketen getötet, fügte Bell hinzu - und betonte: «Kein Ort in der Ukraine ist völlig sicher.» Die US-Regierung fürchtet, dass der Iran Russland künftig möglicherweise mit ballistischen Raketen für den Einsatz in der Ukraine beliefern könnte. Als Gegenleistung für diese Unterstützung habe Russland Teheran eine beispiellose Zusammenarbeit im Verteidigungsbereich angeboten, sagte der Kommunikationsdirektor des Nationalen Sicherheitsrats, John Kirby, am Dienstag in Washington. Bei einem Besuch im Iran in September seien Russlands Verteidigungsminister Sergej Schoigu ballistische Raketen gezeigt worden, so Kirby weiter. «Wir sind daher besorgt, dass der Iran erwägt, Russland jetzt mit ballistischen Raketen für den Einsatz in der Ukraine zu versorgen.»Ballistische Raketen sind in der Regel Boden-Boden-Raketen. Sie befördern je nach Bauart unterschiedliche Sprengköpfe - das können etwa konventionelle, biologische, chemische oder sogar atomare Sprengköpfe sein. Angesichts internationaler Sanktionen haben der Iran und Russland ihre Kooperation auf wirtschaftlichem und militärischem Gebiet ausgebaut. Die Islamische Republik unterstützt Moskau nach westlichen Erkenntnissen auch mit sogenannten Kamikaze-Drohnen im Angriffskrieg gegen die Ukraine. Teheran bestreitet dies. Die Ostukraine ist nach Kiewer Angaben in der Nacht zum Dienstag von Russland wieder aus der Luft beschossen worden. Dabei sei das Krankenhaus der frontnahen Stadt Selydowe im Donbass getroffen worden, teilt der ukrainische Generalstab mit.  Nach Angaben von Innenminister Ihor Klymenko wurden dort sechs Zivilisten verletzt. Es sei aber nicht ausgeschlossen, dass unter den Trümmern zweier getroffener Gebäude noch Menschen verschüttet seien.  Im Nachbarort Nowohrodiwka sei ein Bergwerk getroffen worden, schreibt Klymenko auf Telegram. Dort habe es einen Toten gegeben. 39 Bergleute seien zeitweise unter der Erde gefangen gewesen, mittlerweile aber wieder ans Tageslicht gebracht worden.  Den ukrainischen Militärangaben nach setzte die russische Armee bei den Angriffen eine Iskander-Kurzstreckenrakete, elf Shahed-Drohnen iranischer Bauart und drei umfunktionierte S-300-Luftabwehrraketen ein. Die Iskander-Rakete und zehn Drohnen seien abgefangen worden, teilt die ukrainische Luftwaffe mit."
Kamera bei Videokonferenz nicht ausgeschaltet: Stadträtin putzt während Debatte die Fenster,https://www.blick.ch/ausland/kamera-bei-videokonferenz-nicht-ausgeschaltet-stadtraetin-putzt-waehrend-debatte-die-fenster-id19174823.html,"Fri, 24 Nov 2023 05:53:35 GMT","time.struct_time(tm_year=2023, tm_mon=11, tm_mday=24, tm_hour=5, tm_min=53, tm_sec=35, tm_wday=4, tm_yday=328, tm_isdst=0)",
Iran vermittelt Deal mit Hamas: Neben 13 israelischen Geiseln auch 10 Thais und 1 Filipino freigelassen,https://www.blick.ch/ausland/live-ticker-eskalation-zwischen-israel-und-hamas-id19017998.html,"Fri, 24 Nov 2023 05:05:00 GMT","time.struct_time(tm_year=2023, tm_mon=11, tm_mday=24, tm_hour=5, tm_min=5, tm_sec=0, tm_wday=4, tm_yday=328, tm_isdst=0)","Israel hat die Liste der Geiseln erhalten, die am Samstag – dem zweiten Tag des Waffenstillstands – von der Hamas freigelassen werden sollen. Dies teilte das Büro von Premierminister Benjamin Netanyahu mit.Die neue Liste soll Berichten zufolge 13 Namen enthalten, mit mehr Kindern. Nur vier der am Freitag freigelassenen Israelis waren Minderjährige. Seit Freitag sind erste 24 von 240 Geiseln in der Gewalt der Hamas frei. Gleichentags hat Israel erste 39 palästinensische Minderjährige und Frauen aus Gefangenschaft freigelassen. Neben den am Freitag freigelassenen ersten 13 israelischen Geiseln hat die Terrorgruppe Hamas gleichentags auch zehn Thais und einen Filipino freigelassen. Den Deal dazu hatte der Iran vermittelt, wie aus thailändischen Regierungskreisen verlautet. Zuletzt gab es hochrangige Treffen zwischen Bangkok und Teheran. Die Thailänderin Nathavaree Mulkan gehört zu den elf Ausländern, die im Rahmen einer separaten Vereinbarung freigelassen wurden. Sie ist die einzige Frau unter dieser Gruppe an Befreiten.Wie iraelische Medien berichten, sei zuvor fälschlicherweise behauptet worden, dass sie schwanger gewesen und im Hamas-Geiselhaft ein Kind zur Welt gebracht habe. Offenbar befinden sich alle der Freigelassenen in einem guten Gesundheitszustand. Es ist unklar, ob für diesen separaten Deal Geld floss. Doch Thailand und der Iran unterhalten generell freundschaftliche Beziehungen. Wie israelische Medien berichten, wurden die freigelassenen Geiseln am späten Freitagabend per Helikopter in israelische Spitäler gebracht. Dort warten bereits ihre Familien auf sie.  Die Hamas hat am Freitagabend Videos veröffentlicht, die zeigen, wie die Geiseln an das Rote Kreuz übergeben wurden. In dem Video ist zu sehen, wie Hamas-Kämpfer die Geiseln in Transporter der Hilfsorganisation befördern. Einer der Mitglieder hebt einen Jungen in den Transporter. Ein anderer trägt eine Seniorin bis in das Fahrzeug.  Als Hamas-Mitglieder versuchen, zwei Seniorinnen beim Aussteigen aus einem Transporter zu helfen, schlägt eine der Geiseln einem Mitglied die Hand weg. Die zweite Seniorin nimmt die Hilfe an und sagt etwas zum Kämpfer. Was genau, ist unklar. Die Geiseln sehen sichtlich mitgenommen und verwirrt aus. Um sie herum scharen sich zahlreiche Menschen, die die Übergabe filmen.  Das israelische Militär teilte mit, dass 22 der 24 freigelassenen Geiseln zum Luftwaffenstützpunkt Hatzor gebracht wurden. Von dort werden sie per Helikopter an israelische Spitäler verteilt, in welchen ihre Familien warten.  Die restlichen zwei Freigelassenen wurden bereits per Ambulanz ins Spital gebracht. Alle Personen würden sich laut Militärsprecher Daniel Hagari in einem guten gesundheitlichen Zustand befinden.  Bei dem Hamas-Angriff vom 7. Oktober sind zwei Schweizer ums Leben gekommen. Bei beiden handelte es sich laut dem Eidgenössischen Departement für Auswärtige Angelegenheiten (EDA) um schweizerisch-israelische Doppelbürger.Das EDA habe die offizielle Bestätigung für das zweite Todesopfer am Donnerstag erhalten, hiess es am Freitag auf Anfrage der Nachrichtenagentur Keystone-SDA. Aus Daten- und Persönlichkeitsschutzgründen könnten keine weiteren Angaben gemacht werden, teilte das Aussendepartement weiter mit. Die «NZZ» berichtete zuerst darüber. Fünf Tage nach dem Angriff bestätigte Aussenminister Ignazio Cassis das erste Schweizer Todesopfer. Bei dem Mann handle es sich um einen israelisch-schweizerischen Doppelbürger im Alter von fast 70 Jahren. Man wisse nicht viel über den Todesfall. Klar sei aber, dass der Tod des Mannes Folge eines «unglücklichen Zusammentreffens» mit den Terroristen sei. Der Mann habe seit 2004 in Israel gelebt. Seit Beginn der Waffenruhe konnten nach Uno-Angaben einige Hilfsgüter in den Gazastreifen gebracht werden. Seit Freitagfrüh seien 137 LKWs entladen worden, berichtete das Uno-Nothilfebüro OCHA am Abend. Die Bevölkerung sei mit Lebensmitteln, Wasser und medizinischen Gütern versorgt worden, hiess es.Ausserdem seien 129'000 Liter Treibstoff und vier LKW-Ladungen mit Gas angekommen. Laut OCHA handelte es sich um den grössten Hilfskonvoi seit dem 7. Oktober. Das Uno-Büro berichtete auch, dass 21 Patienten in kritischem Zustand aus dem nördlichen Gazastreifen abtransportiert wurden.  Die 39 palästinensischen Frauen und Kinder haben am Freitagabend gegen 18.30 Uhr das Ofer Gefängnis im Westjordanland verlassen. Sie wurden mit Bussen nach Beitunia – ebenso im Westjordanland – gebracht. Dort sollen sie rund eine halbe Stunde später angekommen sein. Marah Bakeer wurde mit 16 wegen eines Messerangriffs auf einen Grenzpolizisten zu 8,5 Jahren Haft verurteilt und gehört zu den Freigelassenen. Zum Sender Al Jazeera sagte sie, dass viele der freigelassenen Gefangenen medizinische Hilfe benötigen. «Alle Gefangenen erlitten während ihrer Haft ein hohes Mass an medizinischer Vernachlässigung», so die inzwischen 24-Jährige.  Bakeer sagt, sie wurde in Isolierung gehealten und hatte «keine Ahnung, was draussen passierte, keine Ahnung von der Situation in Gaza». Dass der Freilassungs-Deal auf den Tod Tausender Palästinenser folgt, mache sie und andere Ex-Häftlinge «unglücklich und unbehaglich».  Bakeer erzählt zudem, dass israelische Beamte ihr gesagt hätten, die freigelassenen Häftlinge dürften weder zelebrieren noch Flaggen hissen – dann würden sie erneut verhaftet werden. Dennoch zeigen Bilder aus dem Westjordanland, dass zahlreiche Palästinenser die Ankunft der freigelassenen Häftlinge zelebieren.  Auch Zeina Abdo wurde freigelassen und erzählt von schrecklichen Zuständen. Sie wurde mit 16 Jahren unter Hausarrest gestellt, später dann ins Ofer-Gefängnis gebracht. Inzwischen ist sie 18. Sie erzählt Al Jazeera, dass auch sie die letzte 49 Tage ihrer Inhaftierung in Isolierung verbrachte. «Sie [die israelischen Beamten] zerstreuten uns, schlugen uns, besprühten uns mit Tränengas und wir wurden alle isoliert. Es war sehr schwierig.»  Die Palästinenserin erzählt weitergehend: «Wir haben die Sonne nicht gesehen … sie haben uns das Essen vorenthalten, es gab keine Matratze oder ähnliches.»  Der israelische Ministerpräsient Benjamin Netanyahu (74) äusserte sich in einer Ansprache über die Freilassung der Geiseln. Er sagte: «Wir haben jetzt die Rückkehr der ersten unserer Entführten abgeschlossen. Kinder, ihre Mütter und andere Frauen. Jeder einzelne von ihnen ist eine ganze Welt.» Gleichzeitig betonte er aber auch, dass die Freilassung nur eines der Kriegsziele sei – und, dass Israel entschlossen sei, «alle Kriegsziele zu erreichen». Wie ZDF berichtet, sollen sich unter den freigelassenen Geiseln Personen mit deutscher Staatsbürgerschaft befinden. «Es ist eine Mutter mit zwei ganz kleinen Kindern», erklärte ZDF-Korrespondent Michael Bewerung. Aussenministerin Annalena Baerbock (Grüne) bestätigte am Freitagabend am Rande des Grünen-Parteitags in Karlsruhe, dass es sich um insgesamt vier deutsche Staatsbürger handelt.  Hunderte Kämpfer der von den USA und der EU als Terrororganisation eingestuften Hamas waren am 7. Oktober nach Israel eingedrungen und hatten Gräueltaten überwiegend an Zivilisten verübt. Israelischen Angaben zufolge wurden etwa 1200 Menschen in Israel getötet und rund 240 Menschen als Geiseln in den Gazastreifen verschleppt. Seitdem greift das israelische Militär massiv Ziele im Gazastreifen an, inzwischen sind auch Bodentruppen in das Palästinensergebiet eingedrungen. Nach Angaben der Hamas, die sich nicht unabhängig überprüfen lassen, wurden bis Montagabend im Gazastreifen etwa 11'240 Menschen getötet. Derzeit ist der Grenzübergang Rafah der einzige Weg, auf dem Lkw mit humanitären Hilfsgütern wie Nahrung, Trinkwasser, Medikamente oder Zelte in den seit Wochen umkämpften und abgeriegelten Gazastreifen gelangen können. Laut dem UN-Büro für die Koordinierung humanitärer Angelegenheiten (Ocha) konnten bislang 981 Lkw Hilfsgüter in den Gazastreifen bringen. Angesichts der 2,4 Millionen Einwohner des Gebiets reichen diese Hilfen bei weitem nicht aus. Ausserdem kommt es an der Grenze zwischen Israel und dem Libanon immer wieder zu Konfrontationen zwischen der israelischen Armee und der libanesischen Hisbollah-Miliz. Auf beiden Seiten gab es bereits Todesopfer. Es ist die schwerste Eskalation seit dem zweiten Libanon-Krieg im Jahr 2006. Israel hat die Hisbollah gewarnt, der libanesischen Hauptstadt Beirut drohe ein ähnliches Schicksal wie Gaza, sollten die Angriffe andauern."
Alleinerziehende Mutter von drei Kindern sieht Russland auf dem falschen Weg: Diese mutige Frau will Präsident Putin herausfordern,https://www.blick.ch/ausland/alleinerziehende-mutter-von-drei-kindern-sieht-russland-auf-dem-falschen-weg-diese-mutige-frau-will-praesident-putin-herausfordern-id19175345.html,"Fri, 24 Nov 2023 01:34:53 GMT","time.struct_time(tm_year=2023, tm_mon=11, tm_mday=24, tm_hour=1, tm_min=34, tm_sec=53, tm_wday=4, tm_yday=328, tm_isdst=0)","Russlands Präsident Wladimir Putin (71) ziert sich noch immer, seine Kandidatur für die im März geplanten Präsidentschaftswahl offiziell bekannt zu geben. Eine Verfassungsänderung erlaubt es Putin, eine weitere Amtszeit anzustreben. Bis 2020 war Russlands Präsidentenamt auf zwei aufeinanderfolgende Amtszeiten limitiert. Nun darf Putin praktisch auf Lebzeiten weiter herrschen. Eine Kandidatur für 2024, so sagte er im September, bestätige er allenfalls nach der offiziellen Ankündigung der Wahl. Jetzt aber stellt sich Putin eine mutige Russin entgegen. Eine krasse Aussenseiterin hat letzte Woche ihre unerschütterliche Absicht angekündigt, es mit dem Kreml-Machthaber aufzunehmen: Jekaterina Dunzowa ist eine 40-jährige alleinerziehende Mutter und Journalistin aus der Region Twer nordwestlich von Moskau. Dunzowa hat auf Telegram ihre Kandidatur für das russische Präsidentenamt angekündigt. Dunzowa schlägt in ihrer Telegram-Erklärung gleich deutliche Töne an, die sie womöglich hinter Gitter bringen können: «Warum habe ich diese Entscheidung getroffen? Ich liebe unser Land», schreibt sie. «Ich möchte, dass Russland ein blühender, demokratischer und friedlicher Staat ist. Aber im Moment bewegt sich unser Land in eine ganz andere Richtung.» Die Mutter von drei Kindern «verstehe, dass viele im Moment abwarten wollen. Aber wir müssen handeln. Versuchen wir es zumindest! Versuchen wir, diese ‹Wahl› zu gewinnen!» Besonders ihre 19-jährige Tochter sei daran interessiert, bei der Kampagne zu helfen. Die Journalistin vertraut darauf, dass ihr Alter, ihr Geschlecht und ihre mangelnde Erfahrung in der Moskauer Politik ihre grössten Stärken sein können. «Wahlen» in Russland, die Dunzowa bewusst in Anführungs- und Schlusszeichen setzt, wurden noch immer von älteren Männern dominiert, die jahrzehntelang im Schatten des Kremls arbeiteten. Die letzte mächtige Frau in Russland? Kaiserin Katharina die Grosse, im 17. Jahrhundert. Dunzowa will demnächst mit Anhängern in Moskau ihre Partei gründen und in verschiedenen Städten des Landes Parteibüros einrichten. Sie macht sich keine Illusionen. Erwartet bereits, dass jeder Oppositionsversuch gegen Putin von den Behörden aufgelöst wird. «Wir wissen sehr wohl, was passieren kann», sagte Dunzowa der «Moscow Times». «Wenn wir nicht in der Lage sind, uns beim ersten Versuch zu versammeln, werden wir es ein zweites Mal versuchen, und so weiter.» Die studierte Juristin deutet an, dass sie auch Russlands Invasion in der benachbarten Ukraine missbilligt. Ihre Worte wägt sie vorsichtig ab, um die strengen russischen Zensurgesetze nicht zu verletzen. Von der Staatsanwaltschaft war sie bereits vorgeladen worden, um über ihre Kampagne und ihre Haltung zu Russlands Vorgehen in der Ukraine zu sprechen. In Russland ist es verboten, die militärische Spezialoperation des Kremls als «Krieg» zu bezeichnen. Lieber spricht Dunzowa daher von «Frieden». Eine erste grosse Hürde, die Dunzowa zu überwinden hat, sind schwierige Wahlgesetze. Sie muss 300'000 Unterschriften aus mindestens 40 Regionen Russlands sammeln und der Wahlbehörde zur Überprüfung vorlegen. Weiter verlangt das russische Wahlrecht, dass eine Kandidatur von einer 500-köpfigen Interessengruppe unterstützt werden muss. Diese hat sich an einem Ort zu versammeln, um einen Kandidaten zu unterstützen. Es gilt als wahrscheinlich, dass die russischen Behörden ein solches Treffen sofort zu verhindern oder aufzulösen versuchen. Dunzowa hofft auf eine neue Bewegung im Land, damit sie Putin bei der Präsidentenwahl 2024 offiziell herausfordern kann."
"Volle Taschen, volle Kassen: Einkaufscenter und Onlineshops im Ausnahmezustand",https://www.blick.ch/wirtschaft/volle-taschen-volle-kassen-einkaufscenter-und-onlineshops-im-ausnahmezustand-id19178624.html,"Fri, 24 Nov 2023 19:54:04 GMT","time.struct_time(tm_year=2023, tm_mon=11, tm_mday=24, tm_hour=19, tm_min=54, tm_sec=4, tm_wday=4, tm_yday=328, tm_isdst=0)","Black Friday ist der Shoppingtag des Jahres. Kurz vor Weihnachten und just bevor der 13. Monatslohn aufs Konto überwiesen wird, sitzt bei vielen das Portemonnaie besonders locker. Bloss: Mit friedlichem Schlendern durch die Einkaufsstrassen, zwischendurch einem Espresso in der Spätherbst-Sonne, ist diesmal nichts. Es zieht, regnet und wird von Stunde zu Stunde immer kälter. Das spüren auch die Läden in den Innenstädten. Weniger gekauft wird nicht. Die meisten bestellen ihre Schnäppchen aber am Bürotisch während der Arbeit. Und machen nach Feierabend einen Abstecher in ein Einkaufszentrum. Im Glattzentrum in Wallisellen ZH findet sich ab 17 Uhr praktisch kein Parkplatz mehr. Das Geschäft brummt. Blick ist vor Ort. Und schaut, wonach den Kunden der Sinn steht. Ein grosses Thema sind Weihnachtsgeschenke. Zwei Damen, wahre Shoppingprofis, öffnen ihre Einkaufstaschen. Irène Känel (73) aus Bassersdorf ZH: «Ich habe ein Pyjama für meinen Gatten gekauft. Er hat im Januar Geburtstag. Darum bekommt er es erst dann», sagt sie und lacht. Ihre Freundin Brigitte van der Meijden (65) aus Wallisellen ZH beglückt ihren Sohn an Weihnachten mit einem kuschligen Pischi. Nico Bonazzola (20) aus Lachen SZ ist ein Charmeur alter Schule. Er strahlt, als Blick ihn auf seine Einkäufe anspricht. Denn er kauft sich nicht etwa hippe Jeans oder trendige Sneakers für sich selbst. Nein, Bastelartikel für den Adventskalender, den er seiner Freundin macht. «Tannenzapfen, Schöggeli und Geschenkpapier. Die restlichen Geschenke hab ich schon.» Sie wird begeistert sein. Garantiert. Auf die kalte Jahreszeit bereiten sich zwei Freundinnen aus dem Tessin vor. Leyla (20) hat für die gemeinsame Wohnung ein weiches Kissen gekauft. Doch sie ist enttäuscht. «Eigentlich hätte ich mehr als nur 20 Prozent Rabatt erwartet», sagt sie. Ihre Freundin Gioia (20) hat ein Weihnachtsgeschenk für ihren Bruder gefunden. Mit ihrem Rabatt ist sie zufrieden: «40 Prozent!» Was das Präsent gekostet hat, will sie nicht verraten. Ebenfalls viel los war am Black Friday bei den Warenhäusern. Bei Loeb aus Bern heisst es etwa: «Wir haben sehr hohe Frequenzen in der Stadt und insbesondere in unseren Warenhäusern. Die Kauflust scheint definitiv da zu sein.» Und bei Manor wollte eine Sprecherin zwar keine konkreten Verkaufszahlen nennen, doch seien die Black Days und die Vorweihnachts- und Weihnachtszeit «sehr wichtig und verkaufsstark». Und die Geschäfte gut gelaufen."
