title,link,published,published_parsed,article_content
Mehr EU-Politik – weniger Klimaschutz: So stimmt der Ständerat,https://www.srf.ch/news/schweiz/wahlen-2023/wahlen-2023-mehr-eu-politik-weniger-klimaschutz-so-stimmt-der-staenderat,"Mon, 20 Nov 2023 20:29:14 +0100","time.struct_time(tm_year=2023, tm_mon=11, tm_mday=20, tm_hour=19, tm_min=29, tm_sec=14, tm_wday=0, tm_yday=324, tm_isdst=0)","Weder Rechts noch Links haben in der kleinen Kammer nun eine klare Mehrheit inne. Entsprechend wird die Mitte in der kommenden Legislatur zum Zünglein an der Waage. Mittelfristig können die neuen Kräfte verstärkt mitreden, wie Politologe Lukas Golder erklärt. «Besonders in den drängenden Themen, wie der Gesundheits- oder Europapolitik, könnten im Ständerat neue Koalitionen möglich werden.» Die Online-Wahlhilfe Smartvote hat untersucht, wie nach den Wahlen die Mehrheitsverhältnisse für konkrete Geschäfte im Ständerat sind. Politikerinnen und Politiker füllen die Online-Wahlhilfe aus, um ihre politische Haltung offenzulegen. Smartvote hat die Antworten der gewählten Ständerätinnen und Ständeräte 2019 und 2023 untersucht. Von den 46 Gewählten haben 5 (2 Mitte, 2 FDP, 1 MCG) die Fragen vor den Wahlen nicht ausgefüllt, bei den meisten sind stille Wahlen der Grund. Die fehlenden Antworten der Mitte- und FDP-Ständeräte hat Smartvote mit der durchschnittlichen Antwort der jeweiligen Partei ersetzt. Mauro Poggia von MCG wurde bei der Auswertung nicht berücksichtigt. Die Schweiz bemüht sich derzeit um neue Verhandlungen mit der EU. Eine Annäherung an Europa ist mit dem frisch gewählten Ständerat durchaus mehrheitsfähig. Gemäss Auswertung wünschen sich 80 Prozent der Ständerätinnen und Ständeräte engeren Beziehungen zur EU. Das sei ein sehr deutlicher Wert, sagt Michael Erne, Projektleiter bei Smartvote. «Nur einzelne Ständeräte aus der Mitte und der SVP sind dagegen. Der Ständerat ist verglichen mit 2019 in aussenpolitischen Fragen offener und liberaler geworden und könnte in diesem Dossier in den kommenden vier Jahren die treibende Kraft sein.» Das zeigt sich auch im klaren Nein von 91 Prozent in der Frage, ob die Schweiz die bilateralen Verträge mit der EU kündigen solle. Vor zwei Monaten liess Gesundheitsminister Alain Berset die Bombe platzen: Um satte 8.7 Prozent steigen die Krankenkassenprämien im kommenden Jahr. Es ist der grösste Anstieg seit 2010 und dürfte viele Haushaltsbudgets stark belasten. Entsprechend erstaunt es wenig, dass die Forderung nach mehr Prämienverbilligung in beiden Kammern mehrheitsfähig ist. Im neuen Ständerat beantworten 56 Prozent der Parlamentarierinnen und Parlamentarier die Frage, ob der Staat mehr Mittel für die Krankenkassenprämienverbilligung zur Verfügung stellen soll, mit Ja. Demgegenüber lehnen 58 Prozent der Befragten den Vorschlag ab, dass sich die Versicherten stärker an den Gesundheitskosten beteiligen sollen. Vor vier Jahren sprach die Schweiz von einer Klimawahl, Umweltthemen gerieten in den Fokus. Nach dem starken Verlust der Grünen und der GLP bei den bisherigen Wahlen zeigt sich nebst dem Nationalrat auch im Ständerat eine veränderte Priorisierung der Klimafrage. Das Thema Umweltschutz werde von vielen Ständerätinnen und Ständeräten als weniger wichtig erachtet, sagt Smartvote-Projektleiter Michael Erne. «Der Sitzverlust der Grünen zeigt sich hier auch in der inhaltlichen Ausrichtung des Ständerats.» Die Zustimmung zu Umweltschutz gehe zurück und Verbote würden vermehrt kritisch aufgefasst.  Anreize statt Verbote seien zielführender, urteilen 71 Prozent der Befragten. Die Frage, ob die Schweiz die Neuzulassung von Personenwagen mit Verbrennungsmotoren ab 2035 verbieten solle, beantworteten 71 Prozent der Ständeräte mit Nein, 69 Prozent wünschen sich einen Ausbau der stark befahrenen Autobahnabschnitte.  Die Gesellschaft wird immer älter und die Lücken im Vorsorgesystem sind durch die im vergangenen Herbst angenommene AHV-Reform noch nicht gestopft. Eine Initiative der Jungfreisinnigen will daher das Rentenalter für Männer und Frauen weiter erhöhen. Diese Idee sei weder im Stände- noch im Nationalrat mehrheitsfähig, so Michael Erne von Smartvote. «Es gibt eine Zweidrittelmehrheit, die dazu Nein sagt. Neben der FDP, die geschlossen dafür ist, sind nur einzelne Parlamentarier aus SVP und Mitte plus auch die GLP dafür. Das reicht in keiner Kammer für eine Mehrheit.» Mitarbeit: Mirjam Spreiter / Rafael von Matt"
Popstar Shakira bekennt sich vor Gericht schuldig,https://www.srf.ch/news/gesellschaft/einigung-im-steuerprozess-popstar-shakira-bekennt-sich-vor-gericht-schuldig,"Mon, 20 Nov 2023 14:49:45 +0100","time.struct_time(tm_year=2023, tm_mon=11, tm_mday=20, tm_hour=13, tm_min=49, tm_sec=45, tm_wday=0, tm_yday=324, tm_isdst=0)","Die 46-Jährige wird aber neben der bereits erfolgten Nachzahlung der Steuern eine Geldstrafe von mehreren Millionen Franken zahlen müssen, die noch im Detail offiziell mitgeteilt werden wird. Die Staatsanwaltschaft wirft Shakira vor, sie habe von 2012 bis 2014 mindestens 183 Tage pro Jahr in Spanien gelebt und hätte daher dort auch Steuern zahlen müssen. Bisher hatte Shakira wiederholt ihre Unschuld beteuert und dem Fiskus sogar «Erpressung» vorgeworfen. Sie hatte immer versichert, sie habe in den fraglichen Jahren ihren Wohnsitz auf den Bahamas gehabt. Und sie habe lediglich ihren damaligen Partner und Fussballstar Gerard Piqué, mit dem sie zwei Kinder hat und von dem sie mittlerweile getrennt ist, wiederholt in Spanien besucht. Erst von 2015 an habe sie dann ständig in Barcelona gelebt. Zudem habe sie alle Steuern plus Zinsen in Gesamthöhe von 17 Millionen Euro inzwischen nachgezahlt. Seit der Trennung von Shakira und Piqué lebt die Popsängerin mit ihren beiden Söhnen Milan (10) und Sasha (8) in Miami."
Beruflicher Neuanfang mit 42,https://www.srf.ch/radio-srf-3/raus-aus-der-midlife-crisis-wenn-die-krise-zur-chance-wird,"Mon, 20 Nov 2023 05:25:09 +0100","time.struct_time(tm_year=2023, tm_mon=11, tm_mday=20, tm_hour=4, tm_min=25, tm_sec=9, tm_wday=0, tm_yday=324, tm_isdst=0)","Mit 42 Jahren ein beruflicher Neuanfang – dafür entschied sich Tabea Käser. Jedoch liessen die Reaktionen aus ihrem Umfeld nicht lange auf sich warten. «Ich wurde gefragt, ob ich jetzt das Gefühl hätte, mich neu erfinden zu müssen», sagt sie. Doch sie liess sich nicht von ihrem Vorhaben abbringen. Vom Detailhandel wechselte sie in die Pflege. Leute, die wie Tabea Käser ab 40 einen Neuanfang wagen, werden oft mit dem Klischee Midlife-Crisis konfrontiert. Aber gibt es die Midlife-Crisis überhaupt? Lange war sie in der Wissenschaft umstritten, sagt Pasqualina Perrig-Chiello, emeritierte Psychologieprofessorin der Universität Bern.  Nichts mit Midlife-Crisis! SRF 3 wird 40 und möchte feiern – mit Euch! Wir haben Geburtstag und ihr das Geschenk: Am 31. Dezember 2023 erwartet Euch die SRF 3-Radio-Silvesterparty. Am DJ-Pult sorgen Matthias Völlm und DJ Zanussi mit Assistent Philippe Gerber für Partystimmung. Und natürlich stossen wir um Mitternacht mit einem Cüpli aufs neue Jahr an. Melde dich hier an. Heute weiss man: Tatsächlich ist die Lebensphase zwischen 40 und 55 Jahren besonders anfällig für Krisen. «Es ist die Zeit der meisten Burnouts, Depressionen und Scheidungen», sagt die Psychologin. Die Lebensmitte ist geprägt von viel Belastung. «Leute über 40 haben hohe Erwartungen im Berufsleben», so Perrig-Chiello. Man habe wenig Zeit für sich selbst. Auch im Privatleben komme es zu einem Wandel. Die Kinder würden erwachsen werden und sich immer mehr ablösen, gleichzeitig würden die eigenen Eltern immer mehr Unterstützung benötigten. Dazu kommen körperliche Veränderungen. Frauen kämen langsam in die Wechseljahre und auch der Hormonhaushalt der Männer verändere sich. «Man ist nicht mehr jung, aber auch noch nicht alt», so die Psychologin. Das belaste Betroffene zusätzlich. Mit der Midlife-Crisis werden meistens Männer in Verbindung gebracht. Aus Filmen und Serien kennt man das Klischee des Mittvierzigers, der plötzlich seine Frau verlässt und sich ein neues, teures Auto kauft. Komplett falsch sei diese Vorstellung nicht: «Eine Lebenskrise im mittleren Alter trifft Männer in der Regel häufiger als Frauen», sagt Pasqualina Perrig-Chiello.  Laut der Psychologin sind Männer im Vergleich zu Frauen weniger konfliktscheu, gleichzeitig sprechen sie Probleme weniger häufig an. «Männer provozieren häufiger einen Bruch», so Perrig-Chiello. Heisst: Sie tendieren eher dazu, abrupte Entscheidungen zu treffen als Frauen. Die einen würden von heute auf morgen ihren Job aufgeben, andere verliessen plötzlich ihre Familie.  Das hänge unter anderem damit zusammen, dass Männer und Frauen tendenziell unterschiedlich kommunizieren. Frauen hätten typischerweise mehrere Ansprechpersonen, mit denen sie über Probleme sprechen würden. Laut der Psychologin behalten Männer eher ihre Probleme für sich, und wenn, dann sprechen sie mit der Partnerin darüber: «Doch wenn das Problem die Partnerschaft betrifft, sind sie hilflos.» Was Menschen in dieser krisenanfälligen Zeit besonders beschäftige, sei die Frage nach dem Sinn. Laut der Psychologin wird einem bewusst, dass das Leben nicht ewig weiter geht. Das Lebenszeitfenster werde kleiner. «Man stellt infrage, was man bisher erreicht hat und was man noch erreichen möchte», so Perrig-Chiello. Für viele Leute komme in dieser Zeit der Wunsch nach einer Veränderung auf.  So ging es auch Tabea Käser. Sie und ihr Mann führten zu dieser Zeit eine Bäckerei mit vier Filialen und sie arbeitete Vollzeit im Detailhandel. Doch ihr wurde klar, dass es Zeit war, für etwas Neues. Als ihre Tochter begann, sich mit dem Thema Berufswahl zu beschäftigten, und Interesse an der Pflege zeigte, wurde Tabea Käser klar: Das ist, was ich will.  Berufswahl kennt kein Alter Kostenlose Standortbestimmung für über 40-Jährige Natürlich sei die Frage aufgekommen, ob sich ein beruflicher Neuanfang ab 40 Jahren überhaupt lohne. Sie kam zum Schluss: «Man ist nie zu alt, etwas Neues anzupacken.» Sie meldete sich für eine Standortbestimmung an, liess sich beraten und entschied sich, eine Ausbildung in der Pflege anzufangen. Tabea Käsers Fall zeigt: Die Krise kann auch eine Chance sein. «Es muss nicht unbedingt zu einer Krise kommen. Die Lust auf Veränderung an sich ist nichts Negatives», sagt die Psychologin. Sie könne einem auch die Chance geben, sich neu zu orientieren und eine Möglichkeit zu finden, um aus der Routine auszubrechen.  Die Krise könne einem helfen, glücklicher zu werden. Perrig-Chiello spricht von der Talsohle des Wohlbefindens: «In der Zeit ab 40 sinkt die Zufriedenheit.» Es sei ein universelles Phänomen, unabhängig von Wohnort, Einkommen oder Geschlecht.  Laut der Psychologin steigt die Zufriedenheit ab 55 Jahren wieder: «Man schafft es, wieder das Gute zu sehen und zu schätzen, was man erlebt hat.» Die meisten Menschen hätten sich dann an die neue Lebensphase angepasst, seien krisenerprobter und gelassener. "
Drei Privatradios müssen Teil der Corona-Gelder zurückbezahlen,https://www.srf.ch/news/schweiz/beschwerden-abgewiesen-drei-privatradios-muessen-teil-der-corona-gelder-zurueckbezahlen,"Mon, 20 Nov 2023 16:18:51 +0100","time.struct_time(tm_year=2023, tm_mon=11, tm_mday=20, tm_hour=15, tm_min=18, tm_sec=51, tm_wday=0, tm_yday=324, tm_isdst=0)","Die drei Aktiengesellschaften, deren Namen aus den anonymisierten Urteilen des Bundesverwaltungsgerichts nicht hervorgehen, hatten vom Bund im Jahr 2020 als Corona-Nothilfe-Gelder den einmaligen Betrag von je 487'128 Franken erhalten.  Das Bakom informierte die Aktiengesellschaften Ende 2020 darüber, dass bei einem Gewinn die Beiträge gekürzt oder zurückbezahlt werden müssten. Die Medienunternehmen kamen auf die Idee, im Geschäftsjahr 2020 je Rückstellungen für die Pensionskassen zu machen. In der Konsequenz schloss die Jahresrechnung der Unternehmen schlechter ab.  Das Bakom akzeptierte dies nicht. Es seien nur Aufwendungen anrechenbar, die tatsächlich entstanden und für «die zweckmässige Erfüllung der Aufgabe unbedingt erforderlich» gewesen seien, begründete das Bakom den Entscheid.  Das Bundesverwaltungsgericht hat diese Sicht bestätigt und alle drei Beschwerden abgewiesen. Die vorgenommene Bildung von Rückstellungen für die Pensionskasse stelle unter den gegebenen Umständen keinen anrechenbaren Aufwand dar, heisst es in den Urteilen. Das Bakom habe die jeweiligen Jahresrechnungen zu Recht um den Betrag der Rückstellungen für die Pensionskassen gekürzt.  Die Abklärungen des Bundesverwaltungsgerichts ergaben bei den Unternehmen, dass die jeweiligen Pensionskassen im Jahr 2020 nie eine Unterdeckung auswiesen. Der Deckungsgrad betrug jeweils 103.9 Prozent.  Aus den Urteilen geht nicht hervor, wie viel die Aktiengesellschaften zurückzahlen müssen. Die Entscheide sind noch nicht rechtskräftig und können an das Bundesgericht weitergezogen werden. "
Washington sendet weitere Militärhilfe nach Kiew,https://www.srf.ch/news/international/krieg-in-der-ukraine-washington-sendet-weitere-militaerhilfe-nach-kiew,"Mon, 20 Nov 2023 21:59:27 +0100","time.struct_time(tm_year=2023, tm_mon=11, tm_mday=20, tm_hour=20, tm_min=59, tm_sec=27, tm_wday=0, tm_yday=324, tm_isdst=0)","Die Informationen zum Ukraine-Krieg sind zahlreich und zum Teil widersprüchlich. Die verlässlichsten Quellen sind eigene Journalistinnen und Reporter anderer Medien vor Ort, denen man vertrauen kann. Weitere wichtige Quellen sind Augenzeugen – also Menschen vor Ort, die Eindrücke vermitteln können. Besonders zu hinterfragen sind Informationen von Kriegsparteien. Denn alle Kriegsparteien machen Propaganda – in diesem Angriffskrieg vor allem die russischen, offiziellen Quellen. Die Aussagen der Kriegsparteien ordnen wir entsprechend ein. Grundsätzlich gilt bei SRF: Je schwieriger und unzuverlässiger die Quellenlage, desto wichtiger ist Transparenz. Umstrittene Fakten und Informationen, die nicht unabhängig überprüfbar sind, werden als solche kenntlich gemacht. Quellen: Agenturen und SRF"
So will das Wallis die neue Jagdverordnung umsetzen,https://www.srf.ch/news/schweiz/34-woelfe-sollen-weg-so-will-das-wallis-die-neue-jagdverordnung-umsetzen,"Mon, 20 Nov 2023 18:11:40 +0100","time.struct_time(tm_year=2023, tm_mon=11, tm_mday=20, tm_hour=17, tm_min=11, tm_sec=40, tm_wday=0, tm_yday=324, tm_isdst=0)","Am 1. Dezember tritt schweizweit die neue Verordnung über die Jagd und den Schutz wildlebender Säugetiere und Vögel, kurz JSV, in Kraft. Im Wallis hat dieser Termin einen grossen Stellenwert, da der Kanton mit der neuen Verordnung mehr Möglichkeiten zur Regulierung von Wolfsbeständen sieht.  Was heisst das konkret? Wölfe, die während der Sömmerung Nutztiere reissen, können auch weiterhin abgeschossen werden.  Hinzu kommt, dass nun auch präventiv ganze Wolfsrudel erlegt werden können. Rudel, die in sogenannten Problemgebieten leben. In diesen Gebieten zeigten Wölfe ein Auffälligkeiten im Verhalten gegenüber Menschen und im Rissverhalten, schreib der Kanton in einer Mitteilung. Im Wallis sei dies bei 7 von insgesamt 13 Rudeln im Kanton der Fall. Für jedes dieser sieben Rudel seien heuer auch Angriffe nachgewiesen.  Die Rudel auf der Abschussliste bestehen aus insgesamt rund 34 Wölfen. Das macht etwa ein Drittel der Population aus, die auf 90 bis 120 Tiere geschätzt wird. In den nächsten Wochen führe der Kanton bereits Massnahmen durch. «Es geht darum, die allgemeine Sicherheit zu gewährleisten und Angriffe auf Schafe und andere Nutztiere in geschützten Situationen zu reduzieren», sagt der zuständige Staatsrat Frédéric Favre. Die Dienststelle für Jagd, Fischerei und Wildtiere (DJFW) des Kantons Wallis hat die Umsetzung der Verordnung vorgezogen, damit sie bereits ab 1. Dezember angewendet werden kann. Denn: Die Wölfe dürfen nur in den zwei Monaten Dezember und Januar präventiv gejagt werden.  Die proaktive Regulierung, also der Abschuss der sieben Rudel, sei aber erst möglich, wenn das Bafu die vom Kanton Wallis gestellten Anträge bewilligt hat. Die Wildhut, die den Wolf eindämmen soll, werde mit dem Abschuss der Rudel stark gefordert sein. Aufgrund ihres Verhaltens und ihrer grossen Reviere, sei es sehr schwierig, Wölfe zu jagen. Jägerinnen und Jäger können sie daher bei der Jagd auf Kleinraubwild und Wildschweine unterstützten. Wenn sie in ihrem bewilligten Gebiet auf einen Wolf treffen, dürfen sie ihn schiessen.  Die Möglichkeit, ganze Wolfsrudel präventiv schiessen zu können, macht sich auch der Kanton St. Gallen zunutze. Wie die Staatskanzlei mitteilt, hat das zuständige Amt beim Bund ein Gesuch eingereicht, das Calfeisental-Rudel entnehmen zu dürfen. Demnach ist das Calfeisental-Rudel «besonders schadstiftend». Im August verfügte das Amt über den Abschuss von drei Welpen, dieser kam bislang nicht zustande. Jetzt ging ein entsprechender Antrag an das Bundesamt für Umwelt Bafu. Das Rudel ist das einzige bekannte ganze Rudel im Kanton St. Gallen. Das Streifgebiet erstreckt sich aber auch in den Kanton Graubünden. Pro Rudel sind es rund zehn spezialisierte Jägerinnen und Jäger, die den Wildhüter unterstützen. Sie gehen zum Beispiel auf Nachteinsätze oder übernehmen Beobachtungsposten. Um den Wildhüter unterstützen zu können, müssen Jägerinnen und Jäger eine halbtägige Schulung besuchen. Der Andrang für diese ist gross. Rund 800 Anmeldungen gibt es.  Alle sieben Rudel mit ihren rund 34 Tieren bereits diesen Winter zu erlegen, sei jedoch nicht realistisch, heisst es beim Kanton. Man sei zufrieden, wenn man 10 bis 12 Tiere schiessen könne, heisst es beim Kanton. Ob das Bafu die Bewilligung zum präventiven Abschuss der Walliser Wölfe erteilt, soll in den nächsten Tagen auskommen."
