title,link,published,published_parsed,article_content
Unfall in Kriegstetten SO: Kollision von drei Autos fordert zwei Verletzte,https://www.blick.ch/schweiz/mittelland/solothurn/unfall-in-kriegstetten-so-kollision-von-drei-autos-fordert-zwei-verletzte-id19156573.html,"Sat, 18 Nov 2023 10:57:37 GMT","time.struct_time(tm_year=2023, tm_mon=11, tm_mday=18, tm_hour=10, tm_min=57, tm_sec=37, tm_wday=5, tm_yday=322, tm_isdst=0)","Eine 30-jährige Automobilistin wollte gegen 21.15 Uhr links in die Autobahneinfahrt der A1 Richtung Bern einbiegen, wie die Solothurner Kantonspolizei am Samstag mitteilte. Aus noch zu klärenden Gründen sei es dabei zu einer seitlich-frontalen Kollision mit einem entgegenkommenden Auto gekommen. Dieses sei gegen ein weiteres Fahrzeug geprallt und auf der Seite liegend zum Stillstand gekommen. Die beiden Insassen des umgekippten Autos hätten mittelschwere Verletzungen erlitten. (SDA)"
In Appenzell Ausserrhoden sollen 20 Gemeinden zu einer Handvoll zusammenschmelzen: Was bringen Gemeinde-Fusionen eigentlich?,https://www.blick.ch/gesellschaft/in-appenzell-ausserrhoden-sollen-20-gemeinden-zu-einer-handvoll-zusammenschmelzen-was-bringen-gemeinde-fusionen-eigentlich-id19155019.html,"Sat, 18 Nov 2023 10:43:20 GMT","time.struct_time(tm_year=2023, tm_mon=11, tm_mday=18, tm_hour=10, tm_min=43, tm_sec=20, tm_wday=5, tm_yday=322, tm_isdst=0)","«Saarebizgi», verflucht Josef (78) das abgebrochene Zündhölzli. Er steht in Urnäsch AR neben seinem Auto und will sich die Pfeife anzuzünden. Es ratscht und faucht, schon glimmt es wieder vor seinem Bart. Josef war hier in der Gegend an einer «Stobede», zu Besuch bei Freunden. Znacht und ein bisschen «zäuerlen», das ist der traditionelle Appenzeller Naturjodel.  In Urnäsch, im südlichsten Zipfel Ausserrhodens, ist es um zehn Uhr abends wie ausgestorben. Dicker Nebel kriecht über die Hügel, ein paar Strassenlaternen beleuchten den Dorfplatz. Ob er schon abgestimmt habe? Josef seufzt. Hier im Appenzellerland gebe es ein Sprichwort, antwortet er, jedes Wort herber, kratziger Pfeifenrauch. «Wenns nüd am Holz ischt, gets ke Pfiiffe.» – Wozu man nicht geboren ist, das kann man auch nicht werden.  Allein oder gemeinsam, das fragt sich der malerische Halbkanton zwischen Säntis und Bodensee gerade. Am 26. November stimmt Ausserrhoden ab, ob aus 20 Gemeinden drei bis fünf werden sollen. 1. Variante – der Gegenvorschlag: Die 20 Gemeinden Ausserrhodens werden zu drei bis fünf fusioniert. Als Orientierung dienen die historischen Bezirke Vorderland, Mittelland und Hinterland.  2. Variante – die Eventualvorlage: Der Kanton soll Fusionen fördern, sie sollen aber freiwillig bleiben. Die Namen der Gemeinden sollen aus der Verfassung gestrichen werden, damit nicht für jede Fusion eine Verfassungsänderung nötig ist. 1. Variante – der Gegenvorschlag: Die 20 Gemeinden Ausserrhodens werden zu drei bis fünf fusioniert. Als Orientierung dienen die historischen Bezirke Vorderland, Mittelland und Hinterland.  2. Variante – die Eventualvorlage: Der Kanton soll Fusionen fördern, sie sollen aber freiwillig bleiben. Die Namen der Gemeinden sollen aus der Verfassung gestrichen werden, damit nicht für jede Fusion eine Verfassungsänderung nötig ist. Ausgerechnet hier, wo Tradition noch gelebt wird und sich das rote Appezöller Bähnli durch eine prototypisch schweizerische Modelllandschaft schlängelt. Wo der Stolz auf die eigene Gemeinde an beiden Ufern der Sitter spürbar ist. Mitten im Kanton St. Gallen, und doch eine Welt für sich.  Es wäre eine der grössten Gebietsreformen, die ein Kanton je durchgeführt hat – und die wichtigste Abstimmung des Kantons seit Abschaffung der Landsgemeinde 1997. Die Regierung empfiehlt, die neue Struktur anzunehmen. Wie diese genau aussehen soll, ist noch unklar. Möglicherweise spielen die drei historischen Regionen Vorder-, Mittel- und Hinterland eine Rolle. Ein paar Stunden zuvor, drei Appenzellerinnen sitzen an einem Tisch. «Es ist höchste Zeit für eine Fusion», meint die erste. «Alles wird teurer, vielleicht können wir mit grösseren Gemeinden ja sparen.» «Schon», stimmt die zweite zu, «aber bloss nicht mit drei bis fünf Gemeinden, dann wird das reiche Mittelland viel zu mächtig.» Die dritte Frau sagt resigniert: «Ach, egal wie abgestimmt wird – die Konsequenzen sehen wir sowieso erst in ein paar Jahren.»  Es ist Bauernmarkt in Heiden im nördlichen Ausserrhoden, wie jeden Samstagmorgen von Juni bis November. Regionale Betriebe verkaufen Gemüse, Brot, Würste und Lismete. Der Blick reicht weit über den Bodensee. Im Kirchgemeindehaus nebenan wärmen sich die Dorfbewohnerinnen auf. Ihr Halbkanton ist durch das Gegenteil einer Fusion entstanden: 1597 spaltete sich das Appenzellerland in ein reformiertes Ausserrhoden und ein katholisches Innerrhoden.  Seit 20 Jahren gibt es das «Häädler Marktkafi», wo alle wieder einmal zusammenkommen. «Heiden ist mit seinem Bahnhöfli ein echtes Bijou, lassen wir es doch, wie es ist», sagt eine der Frauen. Ihre Sitznachbarin widerspricht: «Veränderung ist nicht immer schlecht. Wisst ihr noch früher, als es nur in den Wohnzimmern geheizt war, und wir überall sonst im Haus ganz dicke Socken tragen mussten?» Die Dritte muss lachen: «Stimmt!» Sie singt: «Eisblumen blühen am Fenster.»  Der Mann, der das alles in die Wege geleitet hat, trinkt Milchkaffee und wählt seine Worte sorgfältig. Lokale Zeitungen bezeichnen Roger Sträuli (62) als «Fusionsturbo». Er sitzt in einem Gasthaus in der Gemeinde Rehetobel, für die er während zwei Amtsperioden im Kantonsrat war. Schon seit 13 Jahren will Sträuli in Ausserrhoden Grenzen verschieben – geografisch, aber auch in den Köpfen seiner Mitmenschen. Einigen Gemeinden gehe es gut, andere seien schlechter dran, sagt Sträuli, der sich selbst als eher liberal beschreibt. «Nur wenn wir uns zusammenschliessen, können wir einander und anderen Kantonen wieder auf Augenhöhe begegnen.» 2010 reichte er deshalb ein Postulat ein, das die Gemeindestrukturen analysieren soll. Das Ergebnis: Es besteht Handlungsbedarf. Trotzdem passierte nur wenig, also gründete er 2014 die IG «Starkes Ausserrhoden», die sich für wirksamere Strukturen einsetzt und die Reform ins Rollen gebracht hat. Die Gemeinden müssen immer mehr und komplexere Aufgaben erledigen. Sie zweckmässig zu erfüllen, werde schwieriger, sagt Sträuli. Für die Behörde lassen sich deshalb oft keine Kandidatinnen und Kandidaten mehr finden, auch Stellen in der Verwaltung bleiben immer häufiger vakant.  Sträulis Lösung: weniger, dafür grössere Gemeinden. Aus zahlreichen Verwaltungsjobs mit niedrigen Pensen würden so attraktive und vollwertige Stellen geschaffen. So könne auch das Milizsystem, das an seine Grenzen stösst, professionalisiert werden. «Der schwierige Spagat zwischen Beruf und freiwilliger Gemeinderatstätigkeit wird so nicht mehr nötig sein.»  Stich für Stich flickt Mirjam Seitz das Loch. Ihre Nähmaschine rattert im Kirchgemeindehaus Heiden über eine Jeans. Seitz ist Mitte 40 und hat vor kurzem die «Häädler Nähstube» aufgemacht. Die Schneiderin und Bildhauerin kommt eigentlich aus Nürnberg (D) und ist vor zwölf Jahren in die Region gezogen.  Die Appenzeller Natur sei wunderschön, sagt sie. Das Einleben dauerte jedoch seine Zeit. «Die Leute sind sehr nett, doch sind sie sich neue Menschen von ausserhalb noch nicht so gewohnt.» Ihr Traum: eines Tages Ausstellungen oder kleine Konzerte in ihrem Atelier organisieren zu können, mehr Leben reinbringen. Momentan fehlt ihr als Alleinerziehende die Zeit. «Aber wer weiss!» Sie glaubt an den Fortschritt hier in Ausserrhoden.  Am Horizont glüht der Hohe Kasten. Das Posti keucht den Hang hinauf, der Kirchturm von Stein schlägt halb fünf. Einige der Appenzeller Dörfer glänzen in goldenem Licht, über andere hat sich bereits der Schatten gelegt. «Jede Gemeinde hat ihre Stärken und Schwächen», sagt FDP-Kantonsrat Marcel Walker (50). Er steht auf dem Wasserreservoir, dem höchsten Punkt seiner Wohngemeinde Stein. Sie gehört knapp nicht mehr zum Mittelland mit Teufen, sondern zum Hinterland.  Walker schätzt die Appenzeller Mentalität, entschlossen und eigenständig. «Trotzdem sind wir füreinander da.» In seiner Gemeinde gibt es einen Whatsapp-Chat, «Stein teilt». Wer eine Schneeschaufel oder einen Rasenmäher braucht, fragt zuerst sein Dorf.  Dass die Mega-Fusion sinnvoll ist, bezweifelt er. So stünden die Gemeinden vor unterschiedlichen Herausforderungen. Entsprechend divers müssen auch die Instrumente der Lösungsfindung sein, fordert Walker. «Wir brauchen mehrere Optionen, wie in einem Werkzeugkasten. Nicht nur die Zwangsfusion.»  Deshalb ist Walker Co-Autor der Eventualvorlage. Der zweiten Variante, die am 26. November zur Abstimmung vorliegt: Gemeindefusionen sollen damit vereinfacht, aber nicht erzwungen werden.  Dass ein Kanton wie Ausserrhoden einen Fusionszwang einführen wolle, kann Walker nicht verstehen. «Fusionsturbo» Sträuli hat hingegen ein ganz anderes Verständnis von Demokratie: «Nur die Variante mit drei bis fünf Gemeinden garantiert, dass alle berücksichtigt werden können.» Ansonsten sei ein Wunschkonzert vorprogrammiert. «Das ist gefährlich», so Sträuli. Die finanz- und strukturschwachen Gemeinden blieben auf der Strecke, die Eventualvorlage verstärke bloss die Ungleichheiten. «Es geht nur mit- statt gegeneinander.» Auch dass die neuen Gemeindestrukturen noch nicht klar definiert sind, wecke Misstrauen, ist sich Walker sicher. Sträuli hält dagegen: Dass die Struktur noch offen ist, sei Absicht. Erst nach der Abstimmung müssen sich alle Gemeinden an einem runden Tisch versammeln, um über die künftigen Strukturen zu entscheiden. Gemeinsam.  Ganz klar: Die Schweiz liebt Fusionen. Seit 1850 ist die Anzahl Gemeinden von 3205 auf 2136 geschrumpft – also um ein Drittel. Die Auswirkungen hat Christoph Schaltegger (51) untersucht. Er ist Professor und Direktor am Institut für Schweizer Wirtschaftspolitik (IWP) an der Universität Luzern. In einem Forschungsprojekt der Universität St. Gallen analysierte er 142 Gemeindefusionen aus zehn Kantonen zwischen 2001 und 2014. Seine Studie zeigte 2017: Der erhoffte positive Effekt bleibt oft aus. «Es gibt natürlich Fälle, in denen es sinnvoll ist», sagt Schaltegger. Zum Beispiel, wenn der Wille zur Autonomie nicht mehr gegeben ist. Vielfach seien die Einwohner jedoch mit falschen Versprechen geködert worden.  Ein Fusionsprozess sei meist viel komplizierter als erwartet, erklärt Schaltegger. Die Kosten würden langfristig nicht sinken: Die behaupteten Synergien liessen sich kaum realisieren, da die Stückkosten in Realität nicht sänken, je grösser die Gemeinde werde. Oft fehle auch der politische Mut, die entstehende Doppelspurigkeit abzubauen.  Dass Fusionsskeptiker häufig als «Ewiggestrige» bezeichnet werden, überrascht Schaltegger: «Das ist keine Diskussion zwischen konservativ und modern.» So spiele zum Beispiel Freiwilligenarbeit in fast allen Dörfern eine grosse Rolle. «Das sind wichtige Strukturen, die über Generationen gewachsen sind.» Schalteggers Studie zeigt: Nach der Fusion sinkt oft der Wille, sich für die eigene Gemeinde einzusetzen.  Für eine erfolgreiche Fusion ist es für ihn deshalb entscheidend, dass sie «von unten reift», also von der betroffenen Gemeinde selbst initiiert wird. Viel wichtiger als eine Fusion sei es, die Zweckverbände zwischen den Gemeinden zu stärken.  Roger Sträuli blickt in Rehetobel aus dem Fenster über die sanfte Hügellandschaft. Für das Studium verliess er die Region in Richtung Westschweiz. Dort packte ihn das Heimweh: «Ich vermisste die Landschaft, ihre Leute und vor allem meinen Turnverein.» Er kehrte zurück, um zu bleiben. Dass das Gemeindeleben unter der Fusion leiden würde, glaubt Sträuli nicht. Schon heute sind die Ausserrhoder Dörfer eng miteinander verwoben. «Die Identität ist geprägt vom vielfältigen Vereinsleben, dessen Mitglieder schon längst nicht mehr alle aus dem Dorf selbst stammen.» Vielen Vereinen sei es gelungen, zukunftsfähige Strukturen zu schaffen. Wie in Rehetobel, wo sich die turnenden Vereine zu einem Sportverein zusammengeschlossen haben. So sei Identität immer menschengemacht, meint Sträuli. «Was mit dem Dorfleben in den Gemeinden passiert, steht und fällt immer mit dem Engagement ihrer Bevölkerung.» Auf dem Dorfplatz in Urnäsch nimmt Josef noch einen Zug und setzt sich dann mitsamt glimmender Pfeife ins Auto. In seinem Dorf gibt es eine schöne Linde, sagt er durch das offene Fenster. Schon als kleiner Bub habe er gewusst: Unter ihr werde er einmal beerdigt. Er knurrt: «Hoffen wir, dass ich da liege, bevor meine Postleitzahl verschwunden ist.» Kein Winken, nicht mal ein Kopfnicken. Und schon ist sein Auto im Nebel verschwunden."
Unfall in Kaisten AG: Autofahrer weicht Tier aus – und landet im Graben,https://www.blick.ch/schweiz/mittelland/aargau/unfall-in-kaisten-ag-autofahrer-weicht-tier-aus-und-landet-im-graben-id19156357.html,"Sat, 18 Nov 2023 09:28:15 GMT","time.struct_time(tm_year=2023, tm_mon=11, tm_mday=18, tm_hour=9, tm_min=28, tm_sec=15, tm_wday=5, tm_yday=322, tm_isdst=0)","Dem Polizeieinsatz vorausgegangen war ein Notruf gegen 22.40 Uhr, wie die Aargauer Kantonspolizei am Samstag mitteilte. Die Einsatzkräfte hätten das Auto im Gebiet Hardwald neben der Hauptstrasse in einem Graben vorgefunden. Alle Insassen des Personenwagens hätten sich ausserhalb des Fahrzeuges befunden, schrieb die Polizei weiter. Gemäss ersten Aussagen musste der 19-jährige Autolenker einem Tier ausweichen und geriet daher mit seinem Fahrzeug in den Graben. Verletzt wurde beim Unfall niemand. Am Fahrzeug entstand erheblicher Sachschaden. (SDA)"
Feuer-Alarm in Amsteg UR: Mehrfamilienhaus wegen Küchenbrand evakuiert,https://www.blick.ch/schweiz/zentralschweiz/uri/feuer-alarm-in-amsteg-ur-mehrfamilienhaus-wegen-kuechenbrand-evakuiert-id19156024.html,"Sat, 18 Nov 2023 08:48:20 GMT","time.struct_time(tm_year=2023, tm_mon=11, tm_mday=18, tm_hour=8, tm_min=48, tm_sec=20, tm_wday=5, tm_yday=322, tm_isdst=0)","Die Brandmeldung ging gegen 1.30 Uhr ein, wie die Kantonspolizei Uri mitteilte. Der Küchenbrand konnte demnach zwar rasch gelöscht werden, allerdings nicht, bevor das Feuer auf weitere Gebäudeteile übergriff. Die Einsatzkräfte befanden sich zurzeit der Mitteilung wegen immer wieder aufkommenden Glutnestern und starker Rauchbildung noch vor Ort. Die Gotthardstrasse durch Amsteg war bis auf weiteres gesperrt. (SDA)"
Rekord-Preis bei Versteigerung: Diese Flasche Whiskey ist Millionen Wert,https://www.blick.ch/ausland/rekord-preis-bei-versteigerung-diese-flasche-whiskey-ist-millionen-wert-id19158008.html,"Sat, 18 Nov 2023 20:52:03 GMT","time.struct_time(tm_year=2023, tm_mon=11, tm_mday=18, tm_hour=20, tm_min=52, tm_sec=3, tm_wday=5, tm_yday=322, tm_isdst=0)","Ein fast 100 Jahre alter schottischer Whisky hat bei einer Auktion in London einen Weltrekordpreis erzielt: Mehr als 2,1 Millionen Pfund erlöste die Flasche des «The Macallan 1926 Adami» am Samstag, wie das Auktionshaus Sotheby's mitteilte. Exakt 2'187'500 Pfund (umgerechnet knapp 2,3 Millionen Franken) kostete der Whisky der Macallan-Brennerei aus der Region Speyside – der Schätzpreis lag bei lediglich 750'000 bis 1,2 Millionen Pfund. Mit der Auktionssumme wurde der Rekord vom Herbst 2019 deutlich übertroffen. Damals war eine 0,75-Liter-Flasche «The Macallan 1926 Fine and Rare» für knapp 1,5 Millionen Pfund versteigert worden. Die Rekord-Whiskys stammen aus einem legendären Vorrat: 1986 wurden insgesamt 40 Flaschen von einem Fass abgefüllt. Davon tragen 14 das «Fine and Rare»-Etikett sowie 12 weitere ein Etikett, das der italienische Maler Valerio Adami 1993 gestaltete. Die nun angebotene Flasche sei zudem die Erste, die von der Macallan-Brennerei aufbereitet wurde, erklärte Sotheby's. Sowohl die Kapsel als auch der Korken seien ausgetauscht worden. Ausserdem sei neuer Kleber auf die Ecken des Etiketts aufgetragen worden. Schliesslich wurde eine Probe von einem Milliliter entnommen, um den Whisky mit einer anderen Flasche von 1926 zu vergleichen. (SDA)"
"«Bitte sag meinen Eltern, dass ich sie liebe!»: Jungpilot (†21) stürzt bei schlechtem Wetter in den Tod",https://www.blick.ch/ausland/bitte-sag-meinen-eltern-dass-ich-sie-liebe-jungpilot-21-stuerzt-bei-schlechtem-wetter-in-den-tod-id19157868.html,"Sat, 18 Nov 2023 18:57:14 GMT","time.struct_time(tm_year=2023, tm_mon=11, tm_mday=18, tm_hour=18, tm_min=57, tm_sec=14, tm_wday=5, tm_yday=322, tm_isdst=0)","Es sind die herzzerreissenden Worte eines jungen Piloten in Florida, der wegen «Problemen mit der Steuerung» den Tower von Gainesville verzweifelt um Hilfe bat. Wegen schlechter Sicht konnte Adrien V.* (†21) keinen Landeplatz für seine einmotorige Maschine finden. Er fragte den Fluglotsen, ob er auf- oder absteigen oder nach links oder rechts fliegen solle, und gab an, dass seine Instrumente im Cockpit keine klare Anzeige lieferten. Als er realisierte, dass er dem Tod geweiht war, hatte er eine Bitte an den Fluglotsen: «Bitte sag meinen Eltern, dass ich sie liebe!» Dann brach der Kontakt ab. Laut des Vorbesitzers des Flugzeugs, David N.*, besass der 21-Jährige seit Mai 2021 seinen Pilotenschein und hatte ihm im Oktober die Cherokee Piper 180 abgekauft. Der TV-Sender WUFT meldete, dass V. am Dienstag gegen 12:45 Uhr vom Kissimmee Gateway Airport abgehoben war. Die viersitzige Maschine war bei Regenwetter und Nebel fast 160 Kilometer in Richtung Gainesville geflogen, als sie an Höhe verlor und bis unterhalb 300 Meter sank. Laut der Flugsicherheitsbehörde meldete der Pilot gegen 13:38 Uhr Probleme und sagte dem Tower: «Ich glaube nicht, dass ich meine Höhe halten kann – wie weit ist es noch bis Gainesville?» Gegen 14 Uhr zeigte der Flugradar, dass Valentine mehrere scharfe Kurven flog und noch einmal bis auf 2100 Meter hochstieg. Dann meldete der Jungpilot dem Fluglotsen, dass er bei den schlechten Sichtverhältnissen seine Orientierung verloren hatte und seine Instrumente im Cockpit ihn im Stich liessen: «Ich verliere an Höhe.» Es folgte seine letzte Nachricht an seine Eltern.  Die US-Flugbehörde, die Federal Aviation Administration (FAA), untersucht jetzt die genauen Umstände vom Absturz. Laut der letzten Messung des Flugradars flog die Maschine zuletzt mit 500 Km/h – mehr als doppelt so schnell wie die mögliche Höchstgeschwindigkeit. Was laut FAA bedeutete, dass die Piper Cherokee in den letzten Sekunden im Sturzflug senkrecht auf den Boden gekracht war. Ein Rettungsteam entdeckte das Wrack im abgelegenen Paynes Prairie Reserve State Park erst drei Stunden nach dem Absturz. Art Forgey, Sprecher des Alachua Sheriffs Departments: «Wir haben die Leiche des Piloten geborgen, es war niemand anderes mit an Bord.» In der Todesanzeige schrieben die Eltern des Piloten, dass ihr Sohn Adrien bei der Sache ums Leben gekommen ist, «die er am meisten geliebt hat: Fliegen». (jmh)  * Namen bekannt"
JN.1  ist noch ansteckender: Forscher warnen vor «hinterlistiger» Corona-Variante,https://www.blick.ch/ausland/jn-1-ist-noch-ansteckender-forscher-warnen-vor-hinterlistiger-corona-variante-id19157684.html,"Sat, 18 Nov 2023 18:26:12 GMT","time.struct_time(tm_year=2023, tm_mon=11, tm_mday=18, tm_hour=18, tm_min=26, tm_sec=12, tm_wday=5, tm_yday=322, tm_isdst=0)","Auch wenn das Coronavirus bei den meisten nicht mehr Gesprächsthema Nummer eins ist, so beobachten Forscher den Erreger nach wie vor mit Argusaugen. Denn: Das Virus mutiert permanent. Nach Eris (EG.5) und Pirola (BA.2.86) sorgt jetzt die Variante JN.1 in Forscherkreisen für Aufsehen. Bei JN.1 handelt es sich um einen Abkömmling von Pirola. Entdeckt wurde die Variante vom Infektiologen Thomas Russo von der Buffalo-Universität in New York.  Laut Russo ist die Mutation extrem ansteckend und verfügt über eine Vielzahl von Veränderungen am Spike-Protein. Das war bereits bei Pirola der Fall. JN.1 toppt das aber anscheinend nochmals, was die Variante noch ansteckender macht. Das führt dazu, dass das Virus schneller als bisher in die Zellen eindringen kann. Für den Körper ist das besonders kräftezehrend. Deswegen bezeichnet Russo die Variante im US-Gesundheitsmagazin «Prevention» auch als «hinterlistig». Wegen der vielen Mutationen des Coronavirus braucht der Körper länger für seine Immunantwort. Zusammengefasst heisst das, dass man wegen JN.1 nicht nur schneller krank wird, sondern es auch länger bleibt. Über neue Symptome der Variante ist derzeit aber noch nichts bekannt. Und wie sieht es eigentlich bezüglich der Corona-Impfung aus? Schützt die noch vor der Mutation? Ja, sind sich die Experten der amerikanischen Gesundheitsbehörde CDC sicher. Daten hätten gezeigt, dass die aktuellen Impfstoffe dem Immunsystem helfen, Pirola zu blockieren. Deshalb geht die Behörde davon aus, dass dies auch bei JN.1 als Subvariante der Fall ist. Erst diese Woche wurde bekannt, dass Forscherinnen und Forscher der Eidgenössischen Technischen Hochschule Lausanne (EPFL) eine Ansteckungstaktik vom Coronavirus aufdecken konnten. Die im Fachblatt «Nature Communications» veröffentlichte Studie konzentrierte sich auf das Spike-Protein des Virus, das den Eintritt in menschliche Zellen ermöglicht, wie die EPFL am Mittwoch mitteilte. Das Virus übernimmt die Kontrolle über ein Enzym namens ZDHHC20. Dieses Enzym markiert Proteine, auch das Spike-Protein des Coronavirus, mit kleinen Fettmolekülen. Dies ist entscheidend, damit das Virus mit seinen Zielzellen verschmelzen kann. Diese Entdeckung könnte schlussendlich helfen, effektivere Behandlungen gegen das Coronavirus zu entwickeln, hiess es von der EPFL. Ausserdem vermuten die Forschenden, dass auch andere Viren diese Taktik anwenden, um ansteckender zu werden. (ced/SDA)"
