title,link,published,published_parsed,article_content
Hochbetrieb bei Interdiscount: Fünffacher Umsatz während Black Friday,https://www.blick.ch/wirtschaft/hochbetrieb-bei-interdiscount-fuenffacher-umsatz-waehrend-black-friday-id19178164.html,"Fri, 24 Nov 2023 19:00:34 GMT","time.struct_time(tm_year=2023, tm_mon=11, tm_mday=24, tm_hour=19, tm_min=0, tm_sec=34, tm_wday=4, tm_yday=328, tm_isdst=0)","«Während des Black Friday sind wir 24 Stunden besetzt», sagt Daniel Augustin (46). Der Marketingleiter am Interdiscount-Hauptsitz im bernischen Jegenstorf zeigt stolz das «Mission Control Center», das der Elektrofachhändler extra für den Black Friday aufgebaut hat. «Hier sitzen an diesem Tag sämtliche Bereichsleiter im Schichtbetrieb und koordinieren den Tag. So können sie schnell reagieren, wenn ein Produkt online nicht mehr angezeigt wird.» Für Interdiscount ist der Black Friday der wichtigste Tag im Jahr. «Während dieser Woche verfünffachen wir jeweils unseren Umsatz im Vergleich zu normalen Tagen», sagt Salome Balmer (29), Mediensprecherin von Interdiscount. Wie viel Interdiscount an diesem Tag konkret einnimmt, verrät sie aber nicht – Geschäftsgeheimnis. Wie lukrativ der Tag ist, zeigt sich im Lager. Überall fahren Lageristen Fernseher, Laptops und sonstige Elektrogeräte in hohem Tempo von A nach B. «Für diesen Tag haben wir die Belegschaft durch Temporär-Angestellte verdoppelt», erklärt der Logistik-Chef Georges Notz (62). Vom Hauptsitz in Jegenstorf werden sowohl Filialen und Privatkunden beliefert. Die Bestellungen werden online registriert und laufen grösstenteils automatisiert übers Förderband.  Die Mitarbeiter kontrollieren an verschiedenen Stationen, dass die Lieferungen stimmen. Es ist harte Akkordarbeit an diesem Freitag. Den Effort aller Mitarbeiter schätzten auch die Kunden. Notz: «Am besten verkaufen sich am Black Friday Fernseher, Laptops, Smartphones und Gaming-Artikel.»"
Benko stellt Antrag auf Konkurs: Deutsche Tochter der Signa Prime ist insolvent,https://www.blick.ch/wirtschaft/benko-stellt-antrag-auf-konkurs-deutsche-tochter-der-signa-prime-ist-insolvent-id19178358.html,"Fri, 24 Nov 2023 17:27:46 GMT","time.struct_time(tm_year=2023, tm_mon=11, tm_mday=24, tm_hour=17, tm_min=27, tm_sec=46, tm_wday=4, tm_yday=328, tm_isdst=0)","Es trifft damit eine Deutschlandtochter der Signa Prime Selection, in der Firmengründer René Benko seine wertvollen Bestandsimmobilien gesammelt hat. Die österreichische Presseagentur APA hat in der Folge bei der Signa und beim Büro des Signa-Sanierers Arndt Geiwitz um Stellungnahmen angefragt. Kurzfristig gab es aber noch keine offiziellen Informationen. Schon zuvor zeigte sich anhand von Medienberichten, dass sich die Finanzlage der Signa-Gruppe des Tiroler Investors René Benko offenbar weiter zuspitzt. Das deutsche Nachrichtenmagazin «Spiegel» berichtete online unter Verweis auf Insider, dass die Situation bei der Signa Holding sowie den Töchtern Prime und Development «so kritisch» sei, dass «Insolvenzanträge vorbereitet» würden – einen ersten Antrag gab es dann eben auch noch am Freitagnachmittag, schrieb das Magazin. Ein Signa-Sprecher hatte noch vor Bekanntwerden der noch nicht offiziell bestätigten ersten Insolvenz im Signa-Reich gegenüber «Spiegel» und «News» gesagt, dass es keine neue Sachlage gebe und man Gespräche mit potenziellen Finanzierungspartnern führe. Laut dem österreichischen Nachrichtenmagazin «News» (Online-Ausgabe) soll sich die Motivation der aktuellen Signa-Mitgesellschafter und -Investoren in engen Grenzen halten, der verschachtelten Firmengruppe noch frisches Geld zur Verfügung zu stellen. Vielen sei missfallen, dass Firmengründer Benko nicht auf ihre Forderung eingegangen sei, sich komplett aus der Signa zurückzuziehen und seine Stimmrechte an den deutschen Sanierer Arndt Geiwitz zu übergeben. Über die nächsten Schritte berate nun der Aufsichtsrat der Signa Prime Selection, berichtet die deutsche «WirtschaftsWoche» (online). Signa reagierte vorerst nicht auf eine schriftliche APA-Anfrage. «Der Standard» (online) aus Österreich schrieb weiter, dass in der Signa für Dienstag eine Art Mitarbeiterversammlung geplant sei, in der über die Finanzlage und weitere Schritte informiert werde. Wie bereits berichtet, ist Ende November laut dem deutschen «Handelsblatt» eine 200 Mio. Euro schwere Signa-Anleihe fällig. Laut «News» und «Spiegel» muss die Signa-Gruppe bis Jahresende 500 Mio. Euro aufstellen, um nicht zahlungsunfähig zu werden. Seit einem Monat steht wegen nicht gezahlten Rechnungen die Baustelle beim Signa-Grossprojekt Elbtower in Hamburg still. «Die Bauarbeiten am Elbtower sind nach wie vor eingestellt. Wir gehen derzeit davon aus, dass diese auch in der nächsten Woche noch nicht wieder aufgenommen werden», hiess es von der betroffenen Baufirma Lupp auf APA-Anfrage. Man warte auf «Informationen der Investoren zum weiteren Vorgehen». In der Schweiz sorgte der Fall von René Benko ebenfalls für Schlagzeilen. So hat die Bank Julius Bär der Signa-Holding mutmasslich hohe Kredite gewährt. Am Aktienmarkt waren die Julius-Bär-Titel in den vergangenen Tagen teilweise unter Druck. Benko ist ausserdem Mitbesitzer des Traditionswarenhauses Globus in der Schweiz. So ist die Globus-Gruppe mitsamt ihren Immobilien je zur Hälfte im Besitz von Signa und der Central Group. Die Central-Gruppe der thailändischen Familie Chirathivat hatte daher ein verbales Bekenntnis zu Globus verlauten lassen, um dem Warenhaus den Rücken zu stärken."
Signa-Holding wohl pleite: Jetzt muss René Benko sogar seinen Picasso verkaufen,https://www.blick.ch/wirtschaft/signa-holding-wohl-pleite-jetzt-muss-rene-benko-sogar-seinen-picasso-verkaufen-id19177052.html,"Fri, 24 Nov 2023 12:51:26 GMT","time.struct_time(tm_year=2023, tm_mon=11, tm_mday=24, tm_hour=12, tm_min=51, tm_sec=26, tm_wday=4, tm_yday=328, tm_isdst=0)","Die Nachrichtenmagazine «News» aus Österreich und «Der Spiegel» aus Deutschland berichten online unter Verweis auf Insider, dass die Situation bei der Signa-Holding sowie den Töchtern Prime und Development «so kritisch» sei, dass «Insolvenzanträge vorbereitet würden». Ein Signa-Sprecher sagte gegenüber den beiden Medien, dass es keine neue Sachlage gebe und man Gespräche mit potenziellen Finanzierungspartnern führe. Über die nächsten Schritte berate nun der Aufsichtsrat der Signa Prime Selection, berichtete die deutsche «Wirtschaftswoche» (online). Signa reagierte vorerst nicht auf eine schriftliche Anfrage der österreichischen Nachrichtenagentur APA. Wie bereits berichtet, ist Ende November laut dem deutschen «Handelsblatt» eine 200 Millionen Euro schwere Signa-Anleihe fällig. Laut «News» und «Der Spiegel» muss die Signa-Gruppe bis Jahresende 500 Millionen Euro aufstellen, um nicht zahlungsunfähig zu werden. Ältere Beraterkosten der Signa sind nun medial auch ein Thema geworden. Der ehemalige österreichische Bundeskanzler und seit 2010 amtierende Signa-Prime-Aufsichtsratschef, Alfred Gusenbauer, soll der Signa Holding laut dem Wochenmagazin «News» für die Jahre 2020 bis Frühjahr 2022 Beraterhonorare in Höhe von über 7 Millionen Euro in Rechnung gestellt haben. In einer Rechnungs-Leistungsbeschreibung heisst es laut Magazinbericht wörtlich, dass man «bei der Restrukturierung und bei der Finanzierung des D18-Pakets der Galleria Kaufhof Karstadt-Gruppe und bei der Beantragung eines Nachrangdarlehens beim WST für GKK» (Galeria Kaufhof Karstadt, Anm.) beratend mitgewirkt habe. Zusätzlich erhält Gusenbauer eine Vergütung als Beiratsmitglied der Signa Holding und als Aufsichtsratschef und Chefkontrolleur der Signa Prime Selection, der Signa Development Selection und der SIGNA RFR US Selection. Seit einem Monat steht wegen nicht gezahlten Rechnungen die Baustelle beim Signa-Grossprojekt Elbtower in der norddeutschen Metropole Hamburg still. «Die Bauarbeiten am Elbtower sind nach wie vor eingestellt. Wir gehen derzeit davon aus, dass diese auch in der nächsten Woche noch nicht wieder aufgenommen werden», hiess es von der betroffenen Baufirma Lupp auf APA-Anfrage. Man warte auf «Informationen der Investoren zum weiteren Vorgehen». Signa-Firmengründer Benko versucht derzeit weitere Finanzmittel zu lukrieren. Laut «Der Spiegel» und «News» stellt er auch millionenschwere Kunstwerke zum Verkauf. Das Bild «L'Étreinte» von Pablo Picasso und ein Selbstporträt von 1988 des Künstlers Jean-Michel Basquiat sollen nach Aussagen mehrerer Insider zu Geld gemacht werden. In der Schweiz sorgte der Fall von René Benko ebenfalls für Schlagzeilen. So hat die Bank Julius Bär der Signa-Holding mutmasslich hohe Kredite gewährt. Am Aktienmarkt waren die Julius Bär-Titel in den vergangenen Tagen teilweise unter Druck. Benko ist ausserdem Mitbesitzer des Traditionswarenhauses Globus in der Schweiz. So ist die Globus Gruppe mitsamt ihren Immobilien je zur Hälfte im Besitz von Signa und der Central Group. Die Central-Gruppe der thailändischen Familie Chirathivat hatte daher ein verbales Bekenntnis zu Globus verlauten lassen, um dem Warenhaus den Rücken zu stärken. (SDA)"
Streikendes Flughafenpersonal in Italien: Swiss muss 12 Flüge streichen,https://www.blick.ch/wirtschaft/streikendes-flughafenpersonal-in-italien-swiss-muss-12-fluege-streichen-id19176522.html,"Fri, 24 Nov 2023 10:42:54 GMT","time.struct_time(tm_year=2023, tm_mon=11, tm_mday=24, tm_hour=10, tm_min=42, tm_sec=54, tm_wday=4, tm_yday=328, tm_isdst=0)","Heute Freitag, 24. November streiken in ganz Italien die gewerkschaftlich organisierten Flughafenangestellten. Der erst vor zwei Tagen angekündigte, 24-stündige Streik hat Auswirkungen auf die Abfertigung und andere Flughafendienste. Die Gewerkschaften fordern mehr Lohn und bessere Arbeitsbedingungen.  Die italienische Luftfahrtbehörde Enac weist darauf hin, dass Flüge zwischen 07.00 und 10.00 Uhr sowie 18.00 bis 21.00 Uhr gesetzlich garantiert seien. Die Swiss hat ihre frühmorgendlichen Flüge nach Rom und Florenz wie geplant durchgeführt.  Dennoch kommt es zu Flugstreichungen, teils auch in obigem Zeitfenster. Gegenüber Blick erklärt Swiss-Sprecher Michael Pelzer, dass heute insgesamt 12 Flüge annulliert sind – nach Mailand, Florenz, Venedig und Bologna. Davon betroffen seien rund 900 Passagiere. Diese seien informiert und nach Möglichkeit bereits auf andere Flüge umgebucht worden. Die Hälfte der für heute geplanten Flüge an die genannten Ziele könne Swiss trotz des Streiks durchführen. Auf dem Abendflug nach Venedig setzt Swiss zudem ein grösseres Flugzeug ein als ursprünglich geplant, um zusätzliche Passagiere an ihr Ziel zu bringen – einen A321 mit 219 Plätzen statt einem A320 mit 180 Plätzen. Swiss übernehme allfällige Kosten für nötige Hotelübernachtungen sowie für die Verpflegung bis zum nächstmöglichen Abflug. «Auf den Flugbetrieb zu unseren restlichen Destinationen in Italien hat der Streik keine Auswirkungen, wir rechnen aber mit vereinzelten Verspätungen bei der Abfertigung», fügt Pelzer an. Konzernschwester Edelweiss hat ihren einzigen Italien-Flug heute, nach Lamezia Terme, pünktlich durchgeführt. Die italienische Ita Airways hat ihrerseits 36 Inlandflüge gestrichen, jedoch die Flüge ins Ausland – darunter auch ab Rom nach Genf und Zürich – aufrechterhalten. Der Abendflug von Easyjet ab Zürich nach Neapel ist annulliert. Easyjet ist aber vor allem in Genf und Basel stark. Dort wurden die Morgenflüge nach Rom, Neapel und Venedig allesamt durchgeführt. Laut Easyjet werden auch die Abendflüge ab Genf und Basel nach Rom, Bari, Venedig, Neapel und Catania durchgeführt. «Von Annullierungen betroffene Kunden haben Anspruch auf eine Erstattung oder eine kostenlose Umbuchung auf einen neuen Flug», hält Easyjet gegenüber Blick fest."
Norwegerin Caroline Hagen Kjos: Sie verwaltet das Familienvermögen aus der Schweiz,https://www.blick.ch/wirtschaft/norwegerin-caroline-hagen-kjos-ihr-vater-schickte-sie-mit-dem-familienvermoegen-in-die-schweiz-id19174887.html,"Fri, 24 Nov 2023 09:50:32 GMT","time.struct_time(tm_year=2023, tm_mon=11, tm_mday=24, tm_hour=9, tm_min=50, tm_sec=32, tm_wday=4, tm_yday=328, tm_isdst=0)","Unter den 19 neuen Namen in der «Bilanz»-Liste der reichsten 300 Schweizer finden sich drei Frauen. Eine davon ist Visionapartments-Gründerin Anja Graf (46), die am TV in der Sendung «Höhle der Löwen» als Investorin auftritt. Die anderen beiden Frauen sind Norwegerinnen. Eine davon Caroline Hagen Kjos (39), deren Vermögen auf 1,5 bis 2 Milliarden Franken geschätzt wird. Sie gehört nicht zu den vielen neu zugezogenen reichen Norwegern. Caroline Hagen Kjos lebt bereits seit 2009 in der Schweiz, ebenso ihr Bruder Carl Erik Hagen. Hier arbeiten beide für die Canica International AG mit Sitz in Freienbach SZ. Dabei handelt es sich um den Finanzarm des norwegischen Familienunternehmens Canica. Zu diesem gehören Mehrheitsbeteiligungen am Mischkonzern Orkla, der in den Bereichen Nahrungsmittel, Haushalt und Bekleidung eine grosse Nummer in Norwegen ist, sowie Anteile an den Firmen Steen & Strøm (Einzelhandel, Immobilien), Jernia (Haushaltsutensilien) oder Komplett (Online-Versandhändler für Elektronikprodukte). Vater der beiden ist Stein Erik Hagen (67), mit einem geschätzten Vermögen von umgerechnet 1,9 Milliarden Franken auf Rang 9 der reichsten Norweger. Dieser ist im Gegensatz zur medienscheuen Tochter extrovertiert, macht keinen Hehl aus seiner Verachtung der hohen norwegischen Vermögenssteuer oder aus seiner Bisexualität. Selber wohnt er weiterhin in Norwegen. Doch bereits 2014 macht er Tochter Caroline zur Vorstandsvorsitzenden von Canica. Dazu erhält sie vom Vater und ihrer nicht in die Schweiz gezogenen Schwester Camilla Hagen Sørli (43) immer weitere Anteile an Canica. Sie hält inzwischen 99,75 Prozent der Familienholding. Der Vater hält aber bei den Stimmrechten weiterhin die Mehrheit. Caroline Hagen Kjos wohnt mit Ehemann und zwei Kindern in Wollerau SZ. Bruder Carl Erik Hagen (35) wohnt in Kilchberg ZH – mit seiner Frau Rikke Sandvold Hagen (31), der Tochter von Immobilien-Tycoon und Bekleidungsunternehmer Kenneth Sandvold (72). Das «Hagen-Modell» hat Schule gemacht. Die reichen Norweger müssen nicht selber in die Schweiz ziehen. Sie entsenden oft den Nachwuchs ins Steuerparadies. Das Vermögen reist mit, meist aber keine unternehmerische Verantwortung. So auch bei Ninja Tollefsen (38), der dritten Frau auf der «Bilanz»-Liste. Sie erbt vor Jahresfrist 90 Prozent des Immobilien-Imperiums von Vater und Immobilien-Tycoon Ivar Tollefsen (62) und zieht damit nach Lugano TI. Der Papa spart Steuern, behält aber die Kontrolle im Unternehmen."
Mobiliar und Co. vor den Kopf gestossen: Swisscom will jetzt auch Versicherungen anbieten,https://www.blick.ch/wirtschaft/mobiliar-und-co-vor-den-kopf-gestossen-swisscom-will-jetzt-auch-versicherungen-anbieten-id19175918.html,"Fri, 24 Nov 2023 09:20:37 GMT","time.struct_time(tm_year=2023, tm_mon=11, tm_mday=24, tm_hour=9, tm_min=20, tm_sec=37, tm_wday=4, tm_yday=328, tm_isdst=0)","Die Swisscom sorgt mit einer Umfrage für Unmut. Denn darin wird die Kundschaft unter anderem nach ihrem Interesse für Hausrats-, Haftpflicht- und Rechtsschutzversicherungen befragt. In der Umfrage hiesse es, dass die Swisscom die zusätzlichen Versicherungsarten ab 2024 schrittweise lancieren wolle, wie ein Kunde gegenüber «CH Media» mitteilt. Das Unternehmen bestätigt, zukünftig ihr Angebot nicht nur auf den Verkauf von Handy-Abos, Internetverbindungen oder Fernsehboxen zu beschränken. Im Rahmen einer Marktbefragung habe Swisscom das Interesse einzelner Kunden für solche Angebote erörtert, bestätigt Sprecherin Annina Merk. Swisscom biete bereits heute eine Geräte- und Cyberversicherung an. «Derzeit prüfen wir eine Ausweitung des Angebots, um den Kundenbedürfnissen nach einfachen und digitalen Lösungen gerecht zu werden.» Dafür sei das Unternehmen mit verschiedenen Partnern im Austausch. Ob und welche Produkte lanciert werden, ist gemäss Merk zum aktuellen Zeitpunkt noch offen. Mehr will Swisscom nicht sagen. Gehört dies noch zum Auftrag des Telekommunikationskonzerns, die zu 51 Prozent im Besitz des Bundes ist? «Wir sehen hier keinen Widerspruch zum Grundversorgungsauftrag oder zu den Zielen des Bundes für die Swisscom», sagt Merk. Sie weist jedoch darauf hin, dass man auch bei zukünftigen Versicherungen nur als Verkäuferin und Vermittlerin agieren würde. Bereits bei der heute angebotenen Cyber- und Geräteversicherung ist im Hintergrund die Axa zuständig. Bei den privaten Konkurrenten kommt die geplante Versicherungsoffensive der Swisscom nicht gut an. Kenntnis von der Umfrage hätte man zwar keine, sagt Thilo Kleine, Sprecher des Schweizerischen Versicherungsverbands (SVV). «Grundsätzlich lässt sich aber sagen, dass der SVV die Ausdehnung staatlicher oder staatsnaher Unternehmen in verschiedene Bereiche der Privatwirtschaft stets kritisch beobachtet.» Unternehmen, die mehrheitlich in staatlicher Hand seien, würden das Risiko eines ungleichen Wettbewerbs bergen. So könnten ungerechtfertigte Vorteile entstehen. «Zum Beispiel durch staatliche Quersubventionierung, regulatorische Vorzüge oder durch den Zugang zu staatlichen Ressourcen und Informationen», sagt Kleine. Die Kritik aus der Privatwirtschaft hat Gewicht: Zu den Mitgliedern des SVV gehören unter anderem die Versicherer Mobiliar, Vaudoise und Zurich. Bei der Swisscom stellt sich laut Kleine zudem die Frage möglicher Interessenkonflikte, die sich aus einer Erweiterung des Versicherungsangebots ergeben könnten. «Insbesondere wenn es um den Datenschutz und die Verwendung von Kundendaten geht, die für den Versicherungsmarkt besonders wertvoll sind.» (sak)"
"Umfrage zum Black Friday: «Die Leute kaufen Sachen, die sie gar nicht brauchen»",https://www.blick.ch/wirtschaft/umfrage-zum-black-friday-die-leute-kaufen-sachen-die-sie-gar-nicht-brauchen-id19175946.html,"Fri, 24 Nov 2023 08:59:06 GMT","time.struct_time(tm_year=2023, tm_mon=11, tm_mday=24, tm_hour=8, tm_min=59, tm_sec=6, tm_wday=4, tm_yday=328, tm_isdst=0)",
"Hart umkämpfter Auto-Markt: VW will «in China, für China» produzieren",https://www.blick.ch/wirtschaft/hart-umkaempfter-auto-markt-vw-will-in-china-fuer-china-produzieren-id19175698.html,"Fri, 24 Nov 2023 08:36:01 GMT","time.struct_time(tm_year=2023, tm_mon=11, tm_mday=24, tm_hour=8, tm_min=36, tm_sec=1, tm_wday=4, tm_yday=328, tm_isdst=0)","Volkswagen will künftig auf dem hart umkämpften Auto-Markt in China verstärkt auf chinesische Zulieferer setzen und sich damit auch vor internationalen Krisen schützen. Politische Sanktionen seien eine Herausforderung für internationale Hersteller in China, und man beobachte Krisen wie in der Ukraine oder im Nahen Osten, die die Wirtschaft beeinflussten, sagte der VW-Konzernvorstand für China, Ralf Brandstätter, in der ostchinesischen Stadt Hefei. Die Wolfsburger wollen ihm zufolge deshalb «in China, für China» produzieren. «Wir streben nach einer autonomen, kontrollierbaren Wertschöpfungskette», erklärte er. Volkswagen wolle dafür auf lokale Zulieferer in China zurückgreifen, um nicht mehr zu abhängig vom Import oder Export zu sein. Dahinter stecken aber nicht nur politische Unwägbarkeiten. Die im Verbrennersegment noch starken Wolfsburger müssen auf dem E-Automarkt der zweitgrössten Volkswirtschaft der Welt Boden gut machen, denn chinesische Hersteller haben Volkswagen dort den Rang abgelaufen: allen voran BYD, die deutlich mehr elektrisch betriebene Fahrzeuge in China verkaufen. Volkswagen entschied deshalb, den Standort in Hefei auszubauen, eine von unzähligen Wohntürmen geprägte Provinzhauptstadt knapp 500 Kilometer westlich von Shanghai. Binnen 2,5 Jahren stampften die Wolfsburger in der Stadt mit rund acht Millionen Einwohnern neue Produktions- und Entwicklungshallen dort aus dem Boden, wo zuvor nur ein karger Parkplatz stand. «In einem dynamischen Marktumfeld ist ein hohes Entwicklungstempo entscheidend für die Wettbewerbsfähigkeit», sagte Brandstätter. Will heissen: E-Auto-Käufer in China haben andere Ansprüche als in Deutschland, auch weil sie laut VW mit durchschnittlich 34 Jahren deutlich jünger und die Fahrgewohnheiten anders sind. In chinesischen Grossstädten stehen Autofahrer etwa viel im Stau. Entertainment ist daher wichtiger als viele Pferdestärken. Ganz so einfach dürfte das aber nicht werden: Brandstätter erwartet nach eigenen Worten «ein sehr aggressives Preislevel». Auf Chinas E-Auto-Markt tummeln sich neben den grossen Herstellern viele kleine Marken, die in Deutschland weitgehend unbekannt sind. Xpeng ist eine davon. VW ging mit den Südchinesen eine Kooperation ein, um sich neue Kunden zu sichern. Branchenbeobachter rechnen damit, dass besonders kleinere Mitstreiter dem Preiskampf nicht standhalten und viele Marken verschwinden werden. Brandstätter und seine Manager-Kollegen sprechen gerne von «China speed» (China-Geschwindigkeit). Für VW bedeutet das: Der Konzern muss schneller werden, Modelle zu entwickeln und sich an die Kundenwünsche anzupassen. Bis 2030 wollen die Wolfsburger 30 neue E-Automodelle in China auf den Markt bringen. Ein Schlüssel dazu ist die Volkswagen China Technology Company (VCTC) in Hefei, mit der, kurz gesagt, die Entwicklung von Modellen für den chinesischen Markt von Wolfsburg nach China verlagert und damit die Zeit bis zur Marktreife von Fahrzeugen und Komponenten um 30 Prozent verkürzt werden soll. Etwa eine Milliarde Euro investierte der Konzern. Bis Ende 2024 sollen dort rund 3000 Menschen arbeiten und Modelle für die drei Joint-Ventures – die Partnerschaften zwischen VW und chinesischen Unternehmen – entwickeln. Vom Fokus auf chinesische Zulieferer erwartet sich Volkswagen China eine deutliche Kostenreduzierung. Warum entschieden sich die Wolfsburger erst jetzt dafür? «Wir haben gelernt, dass man das nicht aus 8000 Kilometern Entfernung machen kann mit nur sechs Stunden Zeitüberlappung», sagte der verantwortliche VW-Manager für Forschung und Entwicklung, Marcus Hafkemeyer, in Hefei. Bisher sei jede Plattform, quasi der Fahrzeugunterbau, in Deutschland für China entwickelt und dann übertragen worden. Jetzt soll das in Hefei geschehen, um Kosten und Zeit für die Entwicklung zu sparen. Hinzu komme, dass aus Volkswagen-Sicht erst in den vergangenen drei bis vier Jahren chinesische Lieferanten gross geworden seien und die Qualität hätten liefern können, die VW benötige, hiess es."
5 von 19 Neuzugängen im «Bilanz»-Ranking: Immer mehr norwegische Steuerflüchtlinge unter den Reichsten,https://www.blick.ch/wirtschaft/5-von-19-neuzugaengen-im-bilanz-ranking-immer-mehr-norwegische-steuerfluechtlinge-unter-den-reichsten-id19174402.html,"Fri, 24 Nov 2023 08:19:53 GMT","time.struct_time(tm_year=2023, tm_mon=11, tm_mday=24, tm_hour=8, tm_min=19, tm_sec=53, tm_wday=4, tm_yday=328, tm_isdst=0)","Insgesamt 19 neue Namen tauchen auf der diesjährigen «Bilanz»-Liste der 300 reichsten Schweizer auf. Darunter bekannte Namen wie Immobilienunternehmerin Anja Graf (46), bekannt aus der TV-Show «Höhle der Löwen», oder Jetsetter Patrick Liotard-Vogt (39), Mehrheitsaktionär bei «A small world», einer Community-Plattform für Reiche. Oder neue Schwergewichte wie die brasilianischen Milliardäre Carlos Sicupira (75) und Marcel Telles (73) von der Investmentfirma 3G Capital, die seit kurzem beide im noblen St. Moritz GR wohnen. Vor allem aber fällt auf, dass fünf der 19 Listen-Neulinge aus Norwegen stammen. Ganz überraschend kommt dies nicht. Vor zwei Jahren hob die sozialdemokratische Regierung Norwegens die Vermögenssteuer für Vermögende sowie die Dividendensteuer an. Es folgte ein Exodus der reichen Norweger in die steuergünstige Schweiz. Folgende fünf Norwegerinnen und Norweger haben es neu in die «Bilanz»-Liste der reichsten Schweizer geschafft: Ende 2022 erbt Tollefsen vom Vater, dem Immobilien-Tycoon Ivar Tollefsen (62), rund 3,6 Milliarden Franken und zieht nach Lugano TI. Unternehmerische Aufgaben im Familienkonzern Fredensborg hat sie keine. Vater Stein Erik Hagen (67), dank zahlreicher Beteiligungen der zweitreichste Mann Norwegens, hat seiner Tochter vor Jahren einen Grossteil des Familienvermögens sowie der Anteile am Familienunternehmen Canica übertragen. Die medienscheue Caroline Hagen Kjos wohnt seit 2009 im Kanton Schwyz. Dahl ist seit den 90er-Jahren mit seiner Firma Sector Alarm erfolgreich, einer der europaweit grössten Gruppen für Alarmsysteme. Dahl wohnt neu in Lugano TI. Übrigens: Da Banken sein Unternehmen zunächst nicht finanzieren wollten, erhielt Dahl beim Karrierestart Geld von Privatinvestor Sjur Thorsheim (64). Dieser ist vor wenigen Wochen Dahl in die Schweiz gefolgt. Der ehemalige Wirtschaftsjournalist hat mit seiner Pareto Group, die Finanzdienstleistungen anbietet und über einen Schifffahrtsarm auch Tanker, Frachter und Bohrinseln verwaltet, ein Milliardenvermögen angehäuft. Støle ist nicht neu in der Schweiz: Er zog bereits vor fünf Jahren nach Zug und steuert seine Geschäfte erfolgreich von dort aus. Klaveness ist Verwaltungsratspräsident und Grossaktionär der Reederei Torvald Klaveness Group, die 1946 von seinem Vater gegründet wurde. Sein Vermögen hat er mit dem lukrativen Frachtschiffgeschäft und mit Logistik-Digitalisierung stetig erweitert. Und sich 2022 in Wädenswil ZH niedergelassen."
