title,link,published,published_parsed,article_content
«Bitte schick mir Zigaretten»: So leben Putins Soldaten im ukrainischen Geheim-Knast,https://www.blick.ch/ausland/bitte-schick-mir-zigaretten-so-leben-putins-soldaten-im-ukrainischen-geheim-knast-id19157397.html,"Sat, 18 Nov 2023 18:04:58 GMT","time.struct_time(tm_year=2023, tm_mon=11, tm_mday=18, tm_hour=18, tm_min=4, tm_sec=58, tm_wday=5, tm_yday=322, tm_isdst=0)","Das bestgehütete Geheimnis der Ukraine liegt am Rand eines kleinen Dorfs irgendwo im Westen des Landes. Hier, in einem riesigen Bau mit weissen Mauern und viel rostigem Stacheldraht, sind Tausende russische Soldaten eingesperrt. Kriegsgefangene, geschnappt an der fernen Front, eingesperrt auf unbestimmte Zeit, mit dem Ziel, sie irgendwann gegen die ukrainischen Kämpfer in den russischen Lagern auszutauschen. Wo das einzige Kriegsgefangenenlager der Ukraine steht, bleibt aus Sicherheitsgründen geheim. Auch die genaue Zahl der Insassen will Petro Yatsenko (45) nicht verraten: «Es sind viel zu viele», sagt der ukrainische Zuständige für die Behandlung von Kriegsgefangenen nur und schreitet rasch über den Gefängnishof. Russland verweigert einen weiteren Gefangenenaustausch seit mehr als drei Monaten. «In vier Wochen sind wir hier voll», sagt Yatsenko. Ein zweites Kriegsgefangenenlager wird bald in Betrieb genommen. Bissig ist die November-Kälte, blau-gelb sind die Netze an den Fussballtoren, ganz in Blau gekleidet die Gefangenen, die mit hinter dem Rücken verschränkten Händen schweigend durch den Hof huschen. Viele humpeln an Krücken. An den Gefängniswänden hängen Fotos der Klitschko-Brüder und alter ukrainischer Herrscher. Sie sollen die Russen über die Geschichte jenes Landes aufklären, das sie von einer angeblichen Nazi-Regierung befreien wollten. Igor (32) ist einer von ihnen. Er sitzt im geheizten Fernsehzimmer mit gut 50 anderen Männern. Die einzige Frau, die je hier landete, wurde vor einem Jahr ausgetauscht. «Ich sass schon in Russland im Knast, wegen Mordes», sagt Igor, Millimeterschnitt, schelmischer Blick. Man habe ihm die Freiheit versprochen, wenn er sechs Monate in der Ukraine kämpfen würde. «Also kam ich. Ich glaubte ihnen das mit den Nazis. Aber ich habe keine gefunden.» Zuhinterst im Raum sitzt Anton (26), Elektriker aus Sibirien, eingezogen gegen seinen Willen, behauptet er mit zittriger Stimme. «Ich wollte diesen Krieg nicht. Und den Familien derer, die ich getötet habe, möchte ich sagen: Es tut mir leid.» Dann fragt Anton den Reporter mit grossen Augen, ob er ihm nicht vielleicht etwas Süsses geben könnte, irgendetwas. Dessert gibt es keines im ukrainischen Kriegsgefangenenlager. Dafür traditioneller Borschtsch – eine Suppe–, Pasta mit Fleisch und sechs Scheiben Brot zum Zmittag. In Schichten marschieren die Gefangenen in den Esssaal, fassen Aluminiumlöffel und Geschirr, schlürfen schweigend. Wir essen mit, die Suppe schmeckt fad. «Kein Salz: Das ist die Strafe dafür, dass sie uns Bachmut geklaut haben», sagt Petro Yatsenko und zwinkert. Natürlich halte man sich an die Ernährungsvorschriften, schiebt er nach und erwähnt zum zigten Mal die Genfer Konvention, die in 143 Artikeln regelt, wie man Kriegsgefangene zu behandeln habe. Hab und Gut sind geschützt – ausser Waffen und Pferde (Artikel 18), trocken, hell und warm muss das Lager sein (Artikel 25), keine Zwangsarbeit (Artikel 49). Steht alles in grossen Lettern draussen im Gefängnishof. «Auch die Russen haben das ratifiziert», sagt Yatsenko. Aber die gäben einen Dreck darauf. 85 Prozent der befreiten ukrainischen Kriegsgefangenen berichteten nach ihrer Befreiung von Folter. Immer wieder habe er die Geschichte mit dem Chabis gehört, sagt Yatsenko: «Sie kriegten eine Schale mit siedend heissem Wasser und ein paar Kohlblättern drin. Man gab ihnen eine Minute Zeit zum Essen. Sie mussten sich entscheiden: Will ich mir den Hals verbrennen – oder doch lieber weiterhungern?» Ganz anders laufe es hier. Die Hälfte der Gefangenen sei nach drei Monaten übergewichtig. «Am liebsten wäre mir, man würde die Gefangenenaustausche in Zukunft nach Gewicht regeln, nicht nach Anzahl Personen. Wir kriegten zwei hungrige Ukrainer für einen fetten Russen», sagt Yatsenko. Galgenhumor. Er hilft den ukrainischen Aufsehern, mit der Trostlosigkeit dieses Orts umzugehen. Den russischen Insassen hilft die Arbeit. In einer Backsteinhalle fertigen Hunderte Gefangene Gartensessel an. Fahles Licht fällt auf die bleichen Gesichter. Die Hände, die zum Töten kamen, flechten nun Korbstühle. Es tackert, hämmert, bohrt. Mehrere Russen hantieren mit spitzen Japanmessern. Nur, wer die zweiwöchige psychologische Überwachung nach Eintritt ins Lager absolut unauffällig übersteht, darf hier in der Korbstuhlhalle mit den potenziellen Mordinstrumenten werkeln. Alle anderen, alle Gefährlichen, sitzen drüben im Neonröhrenkeller und kleben Papiersäcke zusammen. Rund zehn Franken kriegen sie dafür pro Monat. Und ein bisschen Ablenkung von ihrem Elend obendrauf. Die hat Vitali (60) dringend nötig. Mit glasigem Blick sitzt er an seinem Tisch, vor sich einen Stapel Papiersäcke, Leim und die hoffnungslose Lage, in die er sich hineinbugsiert hat. «Ich habe mich freiwillig gemeldet, ich bin Patriot», sagt Vitali, der Grossvater aus dem äussersten Osten Russlands. Von da reiste er quer durch das riesige Reich, um die Ukraine «zu befreien». Schon sein Grossvater habe gegen die Nazis gekämpft, sagt Vitali. Auch er wollte für seine Enkel ein Vorbild sein. Stattdessen ist er jetzt nicht mal mehr für sie da. Ganz zuhinterst im Klebe-Keller sitzt Ablemit (31), überall tätowiert, ein Leben im Knast hinter sich – aber nicht in Russland, sondern im seit 2014 besetzten ukrainischen Donezk-Gebiet. Er rattert die Standard-Phrasen der Russenpropaganda herunter, von der Unterdrückung im Donbass, von den ukrainischen Nazis, an denen er sich rächen wollte. «Ich glaube das noch immer», sagt Ablemit. Doch die Rache muss auf sich warten lassen. Ihm drohen – wie jedem Ukrainer, der mit den Russen kollaboriert – 15 Jahre Gefängnis. Dieselbe Strafe droht russischen Soldaten, die im Kampf freiwillig die Waffen strecken. Die Ukraine weiss das. Deshalb vermerkt sie bei allen Kriegsgefangenen, dass sie gegen ihren Willen gefangen genommen worden seien. Fair. Aber nutzlos. Die Rückkehrer seien für Putin eine Gefahr, erklärt Petro Yatsenko. Sie hätten die wahren Zustände in der Ukraine gesehen – und sie könnten Zweifel wecken an den Geschichten der russischen Propaganda. «Deshalb schickt er sie gleich wieder in den Krieg.» Wer freiwillig in die warmen Schlafsäle (Nachtruhe von 22 bis 6 Uhr, Einzelbetten, Tolstoi-Bücher und Bibeln, aber keine Pornoheftchen) des ukrainischen Lagers zurückkehren wolle, könne sich über die «Ich will raus»-Hotline direkt bei Kiews Streitkräften melden. Jeder Gefangene erhält bei seiner Entlassung eine Karte mit der Nummer drauf. Das sei ein gutes Angebot, sagt Yatsenko. «Die Krankenversorgung in unserem Lager ist deutlich besser als in Russland.» Die Rundumversorgung der Kriegsgefangenen kostet 250 Franken pro Mann und Monat, etwa dreimal so viel wie die Mindestrente in der Ukraine. Im Krankenflügel des Geheimgefängnisses steht ein Röntgenapparat. Es gibt ein Zahnarztzimmer und psychologische Betreuung. Ein Drittel der Gefangenen sei bei der Ankunft verletzt oder verwundet, sagt der zuständige Arzt. Viele über 40 hätten schwere Magenprobleme. «Wir helfen selbstverständlich allen – auch wenn das manchmal nicht einfach ist. Besonders bei den Vergewaltigern und Mördern, die für eine Strafmilderung in den Krieg ziehen und dann hier bei uns landen.» Ein letzter Raum, vielleicht der düsterste im ganzen Gefängnis: Ein Telefon steht auf dem Tisch. Fünf Minuten Gesprächszeit hat jeder Gefangene pro Monat. Nebenan sitzt ein Wächter und hört ganz genau zu, was die Männer am Telefon sagen. Nur ein falsches Wort, eine heikle Information, dann wird die Leitung gekappt. Artem (34) hat keine heiklen Informationen, aber zwei Bitten an seine Frau: «Bitte schick mir Zigaretten. Und bitte küsse Nikka von mir.» Dann steht er auf, geht raus, setzt sich in einem Nebenraum hin und erzählt: von seiner Gefangennahme im Donbass, von Nikka, seiner Tochter, die er so sehr vermisse. Artem schaut weg, Tränen schiessen ihm in die blauen Augen. Aus dem Radio des Wächters im Hintergrund tönt Alan Walkers Song «Faded»: «Where are you now?» («Wo bist du jetzt?»), säuselt die Frauenstimme. Nikka weiss das nicht, seine Frau weiss es nicht, nicht einmal Artem selbst weiss das ganz genau. Er weiss nur, er ist weit weg von da, wo er hingehört, an einem Ort, an dem er nichts verloren hätte, und doch alles verloren hat."
Auswanderin motzt in Miami über ihre Heimat: «In der Schweiz sind alle immer hässig!»,https://www.blick.ch/ausland/auswanderin-motzt-in-miami-ueber-ihre-heimat-in-der-schweiz-sind-alle-immer-haessig-id19157320.html,"Sat, 18 Nov 2023 15:23:13 GMT","time.struct_time(tm_year=2023, tm_mon=11, tm_mday=18, tm_hour=15, tm_min=23, tm_sec=13, tm_wday=5, tm_yday=322, tm_isdst=0)","Wo ist das Leben besser? In der Schweiz oder in den USA? Das wollte ein Tiktoker in Miami von einer Frau bei einer Strassenumfrage wissen. Sie lebe schon seit vier Jahren in den USA, erklärt die Schweizerin. «Die Leute sind hier ehrlich gesagt viel netter. Wenn du einen Uber nimmst, reden sie mit dir. In der Schweiz reden sie nicht mit dir. Da sind alle hässig.» Worauf muss sich jemand gefasst machen, der mit 23 Jahren beschliesst, in der Schweiz zu leben? Die nächste Frage des Interviewers hatte abermals eine Klatsche für die Schweiz zur Folge: «Nicht viel», watscht die Frau ihre Heimat ab. «Es gibt ehrlich gesagt nicht viel zu tun. Aber es ist ein wunderschöner Ort.» Schön, aber langweilig, so also das Fazit der Schweizerin über ihre Heimat. Es gebe keinen Grund, in der Schweiz zu leben. «Es sei denn, du beschäftigst dich mit Banking oder liebst Schokolade.» In der Schweiz blieb die Abfuhr der Frau nicht lange unbemerkt. In den Kommentaren des auf Tiktok veröffentlichten Videos regt sich Widerstand gegen ihre Darstellung. «Bisch ned ganz putzt?», schreibt ein User. «Ich lebe in der Schweiz, sie ist das beste Land überhaupt», lautet ein weiterer Kommentar. Manche betonen die schöne Natur in der Schweiz. Andere die hohe Sicherheit. Die Kommentarschreiber, die für die Schweiz einstehen, sind eindeutig in der Überzahl. Nur vereinzelt teilen die User die Meinung der befragten Schweizerin. Die Schweiz sei schon schön, heisst es etwa. Aber langweilig. Ein anderer Kommentarschreiber meint, die Schweizer «sind deprimierend, Amerikaner so freundlich»."
Flüsse durchschwimmen und Krankheit vortäuschen: So flüchten Ukrainer vor dem Wehrdienst,https://www.blick.ch/ausland/fluesse-durchschwimmen-und-krankheit-vortaeuschen-so-fluechten-ukrainer-vor-dem-wehrdienst-id19155463.html,"Sat, 18 Nov 2023 10:29:14 GMT","time.struct_time(tm_year=2023, tm_mon=11, tm_mday=18, tm_hour=10, tm_min=29, tm_sec=14, tm_wday=5, tm_yday=322, tm_isdst=0)","Diese Zahl ärgert den ukrainischen Präsidenten Wolodimir Selenski (45): Fast 20'000 Männer sind seit dem Beginn der russischen Invasion in der Ukraine ins Ausland geflohen, um der Einberufung zu entgehen. Manche durchquerten reissende Flüsse, andere täuschten Krankheit vor. Einige der Männer haben mit der britischen BBC über ihre Beweggründe für die Flucht gesprochen. «Nicht jeder ist ein Krieger. Man muss nicht das ganze Land einsperren. Man kann nicht alle über einen Kamm scheren, wie es in der Sowjetunion der Fall war», sagt etwa ein Mann namens Jewgeni. Er ist einfach über die Landesgrenze nach Moldau gelaufen. Es gibt aber auch waghalsigere Fluchtwege. Immer wieder schwimmen Ukrainer durch Flüsse in Richtung Moldau oder Rumänien. Nicht immer reicht die Kraft, um die reissenden Gewässer zu überqueren. An den Ufern des Flusses Theiss zwischen der Ukraine und Rumänien wurden die Leichen von mehreren ertrunkenen Männern an Land gezogen. Erik (26), der es über Moldau in die USA geschafft hat und dort mit seiner Familie lebt, muss nach einer Operation im Bauchraum eine spezielle Diät einhalten. Eigentlich war der Musiker vom Kriegsdienst befreit. Aber als der Krieg ausbrach, erwies es sich für ihn als unmöglich, auf legalem Wege eine ärztliche Befreiungsbescheinigung zu bekommen. «Ich verbrachte ein halbes Jahr damit, ein Zertifikat zu bekommen, um zu beweisen, dass ich nicht fit war, obwohl ich alle Tests in der Hand hatte. Irgendwann war meine Geduld am Ende», sagt er. Er floh über die Russland-nahe Moldau-Region Transnistrien. Der Krieg befeuert die Kriminalität. Manche Männer bezahlen den Recherchen zufolge Schmuggler, um über die Grenze zu gelangen. Auf Telegram werden medizinische Bescheinigungen für umgerechnet 3800 Schweizer Franken angeboten. Doch nicht allen Kriegsdienstverweigerern gelingt die Flucht. 21'113 Personen wurden bei der Flucht von den ukrainischen Behörden gefasst. Ihnen droht eine Haftstrafe von bis zu acht Jahren.  Zu den gescheiterten Flüchtigen gehören auch zwei Ukrainer, die nach Rumänien ausreisen wollten. Sie wurden an der Grenze aufgehalten. Die Männer hatten offenbar vor, den Fluss Theiss zu überqueren. Dafür hatten sie sich mit Flamingo-Schwimmflügeli und einem Schwimmring mit Blumenmuster ausgerüstet, wie Bilder der ukrainischen Behörden zeigen. Der Krieg entwickelt sich immer mehr zu einem Zermürbungskrieg. Die Ukraine braucht alle Soldaten, die sie kriegen kann. Das weiss auch Selenski. Im August rügte er die «korrupten Entscheidungen» der medizinischen Militärkommissionen, die zu einer Verzehnfachung der Ausnahmen seit Februar 2022 geführt hätten. Er verkündete, dass alle regionalen Beamten, die für die Wehrpflicht zuständig waren, abgesetzt worden seien und mehr als 30 Personen strafrechtlich belangt würden. (nad)"
Ruinen von Turin: Die Geisterschanzen von Olympia 2006,https://www.blick.ch/ausland/ruinen-von-turin-die-geisterschanzen-von-olympia-2006-id19152867.html,"Sat, 18 Nov 2023 09:22:16 GMT","time.struct_time(tm_year=2023, tm_mon=11, tm_mday=18, tm_hour=9, tm_min=22, tm_sec=16, tm_wday=5, tm_yday=322, tm_isdst=0)",
«Es muss einen belastbaren Mechanismus geben»: Scholz drängt Erdogan zur Rücknahme von abgelehnten Asylbewerbern,https://www.blick.ch/ausland/es-muss-einen-belastbaren-mechanismus-geben-scholz-draengt-erdogan-zur-ruecknahme-von-abgelehnten-asylbewerbern-id19155984.html,"Sat, 18 Nov 2023 08:50:33 GMT","time.struct_time(tm_year=2023, tm_mon=11, tm_mday=18, tm_hour=8, tm_min=50, tm_sec=33, tm_wday=5, tm_yday=322, tm_isdst=0)","Der Kanzler habe betont, dass es dafür «einen belastbaren Mechanismus» geben müsse, hiess es am Freitagabend nach dem etwa zweistündigen Abendessen im Kanzleramt aus deutschen Regierungskreisen. Eine gemeinsame Arbeitsgruppe solle nun bald Ergebnisse dazu vorlegen. Beim Streitthema Nahost-Konflikt habe sich das Gespräch auf die humanitäre Lage im Gazastreifen, der Freilassung von Geiseln der Hamas sowie die Sorge vor einer regionalen Eskalation konzentriert. Man habe auch über längerfristige Perspektiven für den Gazastreifen und den Nahost-Konflikt gesprochen, hiess es. «Der Bundeskanzler unterstrich die deutsche Haltung der Solidarität mit Israel und verurteilte in aller Klarheit den terroristischen Anschlag der Hamas.» Erdogans Besuch in Deutschland, der erste seit fast vier Jahren, war wegen dessen scharfer verbaler Attacken gegen Israel im Zusammenhang mit dem Gaza-Krieg umstritten. Der türkische Präsident hatte die Ermordung vieler Hundert israelischer Zivilisten beim Terrorangriff am 7. Oktober zwar verurteilt, die dafür verantwortliche Hamas aber später als «Befreiungsorganisation» bezeichnet. Israel warf er dagegen einen «Genozid» (Völkermord) im Gazastreifen und «Faschismus» vor, bezeichnete das Land als «Terrorstaat» und stellte sein Existenzrecht infrage. In der Pressekonferenz mit Scholz vermied Erdogan jedoch eine weitere Eskalation. Auch auf Nachfrage wiederholte er die Vorwürfe des Völkermords und des Faschismus gegen Israel nicht. Er zweifelte auch die Legitimität Israels nicht erneut an und verzichtete darauf, die Hamas als «Befreiungsorganisation» zu titulieren. Allerdings gab es neue Spitzen des türkischen Präsidenten. Israel beschuldigte er, mehr Geiseln zu halten als die mehr als 200 der Hamas im Gazastreifen. Seit Jahren seien «Geiseln und Gefangene» in Israels Händen und «bei weitem mehr» als in den Händen der Hamas. Auf was genau Erdogan sich bezog, blieb aber offen. Deutschland warf der türkische Präsident verklausuliert vor, Israel wegen seiner historischen Schuld für den Holocaust zu stark in Schutz zu nehmen. Israel habe Tausende Palästinenser getötet, Krankenhäuser vernichtet, Gebetshäuser und Kirchen zerbombt. «Warum gibt es keine Reaktion?», fragte er. Er selbst könne frei reden, «denn wir schulden Israel nichts», sagte Erdogan. Sein Land sei ja nicht am Holocaust beteiligt gewesen. Von Scholz gab es dazu keinen Kommentar. Der Kanzler hatte die Verbalattacken Erdogans gegen Israel schon vor dem Gespräch als «absurd» zurückgewiesen. In der Pressekonferenz war er darauf bedacht, kein weiteres Öl ins Feuer zu giessen. «Dass wir zu dem Konflikt sehr unterschiedliche Sichtweisen haben, ist ja kein Geheimnis», sagte er. Beide Politiker stimmten darin überein, dass kurzfristig humanitäre Feuerpausen zur Versorgung der Zivilbevölkerung und langfristig eine Zwei-Staaten-Lösung mit einem friedlichen Nebeneinander von Israelis und Palästinensern nötig seien. Nach dem Gespräch wurde aus deutschen Regierungskreisen eine lange Liste mit Ergebnissen des Gesprächs verbreitet. Die beiden hätten sich auf eine zügige Ausweitung der Imam-Ausbildung in Deutschland verständigt, um die Entsendungen von Imamen aus der Türkei schrittweise zu beenden. Scholz habe Erdogan auch Unterstützung beim Wiederaufbau von Bildungseinrichtung nach dem verheerenden Erdbeben vom Februar dieses Jahres zugesagt, bei dem Zehntausende Menschen ums Leben kamen. Die beiden seien sich zudem einig gewesen, «dass Russland weiter dringend aufgefordert» sei, den Angriffskrieg gegen die Ukraine zu beenden. Der Kanzler habe für die noch ausstehende Ratifizierung des schwedischen Nato-Beitritts durch die Türkei geworben und die Entspannung im Verhältnis zwischen der Türkei und Griechenland gewürdigt. Erdogan wird am 7. Dezember auch nach Athen reisen. Kurz vor Erdogans Ankunft drängte die Türkei auf ein deutsches Ja zum Kauf von Eurofighter-Jets. Verteidigungsminister Yasar Güler hatte am Donnerstag gesagt, die Türkei beabsichtige 40 der Kampfflugzeuge zu kaufen und habe bereits die Zustimmung von Grossbritannien und Spanien. Nun wolle man Deutschland überzeugen. Scholz äusserte sich in der Pressekonferenz nicht dazu, ob Deutschland dem Export zustimmen werde. Ein Ja zu dem Rüstungsexport gilt als unwahrscheinlich. Die Bundesregierung genehmigt schon seit Jahren nur noch wenig Rüstungsgüter an den Nato-Partner Türkei. In der gemeinsamen Pressekonferenz sagte Erdogan, es gebe viele Länder, die Kampfflugzeuge herstellten, nicht nur Deutschland. «Das kann man natürlich auch von anderen Ländern besorgen.» (SDA)"
