title,link,published,published_parsed,article_content
Bischof in Chur stösst mit Verhaltenskodex auf Widerstand,https://www.srf.ch/news/schweiz/missbrauchsfaelle-in-der-kirche-bischof-in-chur-stoesst-mit-verhaltenskodex-auf-widerstand,"Tue, 21 Nov 2023 16:22:42 +0100","time.struct_time(tm_year=2023, tm_mon=11, tm_mday=21, tm_hour=15, tm_min=22, tm_sec=42, tm_wday=1, tm_yday=325, tm_isdst=0)","Kein Platz für Missbrauch – das wollte das Bistum Chur mit einem Verhaltenskodex erreichen. 2022 hat Bischof Joseph Maria Bonnemain diesen Kodex als Reaktion auf die Schlagzeilen über sexuellen Missbruch in der katholischen Kirche lanciert. Alle Mitarbeitenden und Führungspersonen des Bistums Chur hätten unterschreiben sollen. Mehrere Abschnitte, insbesondere auch zur Sexualmoral, werden von einzelnen konservativen Priestern aber kritisiert: Sie verweigern die Unterschrift. Wie Recherchen des SRF-Regionaljournals zeigen, krebst Bischof Bonnemain jetzt zurück und toleriert die rebellischen Priester. Der Churer Priesterkreis – ein Verein von Priestern im Bistum Chur – billigt den Kodex nicht. Vor allem die Artikel zur Sexualmoral sind ihm sauer aufgestossen.  Sexuelle Selbstbestimmung und die Pflicht, niemanden wegen der sexuellen Identität oder Orientierung zu diskriminieren sei gegen die katholische Lehre, so eine Stellungnahme. Der Verein unterschreibe demnach nur mit einer Klausel, damit die kritisierten Artikel für die Priester des Priesterkreises nicht verbindlich seien. Dies bestätigt auf Anfrage auch der Vorsitzende Roland Graf. Der Bischof hat sich zweimal mit dem Priesterkreis getroffen, um die Abtrünnigen zur Unterschrift zu bewegen, ohne Erfolg. «Die Mitglieder des Churer Priesterkreises haben mehrfach erklärt, dass sie mit 98 Prozent des Inhaltes des Verhaltenskodexes einverstanden sind», so Bonnemain. «Mit ein paar Punkten haben sie eine gewisse Mühe, weil sie meinen, sie stünden nicht im Einklang mit der Lehre der Kirche.» Eine Verweigerung der Unterschrift zeigt laut Verhaltenskodex «massive Qualitätsdefizite in der Reflexionsfähigkeit, da die Person zu Pauschalurteilen neigt oder das Anliegen der Prävention nicht genügend mitträgt». Trotzdem will der Bischof die Unterschriften nicht einfordern. Denn es gehe um die persönliche Haltung im Umgang, und die ist laut Bonnemain bei allen tadellos. Karin Iten und Stefan Loppacher haben als Präventionsbeauftragte den Kodex entwickelt. Loppacher sieht die Haltung von Bischof Bonnemain kritisch: «Problematisch ist, dass man damit zum Ausdruck bringt, dass man die Auseinandersetzung, auch die kritische Reflexion eigentlich nicht will.» «Der Bischof muss an dem festhalten und die müssen das jetzt einfach unterschreiben», sagt Franz Sepp Caluori, GPK-Mitglied und Bündner Standespräsident.  Anders sieht es der Präsident der katholischen Landeskirche Graubünden, Thomas Bergamin: «Man sollte nicht das Thema an einem Punkt oder Komma aufhängen. Ich bin mir sicher, sie werden sich finden.» «Natürlich muss man versuchen, sie zu gewinnen, aber nicht um jeden Preis», meint wiederum der Präventionsbeauftragte Loppacher. «Der Schutz von Menschen ist wichtiger, als dass man Kompromisse eingeht.» Der Bischof selber hatte 2022 bei der Präsentation des Verhaltenskodexes noch klare Worte gewählt. «Wenn jemand veränderungsresistent bleibt, (…) muss man dieser Person schliesslich sagen ‹Du bist nicht geeignet, um in der Kirche zu arbeiten›.» Heute verzichtet der Bischof auf klare Ansagen. Angesichts des Priestermangels in der Kirche könnte ihm eine Trennung von Priestern eher schwerfallen. Es besteht die Gefahr, dass aus einem Schritt nach vorn zwei zurück werden."
TikTok-Trend #Manifesting: «Das ist unsäglicher Humbug!»,https://www.srf.ch/kultur/gesellschaft-religion/theologe-ueber-milliardenhype-tiktok-trend-manifesting-das-ist-unsaeglicher-humbug,"Tue, 21 Nov 2023 15:33:28 +0100","time.struct_time(tm_year=2023, tm_mon=11, tm_mday=21, tm_hour=14, tm_min=33, tm_sec=28, tm_wday=1, tm_yday=325, tm_isdst=0)","Life-Coaches versprechen in den sozialen Medien Erfolg und Reichtum durch das Konzept des sogenannten «Manifestieren». Die Idee ist einfach: Fest wünschen, immer positiv denken und sich selbst klarmachen, dass man es verdient hat. Dann wird es das Universum für einen richten.  Steckt dahinter nur Hokuspokus – oder vielleicht das Geheimnis kosmischer Kräfte?                   Manuel Schmid               Theologe      Manuel Schmid ist promovierter Theologe und arbeitet als Co-Leiter vom RefLab der reformierten Kirche Zürich. In Podcasts, Blogs oder Vlogs diskutieren er und sein Team mit Gästen über Glaube, Religion und Spiritualität. SRF: Laut einem Artikel im «National Geographic» hat der Hashtag #Manifesting in den sozialen Medien über 34 Milliarden Aufrufe. Manifestieren ist also aus der Nische der spirituellen Szene in den Mainstream gelangt. Was sagen Sie dazu? Manuel Schmid: Ich finde es extrem problematisch, gefährlich und besorgniserregend, dass dieses Konzept so beliebt und populär ist. Natürlich kann man Wahrheitsmomente ausmachen. Aber ins Extreme gezogen, wirken sich diese Wahrheitsmomente ganz problematisch aus – für jeden Einzelnen und, wenn das um sich greift, auch für die Gesellschaft. Ich finde diese Ideologie unbarmherzig und überheblich. Was finden Sie daran denn so gefährlich oder besorgniserregend? Die ganze – ich sage jetzt Ideologie – ist eine Anleitung zum strategischen Selbstbetrug. Es fördert eine ganz manische Form von Optimismus. Per «Gesetz der Anziehung» zieht man mit negativen Gedanken automatisch negative Ereignisse an. Also darf ich mir keine negativen Gedanken mehr erlauben. Eine solche Vorstellung führt dazu, dass ein grosser Teil der Realität ausgeblendet wird, und das ist psychologisch sehr ungesund. «Du kannst alles haben, was du willst», propagieren junge und hippe Menschen auf TikTok, Instagram und YouTube: das Traumauto, den Traumpartner oder das grosse Geld. Die Idee dahinter ist einfach: stark wünschen, immer positiv denken, Unsicherheiten überwinden und sich sagen, dass man es verdient hat.  Durch Aufschreiben, Affirmationen oder Meditationen soll dieses neu erarbeitete Selbstkonzept verinnerlicht werden.  Ein selbsternannter Manifestier-Coach formuliert es auf YouTube so: «Du siehst in deinem inneren Auge die eine Million, du fühlst sie in deinen Zellen und bist schon glücklich, dass sie da sind. Auf deinem Konto sind zwar 0 Euro, aber du gehst in die Schwingung einer Million. Und wenn du es schaffst, lange genug in dieser Schwingung zu bleiben, muss diese Realität wahr werden. Das ist ein Gesetz.» Die Idee ist nicht neu: Die Grundlage vom Manifestieren ist das sogenannte «Gesetz der Anziehung», das besagt: «Gutes zieht Gutes an.»  Die Wurzeln dieser Idee liegen in der «New Thought»-Bewegung des 19. Jahrhunderts. Einer breiten Öffentlichkeit bekannt wurde das «Gesetz der Anziehung» 2006.  Damals veröffentlichte die australische Autorin Rhonda Byrne das Buch «The Secret». Bis heute wurde es in über 50 Sprachen übersetzt und über 30 Millionen Mal verkauft. Es besagt, dass wir mit unseren Gedanken die Realität formen, denn Gedanken haben eine Frequenz. Und wenn wir auf der gleichen Frequenz sind wie unser Wunsch, dann zieht sich das gegenseitig an. Sie plädieren also dafür, ein bisschen häufiger unglücklich zu sein? Absolut. Es ist doch kerngesund, mir in gewissen Zeiten einzugestehen, dass ich todunglücklich bin. Und das zu Recht. Weil ich vom Schicksal heimgesucht wurde, weil mir jemand Liebes entrissen wurde, weil ich eine niederschmetternde Diagnose bekommen habe. Es ist gesund, diese negativen Gefühle und Gedanken zuzulassen. Wenn man das ablehnt, führt das zu einer problematischen Selbstverleugnung.  Affirmationen «Du musst es nur wollen!» – Das Geschäft mit dem Wunschdenken Sie sagen auch, Manifestieren sei überheblich. Wie meinen Sie das? All die Privilegien, die ich als Schweizer habe, mein gesundes Elternhaus, das mich gefördert hat, Freunde, die sich für mich eingesetzt haben, Menschen, die mir Türen geöffnet haben und so weiter. All die Begleitfaktoren, die dazu führen, dass einem etwas Gutes widerfährt, werden ausgeblendet und auf einen einzigen Faktor zurückgeführt: Ich hatte positive Erwartungen und werde nun dafür belohnt. Und inwiefern ist das Konzept vom Manifestieren unbarmherzig? Wenn alle für ihr eigenes Glück verantwortlich sind, dann sind auch alle für ihr Unglück verantwortlich: Eine alleinerziehende Mutter, die kämpft, ihre drei Kinder durchzubringen, am Ende des Monats kein Geld mehr hat und im Winter nicht weiss, wie sie die Wohnung heizen soll – die ist einfach selber schuld an ihrer Misere. Die hat die Million Franken nicht erfolgreich manifestiert. Das ist wirklich unsäglicher Humbug! Sie sagten, dass Manifestieren auch Wahrheitsmomente hat. Welche sind das? Ich kann dem Grundgedanken natürlich etwas abgewinnen: Denke positiv, weil das Gutes anzieht. Wir nehmen die Welt anders wahr, wenn wir mit einer positiven Erwartungshaltung in den Tag gehen. Wir konzentrieren uns in unserer Wahrnehmung auf das Positive und können am Abend mehr Positives nennen. Das ist aber kein magisches Gesetz der Anziehung. Das hat ganz einfach mit der Wahrnehmungspsychologie des Menschen zu tun. Das Gespräch führte Mariel Kreis."
Budimir sei Dank: Kroatien siegt und schnappt sich EM-Ticket,https://www.srf.ch/sport/fussball/em-qualifikation/em-qualifikation-round-up-budimir-sei-dank-kroatien-siegt-und-schnappt-sich-em-ticket,"Tue, 21 Nov 2023 23:11:13 +0100","time.struct_time(tm_year=2023, tm_mon=11, tm_mday=21, tm_hour=22, tm_min=11, tm_sec=13, tm_wday=1, tm_yday=325, tm_isdst=0)","In der letzten EM-Quali-Partie sprang der Vize-Weltmeister von 2018 doch noch auf den direkten EM-Zug auf. Dies dank einem knappen Arbeitssieg in Zagreb gegen Armenien – nach zuletzt zwei Niederlagen (gegen Wales und die Türkei) in Folge. Der Held des Abends war Osasunas Torjäger Ante Budimir, der kurz vor der Halbzeit mit Köpfchen für den einzigen Treffer zuständig war und damit erstmals in der EM-Quali für Kroatien traf. Lange lag Wales zuhause gegen die bereits qualifizierte Türkei in Front. Doch selbst ein Sieg hätte den Walisern aufgrund von Kroatiens Heimerfolg nicht zur direkten Qualifikation gereicht. Neco Williams hatte das Heimteam nach sieben Minuten mit einem schönen Schlenzer in Führung geschossen. Yusuf Yazici traf in der 70. Minute mittels Penalty zum Ausgleich. Um ein Haar wäre Frankreich im letzten Spiel erwischt worden. Ein sehenswertes Weitschusstor von Youssouf Fofana eine Viertelstunde vor Schluss rettete den in dieser EM-Quali bislang makellosen Franzosen zumindest noch ein Remis. Nach den ersten 45 Minuten hatte die Equipe von Didier Deschamps dank einem Tor aus spitzem Winkel von Randal Kolo Muani (42.) mit einer Länge in Führung gelegen. Nach dem Seitenwechsel drehten die Griechen in Athen das Spiel innert fünf Minuten zu ihren Gunsten. Sehenswert war insbesondere die Direktabnahme von Anastasios Bakasetas zum 1:1 in der 56. Minute. Drei Tage nach der 0:14-Demontage in Frankreich traf Fussballzwerg Gibraltar auf die zweite in dieser Gruppe bereits für die EURO qualifizierte Nation. Gegen die Niederlande hatten die Gibraltarer im Hinspiel nur mit 0:3 verloren. Im Rückspiel an der Südküste Spaniens war der Bann nach zehn Minuten und Calvin Stengs' erstem von an diesem Abend drei Toren gebrochen. Vor dem Pausenpfiff folgten noch die Treffer zum 0:2 und 0:3. Nach Stengs' Doppelpack (50./62.) durfte sich zusätzlich Liverpool-Stürmer Cody Gakpo über ein Erfolgserlebnis freuen."
Auch Österreich düpiert inferiores Deutschland,https://www.srf.ch/sport/fussball/test-laenderspiele/2-0-sieg-im-testspiel-auch-oesterreich-duepiert-inferiores-deutschland,"Tue, 21 Nov 2023 22:45:38 +0100","time.struct_time(tm_year=2023, tm_mon=11, tm_mday=21, tm_hour=21, tm_min=45, tm_sec=38, tm_wday=1, tm_yday=325, tm_isdst=0)",Deutschland kommt auch unter dem neuen Trainer Julian Nagelsmann nicht in die Gänge. Der vierfache Weltmeister zog in einem überraschend einseitigen Nachbarsduell mit Österreich den Kürzeren. Beim 2:0 überzeugten die Einheimischen das Wiener Publikum mit zwei sehenswerten Toren. Nach einer halben Stunde tanzte Marcel Sabitzer im Zentrum einer unsortierten deutschen Abwehr Jonathan Tah aus und traf mit einem platzierten Schuss zum 1:0. In der 2. Halbzeit veredelte Christoph Baumgartner eine schöne Passstafette mit einem Heber über Goalie Kevin Trapp (73.). Kurz nach der Pause hatte Leroy Sané Deutschland empfindlich geschwächt und nach einem Ausraster die erste rote Karte seiner Profi-Laufbahn gesehen. Der Sieg der überlegenen Österreicher hätte gar noch höher ausfallen können. Nach der 2:3-Heimniederlage vom Samstag gegen die Türkei verliert Deutschland erneut und muss 7 Monate vor der EM-Endrunde im eigenen Land den nächsten Rückschlag einstecken.
Schweizer Curling-Teams siegreich – Frauen im Halbfinal,https://www.srf.ch/sport/mehr-sport/curling/curling-em-in-aberdeen-schweizer-curling-teams-siegreich-frauen-im-halbfinal,"Tue, 21 Nov 2023 22:32:05 +0100","time.struct_time(tm_year=2023, tm_mon=11, tm_mday=21, tm_hour=21, tm_min=32, tm_sec=5, tm_wday=1, tm_yday=325, tm_isdst=0)","Die Schweizer Curlerinnen haben an der EM in Aberdeen auch das 6. Spiel für sich entschieden. Gegen die Aufsteigerinnen aus Estland bekundete das Team um Skip Silvana Tirinzoni aber mehr Mühe als erwartet und siegte nur knapp mit 6:5. Den Unterschied machten Tirinzoni, Alina Pätz, Selina Witschonke und Carole Howald mit einem Zweierhaus im 7. End, das ihnen die 6:4-Führung brachte. Die Estinnen kamen zwar noch einmal heran, mit dem Vorteil des letzten Steins brachten die Frauen des CC Aarau den Sieg aber ins Trockene.  Auf den 6. liessen die Schweizerinnen wenige Stunden später den 7. Sieg folgen. Tirinzoni und Co. schlugen Gastgeber Schottland in einer engen Partie mit 5:2. Nur einmal, im 8. End, konnte ein Team mehr als einen Stein schreiben – es waren die Schweizerinnen. Nach dem 9. End gaben die Schottinnen auf. Damit schafft die Schweiz bereits nach 7 Runden den Einzug in den Halbfinal. Dafür war ein Platz unter den besten 4 nach der Round Robin notwendig – davon sind sie nicht mehr zu verdrängen. Das Männer-Team um Skip Yannick Schwaller musste im 5. End den Gegnern aus Deutschland gleich 4 Steine überlassen und geriet mit 2:4 in Rückstand. Doch die Schweizer Equipe reagierte prompt: Mit einem Zweierhaus im 6. End bewerkstelligte man den Ausgleich zum 4:4 und in den beiden folgenden Ends stahlen die Schweizer jeweils 2 Steine. Das 4:8 nach 8 Ends war eine zu grosse Hypothek für die Deutschen."
Frauen-Nati: Gertschen übernimmt interimistisch,https://www.srf.ch/sport/fussball/frauen-nationalteam/nach-trennung-von-grings-frauen-nati-gertschen-uebernimmt-interimistisch,"Tue, 21 Nov 2023 10:22:15 +0100","time.struct_time(tm_year=2023, tm_mon=11, tm_mday=21, tm_hour=9, tm_min=22, tm_sec=15, tm_wday=1, tm_yday=325, tm_isdst=0)","Die kurzfristige Nachfolge von Inka Grings ist geregelt: Reto Gertschen wird in den beiden kommenden Spielen der Women’s Nations League gegen Schweden (1. Dezember) und Italien (5. Dezember) als Cheftrainer des Frauen-Nationalteams an der Seitenlinie stehen. Unterstützt wird Gertschen von Selver Hodzic, der schon Grings assistiert hat. Seit 2017 ist Gertschen als Ressortleiter Trainerausbildung beim Schweizerischen Fussballverband tätig. Der 58-jährige Berner weist Erfahrung als Coach der Schweizer U18- und U20-Auswahlen auf. Als Aktiver lief Gertschen in der damaligen Nationalliga A für die Young Boys, Lausanne, Sion, Servette und St.Gallen auf. 1990 absolvierte er gegen die USA sein einziges Spiel für die Nati. Der SFV und Grings hatten die Zusammenarbeit letzte Woche beendet. Gertschen wird am Freitag offiziell vorgestellt. Gleichzeitig wird das Kader für den Nations-League-Zusammenzug bekanntgegeben."
"«Wenn ich Hochdeutsch schreibe, ist das quasi eine Übersetzung»",https://www.srf.ch/news/gesellschaft/pedro-lenz-wenn-ich-hochdeutsch-schreibe-ist-das-quasi-eine-uebersetzung,"Tue, 21 Nov 2023 18:48:39 +0100","time.struct_time(tm_year=2023, tm_mon=11, tm_mday=21, tm_hour=17, tm_min=48, tm_sec=39, tm_wday=1, tm_yday=325, tm_isdst=0)","«Er schenkt der Schweizer Literatur den Humor und dem Schweizer Humor die Literatur.» Mit diesen Worten wurde Pedro Lenz am vergangenen Sonntag der Jonathan-Swift-Preis übergeben. Der Schriftsteller und Kolumnist erhält die Auszeichnung für komische und satirische Literatur, welche mit 20'000 Franken dotiert ist. Er folgt damit auf den Musiker und Autor Sven Regener, der die Auszeichnung 2022 erhalten hatte. Der Jonathan-Swift-Preis ist für Pedro Lenz bei weitem nicht die erste Ehrung, die er erhält. Sein grösster Erfolg «Der Goalie bin ig» brachte ihm den Literaturpreis des Kantons Bern (2010) sowie den Schillerpreis für Literatur der Deutschen Schweiz (2011) ein. Die dazugehörige Romanverfilmung wurde 2014 mit dem Schweizer Filmpreis und dem Quartz für das beste Drehbuch geehrt. Hinzu kommen diverse Auszeichnungen für andere Werke.  Der Jonathan-Swift-Preis ist für den 58-Jährigen ein Novum. Er habe noch nie einen Preis für Humor erhalten, sagt er gegenüber «Gesichter & Geschichten». In der Regel sei der Humor in der Literatur eher eine Bremse als ein Förderkriterium, fügt er an.  Die zur Preisübergabe geladenen Gäste sind sich einig darüber, was Lenz’ Texte so erfolgreich macht. Gina Walter lobt: «Mir gefällt die Greifbarkeit, die sie haben. Es sind wirklich lustige, reale Situationen, die perfekt in Worte gefasst sind. So fühlt es sich für mich an.» Besonders greifbar sind die Texte wohl auch, weil sie meist auf Berndeutsch geschrieben sind. Obschon Lenz mit Werken wie «Primitivo» (2020) oder «Die schöne Fanny» (2017) auch schon hochdeutsche Bücher veröffentlicht hat, schreibt er am liebsten auf Mundart: «Wieso sollte ich nicht schreiben, wie meine Leserinnen und Leser sprechen? Das gibt mehr Nähe. Wenn ich Hochdeutsch schreibe, ist das quasi eine Übersetzung.»  Für Beni Thurnheer (74) macht es der besondere Stil aus, den Lenz in seinen Texten zeigt. Bei Mundarttexten bestehe immer die Gefahr, dass Schreibende zeigen möchten, dass sie eine besonders reine Mundart sprechen. «Pedro Lenz macht das nicht. Er will einfach Geschichten erzählen und dass jeder ihn versteht», sagt der ehemalige TV-Moderator. Zurzeit arbeitet Lenz an neuen Projekten, verrät jedoch noch nicht viel darüber. Stattdessen zitiert er seinen Schriftstellerkollegen Alex Capus (62): «Über ungelegte Eier sollte ein Huhn nicht gackern.» Seinen Lesern bleibt vorerst also nur übrig, gespannt auf das nächste Werk aus Lenz’ Feder zu warten."
Fremdplatzierte Kinder sollen mitbestimmen dürfen,https://www.srf.ch/news/schweiz/studie-zu-pflegekindern-fremdplatzierte-kinder-sollen-mitbestimmen-duerfen,"Tue, 21 Nov 2023 13:40:46 +0100","time.struct_time(tm_year=2023, tm_mon=11, tm_mday=21, tm_hour=12, tm_min=40, tm_sec=46, tm_wday=1, tm_yday=325, tm_isdst=0)","Rund 200'000 Kinder und Jugendliche in der Schweiz leben in schwierigen familiären Verhältnissen: ihre Eltern sind überfordert, vernachlässigen das Kind oder sind gewalttätig, süchtig. Wenn es aus diesen oder anderen Gründen für die Entwicklung des Kindes besser ist, das Elternhaus über kurz oder lang zu verlassen, schalten sich die Behörden ein.  Sie suchen eine Lösung – sei es bei Verwandten, in einem Heim oder bei Pflegefamilien. Das Wissen über diese Vorgänge war bisher begrenzt – nicht einmal die Zahl der betroffenen Familien respektive der Pflegekinder wird erfasst.  Das Forschungsprojekt «Pflegekinder – next generation» soll nun Licht ins Dunkel bringen: Es soll die Grundlagen liefern, um Abläufe und Strukturen für die betroffenen Familien zu vereinheitlichen und zu verbessern.  Die Studie entstand unter der Leitung der Palatin-Stiftung in Zusammenarbeit mit der Konferenz der kantonalen Sozialdirektorinnen und -direktoren (SODK), dem Bundesamt für Sozialversicherungen (BSV), der Konferenz für Kindes und Erwachsenenschutz (Kokes) sowie den Fachorganisationen Integras und PACH. In den letzten drei Jahren haben die Forschenden die kantonalen Pflegekindersysteme miteinander verglichen und auch in den Bereichen «Partizipation» und «Gute Begleitung» Studien durchgeführt. In der ersten vergleichenden Studie zur Situation in den Kantonen möchte Co-Autor Stefan Schnurr von der Fachhochschule Nordwestschweiz (FHNW) kein «Best-of» nennen. Er spricht von einem Flickenteppich, der dringend einheitliche Standards im Pflegekinderwesen brauche. «In welchem Kanton ein Kind aufwächst, ist mitentscheidend für seine Erfahrungen als Pflegekind», sagt Stefan Schnurr vom Institut Kinder- und Jugendhilfe der Hochschule für Soziale Arbeit FHNW. Damit Pflegekinder in allen Kantonen geborgen und sicher aufwachsen können, braucht es Konzepte und Standards. Zentral wären sie bei den Fragen: Auf dem Papier haben die Kinder und Jugendlichen heute schon Mitspracherechte, wenn es darum geht, eine Pflegefamilie zu finden. Gemäss «Pflegekinder – next generation» müssen sie jedoch tatsächlich mitreden können, auch nach dem Entscheid einer Fremdplatzierung. Hier sehen die Studienverantwortlichen auf kantonaler und nationaler Ebene Handlungsbedarf. Die Studien kommen weiter zum Schluss, dass es eine ständige Begleitung aller Beteiligten braucht. Im Notfall müsste Unterstützung rund um die Uhr erreichbar sein, denn Krisen halten sich nicht an Bürozeiten. Auch der Bundesrat sieht Handlungsbedarf, wie er Anfang Jahr in einer Antwort ans Parlament festhielt. Die massgebende Pflegekinderverordnung wurde vor über einem Jahrzehnt letztmals angepasst. Das Forschungsprojekt liefert die Basis für weitere Entscheide. Parallel dazu klärt das Bundesamt für Justiz ab, ob künftig eine nationale Statistik über die Zahl von ausserfamiliär untergebrachten Kindern geführt werden sollte. Für Schnurr wäre auch zentral, dass nach dem Entscheid, ein Kind aus seinem Elternhaus zu nehmen und in eine Pflegefamilie zu geben, der Kontakt zu den leiblichen Eltern nicht abbrechen dürfe. Sonst sei später in einer entspannteren Phase ein «Heimkehren» nicht möglich. Übergänge wie etwa die Schritte in die Selbständigkeit brauchen gemäss Studie auch Aufmerksamkeit. Je nach Kanton endet das Pflegeverhältnis mit 18 oder 25 Jahren. Werden die Pflegekinder verabschiedet und quasi vor die Türe gestellt, besteht die Gefahr, dass sie in die nächsten ganz praktischen Probleme straucheln: Wohin? Reicht das Geld für eine Wohnung oder ein Zimmer irgendwo?  Klar ist: Im Pflegekinderwesen gibt es viele offene Fragen – und Handlungsbedarf."
