title,link,published,published_parsed,article_content
"Schockierende Hamas-Videos veröffentlicht: «Mutter, ich habe zehn Juden getötet!»",https://www.blick.ch/ausland/schockierende-hamas-videos-veroeffentlicht-mutter-ich-habe-zehn-juden-getoetet-zehn-id19155990.html,"Sat, 18 Nov 2023 02:01:40 GMT","time.struct_time(tm_year=2023, tm_mon=11, tm_mday=18, tm_hour=2, tm_min=1, tm_sec=40, tm_wday=5, tm_yday=322, tm_isdst=0)","Am vergangenen Mittwoch lud die israelische Botschaft in Berlin Journalisten und Politiker ein. Den Gästen wurde ein 43-minütiger Film vorgeführt, bestehend aus Aufnahmen von Bodycams, Überwachungskameras und abgehörten Telefonaten der Hamas. Die Dokumentation wurde von der «Welt» protokolliert – und zeichnet ein schreckliches Bild. So ist auf einem mitgeschnittenen Telefonat eine freudige Stimme zu hören. «Mutter, dein Sohn hat heute zehn Juden getötet! Mit meinen eigenen Händen habe ich sie getötet», berichtet ein Terrorist. «Ich rufe dich vom Telefon eines toten Juden an! Ich habe zehn Juden getötet! Ihr Blut ist an meinen Händen. Mutter, dein Sohn ist ein Held!» Am anderen Ende ist daraufhin zu hören, wie die Mutter zu weinen beginnt. Im Hintergrund ist der Vater zu hören. Begeistert von den abscheulichen Taten seines Sohnes ruft er: «Töte! Töte! Töte! Töte!» Auch Aufnahmen vom Angriff auf das Supernova-Musikfestival konnten die israelischen Behörden sicherstellen. Auf Videos sind Menschen zu sehen, die auf einer Tanzfläche in der Wüste feiern. Plötzlich sind Schüsse zu hören. Es bricht Panik aus, die Partygäste rennen in Massen weg vom Festivalgelände. Laut neusten Zahlen wurden beim Terrorangriff auf das Musikfestival mindestens 350 Personen getötet. Aufnahmen einer Bodycam dokumentieren dabei die Vorgehensweise eines Hamas-Terroristen: Mit einer Maschinenpistole steht er vor eine Reihe von Toilettenkabinen und schiesst seelenruhig auf jede einzelne. (obf)"
Die grosse Übersicht: 7 Fakten zu Mindestlöhnen in der Schweiz,https://www.blick.ch/wirtschaft/die-grosse-uebersicht-7-fakten-zu-mindestloehnen-in-der-schweiz-id19157539.html,"Sat, 18 Nov 2023 17:04:46 GMT","time.struct_time(tm_year=2023, tm_mon=11, tm_mday=18, tm_hour=17, tm_min=4, tm_sec=46, tm_wday=5, tm_yday=322, tm_isdst=0)","Vor einem Viertel-Jahrhundert: Im November 1998 haben die Delegierten am Kongress des Schweizerischen Gewerkschaftsbunds ihre erste Mindestlohn-Kampagne lanciert. Wie sieht es 25 Jahres später bei den Tieflöhnen in der Schweiz aus? Was läuft derzeit auf politischer Ebene. Einige Fakten. Im Jahr 2014 sagte das Volk Nein zur eidgenössischen Mindestlohninitiative. Obwohl es keinen Mindestlohn (4000 Franken monatlich sollten es sein) auf nationaler Ebene gibt, haben seitdem die Kantone Neuenburg, Jura, Genf, Tessin und Basel-Stadt aufgrund kantonaler Volksinitiativen einen Mindestlohn beschlossen. In diesem Jahr sagten die Städte Zürich und Winterthur Ja zu ähnlichen Mindestlohn-Initiativen. In Winterthur soll dieser mindestens 23 Franken pro Stunde und in Zürich mindestens 23.90 Franken pro Stunde betragen. Hochgerechnet auf ein Pensum von 100 Prozent entspräche dies rund 4100 bis 4300 Franken monatlich, mal 13. Allerdings sind Rekurse eingegangen. Ob sie Anfang 2024 in Kraft treten, ist noch offen. «Es ist noch nicht vorbei», hiess es diese Woche an der Jubiläumstagung zum Mindestlohn der Gewerkschaften. Demnach laufen Mindestlohn-Initiativen auch in den Kantonen Solothurn, Basel-Landschaft, Waadt und Wallis sowie in der Stadt Luzern. In den Kantonen Freiburg, Appenzell Ausserrhoden, St. Gallen und Thurgau sowie in den Städten Bern und Biel fänden Diskussionen für die Einführung eines Mindestlohns statt, so die Gewerkschafter. Sie bestätigen: «Die Tieflohnbeschäftigung hat in den vergangenen Jahren abgenommen.» Verschwunden seien Tief- und auch Armutslöhne nicht. Als Tieflohn werden international die Löhne bezeichnet, die unter 66 Prozent des Medianlohns der Gesamtwirtschaft liegen. Gemäss der Statistik hatten 2020 in der Schweiz 16 Prozent der Frauen und 8 Prozent der Männer einen Tieflohn. Sprich: ein Bruttomonatslohn von weniger als 4399 Franken auf eine 40-Stundenwoche gerechnet. Laut einer eigenen Auswertung des Gewerkschaftsbundes der Lohnstrukturerhebung 2020 des BFS bleiben das Gastgewerbe, die Reinigung und auch der Detailhandel Tieflohnbranchen. «Besonders virulent ist das Tieflohnproblem in den persönlichen Dienstleistungen, darunter Coiffeure- und Kosmetikstudios, wo mehr als die Hälfte der Beschäftigten einen Tieflohn verdient», heisst es bei den Gewerkschaften auf Nachfrage. Hierzu gehören auch die Mitarbeiterinnen und Mitarbeiter der 1100 Schweizer Tankstellenshops. Die tiefsten Mindestlöhne gibt es im Tessin, ab 3600 Franken pro Monat. Im Wallis, Jura, Graubünden, Schaffhausen und im Thurgau liegt der Mindestlohn bei 3730 Franken, in der übrigen Schweiz bei 3830 Franken. Mit den deutschen Discountern Aldi und Lidl wuchs in den vergangenen Jahren nicht nur der Wettbewerb um tiefere Preise im Laden, sondern auch um Mitarbeitende an der Verkaufsfront. Und dieser Wettbewerb wird auch über die Löhne ausgetragen. Bei Denner erhalten Ungelernte bei einem Pensum von 100 Prozent neu 4400 Franken im Monat. Ein Blick zu Lidl und Aldi zeigt: Bei Lidl sind es derzeit ohne Ausbildung 4500 Franken monatlich. Aldi Suisse ist der Mindestlohn-Spitzenreiter: 2023 bekommen Angestellte zumindest 4646 Franken pro Monat. Weniger als die statistische Tieflohngrenze von 4399 Franken pro Monat erhalten Ungelernte bei Coop und Migros (Mindestlohn 4200 Franken). Allerdings kommt es auch auf die sozialen Leistungen und Zahlungen an die Pensionskasse der Arbeitgeber sowie Ferientage an. Die Sozialpartner im Gastgewerbe haben sich bereits im Juli 2023 auf die Mindestlöhne für das kommende Jahr geeinigt. Mindestlöhne gemäss L-GAV in Franken pro Monat (brutto): Mitarbeitende ohne Berufslehre verdienen neu 3666 Franken, Mitarbeitende mit eidg. Fähigkeitszeugnis und Weiterbildung 4576 Franken.  400'000 Arbeitnehmende können sich freuen! Nach intensiven Verhandlungen haben sich die Sozialpartner Mitte November auf einen neuen Gesamtarbeitsvertrag Personalverleih für die nächsten vier Jahre geeinigt. Dieser bringt Ungelernten einen Mindestlohn von 3744.86 Franken im kommenden Jahr. Der Hochlohn für Ungelernte Temporärkräfte beträgt 3951.26 Franken monatlich."
Handy-Abo-Werbung kann in die Irre führen: Lass dich vom «lebenslangen Rabatt» nicht täuschen!,https://www.blick.ch/wirtschaft/handy-abo-werbung-kann-in-die-irre-fuehren-lass-dich-vom-lebenslangen-rabatt-nicht-taeuschen-id19157197.html,"Sat, 18 Nov 2023 16:19:41 GMT","time.struct_time(tm_year=2023, tm_mon=11, tm_mday=18, tm_hour=16, tm_min=19, tm_sec=41, tm_wday=5, tm_yday=322, tm_isdst=0)","Sie sind verlockend, die Werbeversprechen der Verkäufer von Handy-Abos. Gerade in den Tagen vor dem Black Friday – er findet am 24. November statt, also in der kommenden Woche – haben sie Hochkonjunktur. Lidl zum Beispiel: Statt 19.95 Franken kostet das Connect & Smart Abo nur 9.90 Franken. «50 Prozent lebenslanger Rabatt», verspricht der Discounter. Klingt gut. Aber auch das Angebot von Wingo ist allgegenwärtig: Internet für daheim statt 69.00 für 39.95 Franken monatlich. Auch hier gilt der Rabatt das ganze Leben lang. Zu schön, um wahr zu sein? An solchen Lebenslang-Angeboten ist nichts auszusetzen, die Anbieter bewegen sich auf legalem Boden. Auffallend dennoch: Das Angebot ist auf eine kurze Zeit begrenzt. Jetzt musst du zuschlagen, suggeriert die Werbung. Kaufdruck ist da. Was bei der Konsumjagd auf der Strecke bleibt, ist darum ein genauer Check dieses Werbeversprechens. «Mit dem lebenslangen Rabatt kann natürlich getrickst werden», sagt Oliver Zadori (40) zu Blick. Der Betreiber der Vergleichsplattform dschungelkompass.ch nimmt täglich solche Angebote unter die Lupe. Auf das Beispiel von Lidl bezogen, führt Zadori aus: Anstatt 19.95 Franken resultiere ein absoluter Rabatt von 10.05 Franken oder ein prozentualer von 50 Prozent. Das wird relevant, wenn sich der Listenpreis irgendwann ändern sollte – zum Beispiel von 19.90 auf 24.90 Franken. Zadori rechnet vor: Mit dem prozentualen Rabatt (50 Prozent) beträgt der neue Preis dann 12.45 Franken. Mit dem absoluten Rabatt (10.05 Franken) kostet das Abo hingegen neu 14.85 Franken. Grundsätzlich sei man aber mit diesem «lebenslangen Rabatt» ziemlich sicher, so der Telekom-Experte. «Die meisten dieser Angebote haben eine Kündigungsfrist von zwei Monaten.» Das sieht auch Jean-Claude Frick (50) von comparis.ch so. Er gibt ausserdem zu bedenken: «Inzwischen haben praktisch alle Provider Klauseln drin, dass die Preise ‹inflationsbedingt› angepasst werden können.»  Laut dschungelkompass.ch haben in diesem Sommer einige Abo-Anbieter ihre Listenpreise bereits zwischen 2 und 4 Prozent angehoben. Lidl hat beispielsweise die Listenpreise noch nicht erhöht. Darum sei eine kurze Kündigungsfrist ohne Mindestvertragszeit wichtig, findet Telekom-Experte Frick. «Aufpassen muss man, wenn das Angebot zwar lebenslang gilt, aber eine Mindestlaufzeit von, sagen wir mal, 24 Monaten hat. Dann kann man nicht vorher aus dem Abo raus, falls man bei der Konkurrenz etwas Günstigeres findet.»"
SP-Badran attackiert SVP-Nationalrat in der «Arena» zu Wohnungsnot: «Das wäre ein Aufruf zu illegalem Verhalten»,https://www.blick.ch/politik/sp-badran-attackiert-svp-nationalrat-in-der-arena-zu-wohnungsnot-das-waere-ein-aufruf-zu-illegalem-verhalten-id19156873.html,"Sat, 18 Nov 2023 12:25:49 GMT","time.struct_time(tm_year=2023, tm_mon=11, tm_mday=18, tm_hour=12, tm_min=25, tm_sec=49, tm_wday=5, tm_yday=322, tm_isdst=0)","Thema Wohnungsmarkt: Hitzige Debatten sind vorprogrammiert, wenn Mieter und Hauseigentümer aufeinandertreffen. Kein Wunder, gab es auch am Freitagabend in der SRF-Sendung «Arena» zünftige Wortgefechte. Einziger Konsens: Die Mieten in der Schweiz steigen ohne Ende. Das wars aber auch schon mit der Einigkeit. Im Auge des Sturms: Manfred Bühler (44), SVP-Nationalrat und Vorstandsmitglied des Hauseigentümerverbands des Kantons Bern, und FDP-Nationalrat Beat Walti (54) auf der einen Seite. Auf der anderen: Michael Töngi (56), Grünen-Nationalrat sowie Vizepräsident des Mieterinnen- und Mieterverbands, und Jacqueline Badran (62). Es geht hin und her. Dann ruft SVP-Mann Bühler zur Besonnenheit auf: «Meiner Meinung nach ist es nicht so dramatisch, wie es gemeinhin dargestellt wird.» Damit meint er die steigenden Preise, die die Haushalte bei der Wohnungsmiete zu verkraften haben. Bühler sagt, dass das Wechselspiel aus Angebot und Nachfrage mehr oder weniger funktioniere. «Es gibt heute diverse Angebote: kleinere und grössere Wohnungen, günstigere und teurere Standorte. Wer im Zentrum der Städte Zürich oder Zug wohnen will, muss auch bereit sein, einen hohen Preis zu zahlen.» Zu viel für SP-Vizepräsidentin Badran. Sie wirft dem Hauseigentümer-Vertreter Bühler «Zynismus» vor. Er rufe mit seinem Gerede von Angebot und Nachfrage zu «illegalem Verhalten» auf. Bühler seinerseits kontert. Es wird laut. Fakt ist: In der Schweiz gilt die sogenannte Kostenmiete. Der Vermieter darf keinen übersetzten Ertrag aus der Mietsache erzielen. Der erlaubte Mietzins soll sich nach den Kosten des Wohnungseigentümers inklusive Hypothekarzins richten. Für neu vermietete Objekte gilt ein Rendite-Deckel von 2 Prozent über dem Referenzzinsatz. «Trotz geregelter Kostenmiete schöpfen die Vermieter illegal Milliarden Franken ab», sagt SP-Nationalrätin Badran. FDP-Nationalrat Walti spricht von Einzelfällen: «Der Generalverdacht, dass das Gros der Vermieter eine zu hohe Rendite einstreicht, ist falsch. Ein vernünftiger Vermieter will schliesslich mit der Mieterschaft nicht im Clinch liegen.» Das Thema Wohnungsmarkt und Mieten dürfte in nächster Zeit noch für viel mehr Debatte sorgen. Der Mehrheit der Schweizer Mieterschaft droht laut Studien von Raiffeisen eine weitere Mieterhöhung per 1. April 2024. Und sogar eine dritte Erhöhung bis Ende 2024 sei bereits absehbar. Basis dafür könnte schon ein weiterer Anstieg des Referenzzinssatzes im nächsten Monat sein. (uro)  Steigende Mieten:Hier findest du die Vorgaben, wie viel mehr Miete der Vermieter verlangen darf. "
"«Krasser Fall» bei Industriekonzern SFS: Zwei Stunden länger arbeiten, weniger Ferien – zum gleichen Lohn!",https://www.blick.ch/wirtschaft/krasser-fall-bei-industriekonzern-sfs-zwei-stunden-laenger-arbeiten-weniger-ferien-zum-gleichen-lohn-id19156584.html,"Sat, 18 Nov 2023 11:25:36 GMT","time.struct_time(tm_year=2023, tm_mon=11, tm_mday=18, tm_hour=11, tm_min=25, tm_sec=36, tm_wday=5, tm_yday=322, tm_isdst=0)","Lieferprobleme, hohe Energiekosten und ein starker Franken bremsen international tätige Autozulieferer derzeit massiv aus. So auch den Schweizer Industriekonzern SFS mit seiner Autozulieferer-Sparte Automotive. Die Geschäftsleitung greift zu einschneidenden Massnahmen für 950 der 2500-köpfigen SFS-Belegschaft in der Schweiz. Sie müssen seit 1. November pro Woche 2 Stunden länger arbeiten – ohne Lohnausgleich. Hinzu kommt, dass die betroffenen Angestellten im kommenden Jahr eine Ferienreduktion von 5 auf 25 Tage hinnehmen müssen. Betroffen sind die Mitarbeitenden an den St. Galler Standorten Heerbrugg und Flawil. Weitere Sparmassnahmen des Konzerns: Einstellungsstop, Verlagerungen von Mitarbeitenden innerhalb der Geschäftssparten, Stellenabbau. Die Rede ist von «Massnahmen zur Wiederherstellung der Wettbewerbsfähigkeit» von Automotive, wie die «Schweiz am Wochenende» aus einem ihr vorliegenden SFS-Schreiben an die Belegschaft zitiert. Konzern-Chef Jens Breu und der Automotive-Spartenleiter Alfred Schneider sprechen darin von einem «grossen persönlichen Beitrag», den diese Massnahmen von den Angestellten erforderten. Das Personal macht die Faust im Sack, der Unmut sei jedenfalls gross, heisst es bei der Gewerkschaft Unia. Sie ist mit einzelnen SFS-Betroffenen in Kontakt. Viele haben die neuen Konditionen geschluckt, andere wollen SFS offenbar verlassen. Den Ärger laut kundtun will derzeit niemand. Arbeitsrechtlich ist der Fall klar: Wer die Vertragsänderung mit den schlechteren Konditionen unterschreibt, stimmt zu. Dennoch bezeichnet Arbeitsrechtsspezialist Roger Rudolph von der Universität Zürich das Beispiel SFS als «krassen Fall», wie es im Artikel weiter heisst. Dies, weil die Angestellten gerade mal fünf Tage vor Inkrafttreten der Massnahmen davon in Kenntnis gesetzt worden seien. «Rasches Handeln ist Teil unserer DNA und unseres Erfolgs», sagt SFS-Chef Breu gegenüber dem «Rheintaler». Die allermeisten Mitarbeitenden würden die «temporären Massnahmen» mittragen. Sie gelten offenbar zunächst mal für 12 Monate. Ob sie verlängert werden, hängt von der Entwicklung der Automotive-Sparte ab. Immerhin: Die Chefs der Automobil-Sparte tragen die Massnahmen mit. Die Automotive-Leitung bekommt 10 Prozent weniger Lohn, die Unterchefs erhalten 7 Prozent weniger. SFS-Chef Breu will sein Salär ebenfalls um 10 Prozent kürzen."
Höhere Mieten: Wie viel darf der Vermieter von den Haushalten verlangen?,https://www.blick.ch/wirtschaft/hoehere-mieten-wie-viel-darf-der-vermieter-von-den-haushalten-verlangen-id19156639.html,"Sat, 18 Nov 2023 11:16:32 GMT","time.struct_time(tm_year=2023, tm_mon=11, tm_mday=18, tm_hour=11, tm_min=16, tm_sec=32, tm_wday=5, tm_yday=322, tm_isdst=0)","Viele haben die dicke Post schon bekommen, manchen steht sie noch bevor. Hunderte von Vermieterschaften verlangen höhere Mieten für Wohnungen. Grund ist primär der Referenzzinssatz, der im Juni dieses Jahres auf 1,5 Prozent stieg und vielleicht weiter nach oben klettert. Hinzu kommen zwei weitere Gründe, um die Miete zu erhöhen: die Teuerung und die allgemeine Kostensteigerung.  Mit der Kostensteigerung machen Vermieterschaften höhere Aufwendungen für die Wohnung geltend – zum Beispiel, dass ihre Betriebs- oder Instandstellungskosten gestiegen sind. Weil es einfacher ist, rechnen die Schlichtungsbehörden dafür mit Pauschalen, die sich in der Regel zwischen 0 und maximal 1 Prozent bewegen – je nachdem, wie alt die Liegenschaft ist oder wie viele Nebenkosten separat verrechnet werden. Konkret belegen muss die Vermieterschaft die behauptete Kostensteigerung erst vor Gericht.  Im Kanton Zürich haben die Schlichtungsbehörden ihre Praxis nun vereinheitlicht. Das heisst: Alle zwölf Behörden rechnen künftig mit den gleichen Grundsätzen, wenn es darum geht, den passenden Prozentsatz für die Pauschale zu wählen. Dieser Artikel wurde erstmals im «Beobachter» publiziert. Weitere spannende Artikel findest du unter www.beobachter.ch. Aktuell: Kostenloses Webinar ChatGPT und DatenschutzWir zeigen, wie man KI-Tools wie ChatGPT nutzt, ohne zu viel persönliche Daten preiszugeben. Das Webinar ist gratis und dauert eine Stunde – am 30. November 2023 um 18 Uhr. Hier können Sie sich anmelden. Dieser Artikel wurde erstmals im «Beobachter» publiziert. Weitere spannende Artikel findest du unter www.beobachter.ch. Aktuell: Kostenloses Webinar ChatGPT und DatenschutzWir zeigen, wie man KI-Tools wie ChatGPT nutzt, ohne zu viel persönliche Daten preiszugeben. Das Webinar ist gratis und dauert eine Stunde – am 30. November 2023 um 18 Uhr. Hier können Sie sich anmelden. Und so wird gerechnet: Bei maximal fünfjährigen Neubauten dürfen die Vermieter grundsätzlich keine Kostensteigerungen verlangen – die Pauschale beträgt 0,0 Prozent. Ansonsten kommt es darauf an, wie viele Nebenkosten die Vermieterschaft den Mietenden im Vertrag schon aufgebrummt hat. Wenn es viele sind, werden ihnen nur 0,25 Prozent Kostensteigerung angerechnet. Wenn nur wenige oder gar keine Nebenkostenpositionen separat abgerechnet werden, werden pauschal 0,5 Prozent des jährlichen Nettomietzinses eingesetzt. Diese Regeln geben betroffenen Mietenden einen Anhaltspunkt darüber, welche Pauschale man ihnen etwa verrechnen darf. Und das erleichtert ihnen, sich ausserbehördlich mit der Vermieterschaft zu einigen.  Ausnahmsweise kann von diesen Vorgaben abgewichen werden, wie das Zürcher Bezirksgericht in einer Mitteilung schreibt. Denn massgeblich sei und bleibe der konkrete Einzelfall. "
"Werner Vontobel ordnet ein: «Wertschöpfungsketten – je globaler, desto schlimmer»",https://www.blick.ch/wirtschaft/werner-vontobel-ordnet-ein-wertschoepfungsketten-je-globaler-desto-schlimmer-id19156475.html,"Sat, 18 Nov 2023 11:05:34 GMT","time.struct_time(tm_year=2023, tm_mon=11, tm_mday=18, tm_hour=11, tm_min=5, tm_sec=34, tm_wday=5, tm_yday=322, tm_isdst=0)","Unsere Urahnen hatten sehr kurze Wertschöpfungsketten. Dieselben Sippenmitglieder, die auf der Jagd ein Mammut erlegt haben, waren auch für die Herstellung von Pfeil, Bogen und Pfeilgift zuständig. Sie haben das Mammut transportiert, ausgeweidet, das Fleisch gebraten und serviert und sie sassen auch zu Tisch beziehungsweise am Lagerfeuer. Sie brauchten kein Geld, keine Werbeprospekte, keine Stellenvermittler, Lebensmittelinspekteure, Verkaufslokale. Und die Beute wurde einigermassen gerecht geteilt. Mehr als sich satt essen konnte niemand und bei der nächsten Jagd mussten alle fit sein. Inzwischen haben wir das Geld erfunden, die Arbeitsteilung vorangetrieben und wir wurden wesentlich produktiver. Doch dieser Fortschritt hat auch ein paar Schattenseiten: Die Arbeit wurde für viele eintönig und oft auch eine einsame Angelegenheit – verglichen mit dem Erlebnis einer gemeinsamen Jagd mit anschliessendem Lagerfeuer. Zudem wurden die Arbeitsabläufe viel komplexer. Der Löwenanteil der Arbeit dient heute bloss noch der Bewältigung der mit dem Markt verbundenen Komplexität. Vor allem aber verteilt die Marktwirtschaft ihre Beute sehr ungleichmässig. Dieses Problem hat sich mit den globalen Wertschöpfungsketten noch wesentlich verschärft. Je globaler diese sind, desto mehr Werte können an wenigen strategischen Punkten abgeschöpft werden. Beispiele sind die Finanzdienstleistungen, Verwaltung, Forschung und Werbung. Wer den Zugang zur globalen Kundschaft beherrscht, sahnt ebenfalls ab. Booking.com etwa nimmt 15 bis 20 Prozent des Buchungspreises und beansprucht damit mit einem kleinen Bruchteil des Arbeitseinsatzes rund die Hälfte der Wertschöpfung. Ein krasses Beispiel für konzentrierte Wertabschöpfung ist der Schweizer Schuhhersteller On. Er produziert in Vietnam, wo der Mindestlohn bei etwa einem Dollar pro Stunde liegt. Ganz oben haben sich die fünf Gründer und Topmanager 2021 je rund 16 Millionen Franken auszahlen lassen. Zudem haben sie beim Börsengang durch den Verkauf von Aktien weitere 135 Millionen Dollar verdient. 2023 haben sie bisher noch einmal rund 50 Millionen Dollar kassiert.  Dafür müssten 25'000 Textilarbeiterinnen ein Jahr lang hart arbeiten. Dazu kommt, dass diese Mehrwerte überwiegend an den globalen Hotspots abfallen – in Zug, Zürich, Genf, München, New York etc. Mit der Folge, dass dort die Mieten und die Immobilienpreise explodieren, womit die dortigen Bodenbesitzer ebenfalls zu Globalisierungsgewinnern werden. Sie knöpfen aber nicht nur den Globalisierungsgewinnern viel Geld ab, sondern schröpfen auch die Normalverdiener und Mieter an den Hotspots. Insgesamt summiert sich diese Umverteilung allein in der Schweiz auf einen hohen zweistelligen Milliardenbetrag – jährlich wohlverstanden. Das ist übel, aber es kommt noch übler: Seit etlichen Jahrzehnten gilt es als ausgemachte Sache, dass sich Randgebiete nur dadurch entwickeln können, dass sie sich in die globalen Wertschöpfungsketten einklinken. Doch weil die fetten Glieder bereits besetzt sind, müssen sie mit dem mageren Rest vorliebnehmen. Was dabei für Vietnam herausspringt, haben wir im Falle der On-Schuhe gesehen. Doch auch bei Hightech-Produkten sieht es nicht besser aus. Weil in China die Lohnkosten gestiegen sind, stellt Foxconn im Auftrag von Apple das iPhone neuerdings auch in Vietnam her – womit für dieses Land magere rund 2 Prozent der ganzen Wertschöpfung abfallen. Als sich die Schweiz zum Industrieland gemausert hat, waren die Wertschöpfungsketten noch nicht global. Sonst würden auch wir noch immer am Hungertuch nagen."
Garant für «Wohlstand und Wachstum»: Jordan plädiert für Unabhängigkeit der SNB,https://www.blick.ch/wirtschaft/garant-fuer-wohlstand-und-wachstum-jordan-plaediert-fuer-unabhaengigkeit-der-snb-id19156377.html,"Sat, 18 Nov 2023 09:23:17 GMT","time.struct_time(tm_year=2023, tm_mon=11, tm_mday=18, tm_hour=9, tm_min=23, tm_sec=17, tm_wday=5, tm_yday=322, tm_isdst=0)","«Ohne Unabhängigkeit gibt es keine freie Forschung und keine von Partikularinteressen abgeschirmte Geldpolitik», hob Jordan in seiner Rede hervor. «Unabhängigkeit ist aber weder ein Naturgesetz noch eine Selbstverständlichkeit.» Für Jordan kommt es beim Erhalt der Unabhängigkeit vor allem auf drei Punkte an. Erstens müsste die Unabhängigkeit bei der SNB effektiv gelebt werden. Für die SNB bedeute dies, dass sie «ihre Geldpolitik immer auf den Erhalt der Preisstabilität ausrichtet.» Zweitens gelte es Rechenschaft abzulegen, was die SNB regelmässig gegenüber Bundesversammlung und der Öffentlichkeit tue. Zuletzt dürften nur Ziele verfolgt werden, die auch durch das Mandat der SNB abgedeckt seien und für welche die Zentralbank die geeigneten Instrumente habe. «Eine von Partikularinteressen getriebene Ausdehnung des Aufgabenbereichs ist nicht mit der gesetzlich verankerten Unabhängigkeit vereinbar», sagte Jordan weiter. Um den gesetzlichen Auftrag erfüllen zu können, dürfe die SNB sich keinen Stillstand leisten. Sie müsse immer höchst flexibel sein, um so auf das sich schnell verändernde Umfeld reagieren zu können. In diesem Zusammenhang führte Jordan die Corona-Krise oder den Untergang der Credit Suisse an. Bei diesen Krisen habe die SNB mit schnellen Massnahmen höchste Flexibilität und Entschlossenheit unter Beweis gestellt. Zudem hätten die getroffenen Massnahmen der Bevölkerung aufgezeigt, dass sie auch in Krisenzeiten auf die Institution vertrauen können. «Ein eng definiertes Mandat bei gleichzeitig grossem Handlungsspielraum in seiner Umsetzung ist ganz besonders in solch akuten Krisensituationen entscheidend für den Erfolg unserer Institutionen,» sagte Jordan. Es zahle sich daher aus, «stur beim Auftrag, aber flexibel in seiner Umsetzung» zu sein. (SDA)"
