title,link,published,published_parsed,article_content
Die Lage in der Ukraine – die Übersicht,https://www.srf.ch/news/international/krieg-in-der-ukraine-die-lage-in-der-ukraine-die-uebersicht,"Mon, 20 Nov 2023 16:49:42 +0100","time.struct_time(tm_year=2023, tm_mon=11, tm_mday=20, tm_hour=15, tm_min=49, tm_sec=42, tm_wday=0, tm_yday=324, tm_isdst=0)","Die ukrainische Armee hat nach eigenen Angaben an der fast 100 Kilometer langen Front im Osten und Süden erneut Dutzende russischer Angriffe abgewehrt. Der Lagebericht des Generalstabs in Kiew verzeichnete für Sonntag 46 russische Sturmangriffe. Sie seien alle zurückgeschlagen worden, hiess es.  Schwerpunkte seien die Städte Marjinka (16 russische Angriffe) und Awdijiwka (12 russische Angriffe) nahe der russisch kontrollierten Donbass-Hauptstadt Donezk gewesen. Diese Militärangaben waren nicht unabhängig überprüfbar.  Das ukrainische Militär setzt sich eigenen Angaben zufolge in der umkämpften Region Cherson südöstlich des Flusses Dnipro fest. «Die Verteidigungskräfte halten weiterhin Stellungen am linken Ufer des Dnipro in der Region Cherson», teilte der Generalstab am Sonntagabend auf Facebook mit.  Zuvor hatte die Sprecherin der Kommandostelle Süd, Natalja Humenjuk, gesagt, die ukrainischen Armee habe die Russen am bis vor kurzem noch vollständig besetzten linken Ufer nun schon drei bis acht Kilometer vom Fluss weggedrängt. Auch internationale Beobachter hatten zuletzt von Vorstössen der Ukrainer in dem Gebiet berichtet. Cherson in der Südukraine war kurz nach dem russischen Einmarsch am 24. Februar 2022 grösstenteils besetzt worden.  Ein Vorstoss über den Dnipro ist für die ukrainische Armee von entscheidender Bedeutung. Der Transport schwerer militärischer Ausrüstung und von Vorräten über den Fluss könnte es den ukrainischen Truppen ermöglichen, eine neue Angriffslinie im Süden auf dem direktesten Landweg zur Schwarzmeer-Halbinsel Krim zu eröffnen, die 2014 von Russland annektiert wurde. Die Lage im Schwarzen Meer hat sich nach Ansicht des ukrainischen Präsidenten Wolodimir Selenski in den vergangenen Monaten zugunsten seines Landes verbessert. «Es ist uns gelungen, Russland im Schwarzen Meer die Initiative zu entreissen», sagte Selenski in Kiew. Dort tagte die Parlamentarische Versammlung der Schwarzmeer-Wirtschaftskooperation (PABSEC). Mit Beginn des Angriffskrieges im Februar 2022 blockierte Russland die ukrainische Schwarzmeerküste zunächst völlig; die Ukraine verlor ihre Marine. Später liess Moskau in einer Vereinbarung mit der Türkei und den Vereinten Nationen begrenzte ukrainische Getreideexporte per Schiff zu.  Seit August betreibt die Ukraine einen Seekorridor Richtung Bosporus ohne russische Sicherheitsgarantien. Bislang haben nach ukrainischen Angaben 151 Frachter den temporären Korridor im Schwarzen Meer genutzt. Militärischer Hintergrund sind ukrainische Erfolge wie die Versenkung des russischen Kreuzers «Moskwa» und die Rückeroberung der Schlangeninsel vor der rumänischen Küste 2022. In diesem Jahr setzte die Ukraine mit westlichen Präzisionswaffen Stellungen der russischen Flugabwehr, Militärflugplätze und Kommandozentralen auf der Halbinsel Krim ausser Gefecht. Auch mehrere Schiffe der Schwarzmeerflotte wurden schwer beschädigt.  Russland kann aber immer noch die ukrainischen Häfen am Meer und an der Donau mit Kampfdrohnen oder Raketen beschiessen. Die russischen Streitkräfte haben rund 17 Prozent der Ukraine besetzt. Sie sind derzeit im Osten erneut in der Offensive, unter anderem in der Gegend der ukrainisch kontrollierten Stadt Awdijiwka und in der Nähe der russisch kontrollierten Stadt Bachmut. Dort kommt es nach jüngsten Angaben des ukrainischen Militärs gegenwärtig auch zu einigen der bislang heftigsten Schlachten. Insgesamt tobten den Angaben zufolge aber entlang der gesamten Front vom Osten bis zum Süden Kämpfe.  Bei russischen Soldaten und ihren Angehörigen wächst nach Einschätzung britischer Experten die Kritik an langen Einsätzen in der Ukraine. Das geht aus dem täglichen Geheimdienstbericht des Verteidigungsministeriums in London zum russischen Angriffskrieg in der Ukraine am Montag hervor.  Demnach gingen am 7. November wohl zum ersten Mal seit dem Beginn der russischen Invasion im Februar 2022 Frauen russischer Soldaten in Moskau aus Protest auf die Strasse und forderten die Rotation ihrer Männer vom Einsatz an der Front. Zwar sei die Demonstration innerhalb weniger Minuten von der Polizei beendet worden, doch die Forderung sei bemerkenswert, hiess es in der Mitteilung der Briten. «Der anscheinend unbegrenzte Kampfeinsatz von Personal ohne Rotation wird zunehmend von den Soldaten selbst wie auch deren Angehörigen als nicht nachhaltig betrachtet», so die Mitteilung. Am Mittwoch findet ein virtueller G20-Gipfel statt. Der russische Präsident Wladimir Putin wird nach Angaben des Moskauer Staatsfernsehens daran teilnehmen. Putin werde da womöglich das erste Mal seit langer Zeit im Online-Format live auch wieder westliche Staatenführer sehen, berichtete das Staatsfernsehen am Sonntag. Die Ukraine will nach Worten von Präsident Wolodimir Selenski alle Vorgaben der EU-Kommission für Beitrittsverhandlungen mit der Europäischen Union erfüllen. Das sagte Selenski in seiner Videoansprache, nachdem er mit seiner Führung in Kiew über den erhofften Beitritt gesprochen hatte.  «Wir arbeiten daran, eine bedingungslose Entscheidung über die Aufnahme von Verhandlungen zu erreichen», sagte Selenski. Für die Ukraine sei es entscheidend, alle Vorgaben der Europäischen Kommission als Voraussetzung für Beitrittsverhandlungen zu erfüllen.  Kommissionspräsidentin Ursula von der Leyen sah das Land auf gutem Weg, insgesamt sieben Vorgaben zu erfüllen, darunter zur Bekämpfung der Korruption. Die Ukraine hofft, dass ein Gipfel der Staats- und Regierungschefs Mitte Dezember den Weg für Beitrittsgespräche freimacht. Selenski stellte die Aufnahme der Ukraine als Projekt für ganz Europa dar. Die Mitglieder der Asiatisch-Pazifischen Wirtschaftsgemeinschaft (Apec) haben sich bei ihrem Gipfeltreffen in San Francisco nicht auf eine gemeinsame Position zu den Kriegen in der Ukraine und in Gaza verständigen können. Eine gemeinsame Abschlusserklärung wurde am Freitagabend (Ortszeit) veröffentlicht. Darin blieben die beiden Konflikte ausgespart. Der Deutsche Bundeskanzler Olaf Scholz fordert den russischen Präsidenten Wladimir Putin auf, den ersten Schritt zu einer möglichen friedlichen Lösung in der Ukraine zu gehen. «Er muss Truppen zurückziehen», sagt der SPD-Politiker auf einem Bürgerdialog im brandenburgischen Nuthetal. Scholz sichert der Ukraine erneut Hilfe bei der Verteidigung gegen den russischen Überfall zu, solange dies nötig sei. Laut ukrainischen Streitkräften hat Russland bis jetzt 319'210 Soldaten verloren (Stand 20. November). Wie Russland macht die Ukraine in der Regel keine Angaben zu Getöteten und Verletzten in den eigenen Reihen. Der ukrainische Verteidigungsminister Olexi Resnikow hatte aber am 16. April einen Hinweis auf die ungefähre Höhe der eigenen Verluste seit Beginn des russischen Angriffskrieges gemacht. Die Opferzahl liege unter 50'000 Toten. Der russische Verteidigungsminister Sergei Schoigu bezifferte Anfang September die ukrainischen Verluste seit Beginn der Gegenoffensive Kiews auf mehr als 66'000 Soldaten. Unabhängig lassen sich die Angaben der Kriegsparteien nicht prüfen.  Über 3500 ukrainische Soldaten sind nach Angaben der Regierung in Kiew weiter in russischer Kriegsgefangenschaft. Insgesamt sei die Gefangenschaft von mehr als 4300 Ukrainern in Russland bestätigt, teilte das Ministerium für Reintegration am Freitag mit. Davon seien über 760 Zivilisten. Die Angehörigen erhalten demnach finanzielle Unterstützung vom ukrainischen Staat.  Anfang November war bekannt geworden, dass Kiew im Westteil des Landes ein zweites Gefängnis für russische Kriegsgefangene vorbereitet. Schätzungen zufolge bieten beide Einrichtungen gemeinsam Platz für etwa 900 Gefangene. Russischen Angaben nach befinden sich über 500 russische Soldaten in ukrainischer Kriegsgefangenschaft. Die Ukraine wehrt seit fast 21 Monaten eine russische Invasion ab. Dem ukrainischen Menschenrechtsbeauftragten Dmytro Lubinez zufolge wurden seither knapp 2600 Kriegsgefangene und Zivilisten von Moskau an Kiew übergeben. Moskau hat im Gegenzug eine unbekannte Zahl an Kriegsgefangenen erhalten.  Nach US-Schätzungen (Stand 18. August) könnten fast eine halbe Million Soldaten auf beiden Seiten getötet oder verwundet worden sein, zitierte die «New York Times» US-Regierungsbeamte. Diese warnten zugleich, dass die Verluste schwer einzuschätzen seien, da Kiew keine Zahlen veröffentliche und vermutet werde, dass Moskau zu geringe Zahlen nenne. Dem Bericht zufolge gehen die nicht namentlich genannten US-Beamten auf russischer Seite von 120'000 getöteten und 170'000 bis 180'000 verwundeten Soldaten aus. Für die Ukraine sprachen sie demnach von etwa 70'000 getöteten und 100'000 bis 120'000 verletzten Soldaten. Unabhängig überprüfen lassen sich diese Zahlen noch nicht. In der Ukraine benötigen gemäss der UNO rund 18 Millionen Menschen humanitäre Hilfe – das sind rund 40 Prozent der Bevölkerung. Es sei wichtig, angesichts der Lage im Nahen Osten den enormen Bedarf an Hilfe in der Ukraine nicht aus den Augen zu verlieren, sagte der UNO-Nothilfekoordinator vor dem Sicherheitsrat Ende Oktober. Durch die schweren Schäden an der Infrastruktur sei der Zugang der Zivilbevölkerung zu elementaren Dingen wie Strom, Wasser oder Heizwärme weiterhin beschränkt. Das sei gerade mit Blick auf den nahenden Winter besorgniserregend, so der UNO-Vertreter.  Zivile Opfer: Laut dem UNO-Hochkommissariat für Menschenrechte haben Beobachterinnen und Beobachter bisher über 9701 getötete und rund 17'748 verletzte Zivilpersonen durch den russischen Angriff auf die Ukraine gezählt (Stand 25. September). Es sei aber zu befürchten, dass die tatsächlichen Zahlen wesentlich höher liegen. Die UNO zählt nur Fälle, die sie unabhängig bestätigen konnte. Geflüchtete: Über 5.8 Millionen Menschen haben seit Kriegsbeginn die Ukraine verlassen und Schutz in europäischen Ländern gesucht, weltweit sind es über 6.2 Millionen (Stand 20. November). Das teilt das Flüchtlingshilfswerk der UNO (UNHCR) mit. Die Zahl der Binnenflüchtlinge beziffert die für Flüchtlingsfragen zuständige Vizeregierungschefin auf 4.9 Millionen (Stand 12. November). In letzter Zeit sei die Zahl der Binnenflüchtlinge indes kaum noch gestiegen, so Iryna Wereschtschuk. Denn: Einige Evakuierte kehrten in ihre Häuser zurück. Angesichts der humanitären Krise in der Ukraine sammelt die Glückskette Spenden für die betroffene ukrainische Bevölkerung. Millionen Menschen – vor allem Kinder, Frauen und ältere Menschen – sind bereits geflohen und suchen Zuflucht in den Nachbarländern oder in Gebieten im Landesinnern, die von Kämpfen verschont geblieben sind. Die Glückskette unterstützt geflüchtete Menschen über ihre Partnerorganisationen innerhalb der Ukraine, den Nachbarländern Polen, Rumänien, Moldawien und Ungarn sowie in der Schweiz. Spenden können unter www.glueckskette.ch oder auf das Postkonto 10-15000-6, Vermerk «Krise in der Ukraine», getätigt werden. 66'057 Personen, die wegen des Kriegs gegen die Ukraine in die Schweiz geflüchtet sind, haben einen aktiven Schutzstatus S. Das sind 40 weniger als in der Vorwoche. Bei insgesamt 19'116 Personen wurde der Status S beendet (+179). (Stand 17. November) Die Informationen zum Ukraine-Krieg sind zahlreich und zum Teil widersprüchlich. Die verlässlichsten Quellen sind eigene Journalistinnen und Reporter anderer Medien vor Ort, denen man vertrauen kann. Weitere wichtige Quellen sind Augenzeugen – also Menschen vor Ort, die Eindrücke vermitteln können. Besonders zu hinterfragen sind Informationen von Kriegsparteien. Denn alle Kriegsparteien machen Propaganda – in diesem Angriffskrieg vor allem die russischen, offiziellen Quellen. Die Aussagen der Kriegsparteien ordnen wir entsprechend ein. Grundsätzlich gilt bei SRF: Je schwieriger und unzuverlässiger die Quellenlage, desto wichtiger ist Transparenz. Umstrittene Fakten und Informationen, die nicht unabhängig überprüfbar sind, werden als solche kenntlich gemacht."
Weibliche Wut: über das Potenzial eines verpönten Gefühls,https://www.srf.ch/kultur/gesellschaft-religion/gender-und-psychologie-weibliche-wut-ueber-das-potenzial-eines-verpoenten-gefuehls,"Mon, 20 Nov 2023 19:05:38 +0100","time.struct_time(tm_year=2023, tm_mon=11, tm_mday=20, tm_hour=18, tm_min=5, tm_sec=38, tm_wday=0, tm_yday=324, tm_isdst=0)","«Ich will wütend werden können.» «SRF Input»-Hörerin Stefanie ist Mitte 20, hat einen spannenden Job, lebt in einer Beziehung – und vermisst eine ganz bestimmte Emotion: «In Situationen, in denen ich eigentlich wütend werden möchte, kommen mir die Tränen.»  Wenn sich ihr Freund zum Beispiel nicht an Abmachungen hält, wird sie traurig – und in der Folge von ihm getröstet. Wenn sie sich im Job übergangen, ungerecht behandelt oder nicht gehört fühlt, zieht sie sich zurück. «Dabei will ich eigentlich das Gegenteil: Ich will meinem Ärger Raum geben, standhaft sein und meinen Punkt klarmachen!»  Stefanie erinnert sich nicht daran, wann sie das letzte Mal richtig wütend war. Und sie will das ändern. Mit dieser Gefühlsunterdrückung ist Stefanie nicht allein: «Männer zeigen Wut im Schnitt häufiger als Frauen. In alltäglichen Situationen der Ohnmacht beispielsweise tendieren Männer dazu, zu fluchen.» Dies ist der Befund von Ad Vingerhoets, Professor für klinische Psychologie an der Tilburg Universität in Holland, nach 40 Jahren Forschung. «Frauen hingegen werden in diesen Momenten nicht wütend, sondern beginnen tendenziell zu weinen.»  Wichtig ist an dieser Stelle der Hinweis, dass es sich hierbei um Durchschnittswerte handelt. Neben dem Peak dieser Verhaltenskurven gibt es auch die nicht stereotypen Beispiele: Männer, die weinen, wenn sie an eine Grenze stossen. Und Frauen, die wütend werden.  Wut habe zu Unrecht einen schlechten Ruf, findet Psychologin und Wut-Coach Maja Herold. «Meine Patienten und Patientinnen wollen nicht wütend werden. Zu gross ist die Angst davor, die Kontrolle über die Wut zu verlieren, jähzornig oder gar gewalttätig zu werden. Sehr oft unterdrücken sie deshalb das Gefühl.»  Dabei liege in der konstruktiven Wut ein grosses Potenzial: Sie diene der Abgrenzung auf der einen Seite – und ermögliche andererseits Annäherung, sagt Herold. Aber nur, wenn der Umgang mit der Wut gelernt wurde. Das sei enorm wichtig, denn: «Wut ist eh da, auch wenn wir sie unterdrücken. Sie ist unumgänglich.» Herold unterscheidet zwischen roter und grüner Wut. Rote Wut sei die impulsive, destruktive Kraft, die gewaltvoll sein kann und an anderen oder sich selbst Schaden anrichten kann. Die grüne Wut hingegen habe einen konstruktiven Charakter.  Quellen: Maja Herold, Psychologin und Wut-Coach / Medizinisches Wörterbuch «Pschyrembel» «Input»-Hörerin Stefanie sagt über ihre Wut: «Das ist eine Emotion, die mir nicht vertraut ist. Ich kenne das Gefühl schlicht nicht.» Es sei sinnvoll, sich mit der Wut vertraut zu machen, entgegnet Wut-Coach Herold. «Auch Stefanie ist biologisch in der Lage, Wut zu verspüren.» Das sei eine Frage der Übung. Der Schlüsselbegriff aus der Psychologie dazu lautet «Containment», was mit «Haltefähigkeit» oder «Beherrschung» übersetzt werden kann. «Wenn meine Patienten und Patientinnen gelernt haben, ihre Wut zu containen, kann ihnen das zu einem selbstbestimmteren Leben verhelfen.» Mit klarem Kopf kann schliesslich das Annäherungspotenzial der Wut zum Zug kommen – und man kann dem Gegenüber den Grund für den Ärger sachlich vorbringen und das Gespräch suchen. «Darin liegt das Annäherungspotenzial der Wut», schliesst Herold.  Offen bleibt allerdings die Frage nach dem gesellschaftlichen Umgang mit Wut und den Geschlechtern. Studien aus den USA legen nahe, dass mit weiblicher Wut anders umgegangen wird als mit männlicher. Wenn Frauen ihre Wut offen zeigen, kann ihnen das in alltäglichen oder öffentlichen Situationen zum Nachteil gereichen.  In einer Studie aus dem Jahr 2014 im Rahmen einer inszenierten Geschworenenversammlung gaben Studienteilnehmende häufiger an, dass wütende Männer überzeugend seien. Wütende Frauen hingegen nicht – bei exakt gleichem Text und gleichen Argumenten.  Was machen wir damit? «Frauen müssen standhaft bleiben», sagt Wut-Coach und Psychologin Maja Herold. «Sie müssen ihrer Wut vertrauen, um ihre Grenzen zu wahren. Unabhängig vom eigenen Geschlecht ist es angezeigt, auch Kindern schon früh zeigen, dass weibliche Wut berechtigt ist.»  Ausserdem lohnt es sich für jede einzelne Person, den Stimmen im eigenen Kopf zu lauschen und sich zu fragen: «Urteile ich anders über wütende Frauen als über wütende Männer? Wie würde ich reagieren, wenn das Gleiche ein wütender Mann gesägt hätte?»  «Input» ist der Hintergrundpodcast, der sich Zeit fürs Leben nimmt. Jeden Mittwoch ab 15 Uhr online, sonntags ab 20 Uhr auf Radio SRF 3. Um diesen Podcast zu abonnieren, benötigen Sie eine Podcast-kompatible Software oder App. Wenn Ihre App in der obigen Liste nicht aufgeführt ist, können Sie einfach die Feed-URL in Ihre Podcast-App oder Software kopieren."
Was sagen Sie zu den Kräfteverhältnissen im neuen Parlament?,https://www.srf.ch/news/schweiz/wahlen-2023/staenderatswahlen-2023-politologe-fuer-die-mitte-hat-sich-der-namenswechsel-gelohnt,"Mon, 20 Nov 2023 09:03:12 +0100","time.struct_time(tm_year=2023, tm_mon=11, tm_mday=20, tm_hour=8, tm_min=3, tm_sec=12, tm_wday=0, tm_yday=324, tm_isdst=0)","In fünf Kantonen gab es am Sonntag einen zweiten Wahlgang für den Ständerat, nun ist das Parlament komplett. Politologe Georg Lutz schätzt die neue Situation in Bundesbern ein.                  Georg Lutz               Professor für Politologie      Der Politologe Georg Lutz ist Professor an der Universität Lausanne. Davor war er Projektleiter der Schweizer Wahlstudie «Selects» am Forschungszentrum Sozialwissenschaften FORS in Lausanne. SRF News: Wie wirken sich die neu geordneten Sitze auf die Kräfteverhältnisse im Parlament aus?  Georg Lutz: Grundsätzlich verändern sich die Mehrheiten nicht, dafür sind die Verschiebungen zu klein. Wichtig ist aber, was es jetzt für Signale über die künftige Positionierung der Parteien gibt. Die SVP ist in vielen Kantonen zwar stärkste Partei, aber trotzdem nicht mehrheitsfähig. Und das hat auch mit ihrer Politik im Parlament zu tun. Wenn sie da mehrheitsfähig werden wollte, dann müsste sie moderater werden.  Es zeigt sich auch ein riesiges Dilemma bei der FDP. Diese hat die SVP offiziell unterstützt, was aber weder der SVP noch der FDP genützt hat. Sie ist jetzt im Ständerat also gegenüber der Mitte eigentlich viel schwächer. Das war vorher noch nie so. Da ist die FDP jetzt gefordert.  Die Mitte wird zur Entscheidungsmacherin der kommenden vier Jahre im Ständerat. Wie wird sie sich bei Leitthemen wie der Europolitik, der Altersvorsorge, der Migration oder auch der Klimakrise positionieren? Ich denke, für die Mitte hat sich vor allem der Namenswechsel gelohnt. Da steht ja mehr als nur eine neue Etikette dahinter. Die Partei hat gerade auch in den zweiten Wahlgängen gezeigt, dass sie mehrheitsfähiger geworden ist. Besonders in Kantonen, in denen sie früher als CVP eher noch Schwierigkeiten hatte.  Für die Mitte, die jetzt in der komfortablen Situation ist, Mehrheiten sowohl im Ständerat, als auch im Nationalrat bestimmen zu können, wird es entscheidend sein, wie geschlossen die Fraktion ist. Sie war bisher eigentlich eine der am wenigsten geschlossenen Fraktionen im Parlament überhaupt. Und die Frage ist auch, wie sie im Ständerat systematisch mit der FDP zusammenarbeiten kann, um die Vormachtstellung, die sie im politischen System im Moment hat, auch nutzen zu können. Wenn sich die Mitte und die FDP clever anstellen, können sie in beiden Kammern den Ton angeben. Hierfür müsste sich die FDP aber von der SVP abwenden und sich der Mitte annähern. Für wie wahrscheinlich halten Sie dieses Szenario?  Da werden wir abwarten müssen. So komfortabel die Position der Mitte ist, so schwierig ist sie für die FDP. Denn die FDP hat eigentlich immer noch kein klares Rezept gefunden, wie sie ihr Verhältnis zur SVP gestalten will. Sie hat gemerkt, dass es Wähleranteile kostet, wenn man zu stark mit der SVP zusammengeht. Umgekehrt ist die Partei auch immer wieder auf die SVP angewiesen, weil es gerade in der Wirtschafts- und Sozialpolitik doch auch klare Übereinstimmungen gibt. Es wird sich die Frage stellen, ob die FDP  in den nächsten drei, vier Jahren einen mehr von der SVP emanzipierten Kurs wählt oder wieder eine grosse Ambivalenz zeigt, was für die Positionierung der Partei eher schädlich ist. Das Gespräch führte Can Külahcigil."
Wie beurteilen Sie Mileis Wahlsieg in Argentinien?,https://www.srf.ch/news/international/wahlen-in-argentinien-javier-milei-wird-neuer-praesident-argentiniens,"Mon, 20 Nov 2023 04:50:07 +0100","time.struct_time(tm_year=2023, tm_mon=11, tm_mday=20, tm_hour=3, tm_min=50, tm_sec=7, tm_wday=0, tm_yday=324, tm_isdst=0)","«Ich habe Javier Milei angerufen und ihm gratuliert», sagte der argentinische Wirtschaftsminister Sergio Massain in seiner Wahlkampfzentrale in Buenos Aires, wie die Nachrichtenagentur Reuters berichtet. Das amtliche Endergebnis wurde allerdings noch nicht veröffentlicht.  «Die Situation Argentiniens ist kritisch. Die Veränderungen, die unser Land braucht, sind drastisch. Es gibt keinen Platz für Gradualismus, keinen Platz für laue Massnahmen», sagte Milei, bei seinem Auftritt nach der Wahl.  Die Anhängerinnen und Anhängern skandierten «Präsident, Präsident» und «Freiheit, Freiheit», als der Rechtspopulist die Bühne betrat. In der Stichwahl traten der linksgerichtete Massa und der libertäre Ökonom Milei gegeneinander an. Die Kandidaten stehen für völlig gegensätzliche Wirtschaftssysteme: Massa hatte angekündigt, die Staatsverschuldung in den Griff zu bekommen und die Reserven der Zentralbank zu erhöhen.  Milei,  welcher von seinen Fans «el león», der Löwe, genannt wird, hatte erklärt, er wolle die Zentralbank schliessen, die Wirtschaft auf den US-Dollar umstellen und den Staatsapparat verkleinern.  Argentinien steckt in einer schweren Wirtschaftskrise. Die Misswirtschaft der Regierung, der hohe Schuldenberg und die Hyperinflation belasten die Menschen im südamerikanischen Land.  Der Präsident Brasiliens, Luiz Inacio Lula da Silva, sandte Glückwünsche über die Plattform X, ehemals Twitter. Er wünsche der neuen Regierung gutes Gelingen. Anders klingt es beim Präsidenten von Kolumbien: Gustavo Petro schrieb auf X: «Die extreme Rechte hat in Argentinien gesiegt, dies ist traurig für Lateinamerika.» Auch aus den USA kamen Glückwünsche zur Wahl. Der Nationale Sicherheitsberater Jake Sullivan gratulierte den Argentinierinnen und Argentiniern zu freien und fairen Wahlen. Man wolle starke bilaterale Beziehungen schaffen, basierend auf die Menschenrechte, demokratische Werte und Transparenz."
