title,link,published,published_parsed,article_content
Die Reichsten sind die grössten Klimasünder,https://www.srf.ch/news/wirtschaft/oxfam-studie-zum-co-ausstoss-die-reichsten-sind-die-groessten-klimasuender,"Mon, 20 Nov 2023 21:39:01 +0100","time.struct_time(tm_year=2023, tm_mon=11, tm_mday=20, tm_hour=20, tm_min=39, tm_sec=1, tm_wday=0, tm_yday=324, tm_isdst=0)","Das reichste Prozent der Weltbevölkerung verursacht so viele klimaschädliche Treibhausgase wie die ärmsten zwei Drittel der Welt. Das heisst es im neuesten Oxfam-Bericht. Laut dem Report «Climate Equality: A Planet for the 99 Percent» steigt der Treibhausgasausstoss der Menschen mit dem privaten Einkommen und Vermögen. Das zeigen Daten aus dem Jahr 2019. Ursache sind unter anderem häufigere Flugreisen, grössere Häuser sowie insgesamt mehr klimaschädlicher Konsum. Im Extremfall sind das Luxusvillen, Megajachten und Privatjets. Oxfam ist ein Verbund von verschiedenen Hilfs- und Entwicklungsorganisationen. Er kämpft gegen extreme Armut und soziale Ungleichheit. Basis für den neuesten Bericht sind Zahlen des Stockholm Environment Institute, das sich auf Daten des Global Carbon Atlas, der World Inequality Database, der Penn World Table zum Einkommen (PWT) sowie Zahlen der Weltbank stützt. Die Botschaft der Zahlen entspricht laut SRF-Wissenschaftsredaktorin Katrin Zöfel der Realität. Die Daten enthielten jedoch einige Unschärfen: «Es gibt verschiedene wissenschaftliche Methoden, um solche CO₂-Budgets zu berechnen. Sie enthalten alle ein bisschen Unsicherheiten – zum Beispiel Schätzungen zum Verhalten dieses reichsten Prozents der Weltbevölkerung oder der ärmsten zwei Drittel. Wenn man global rechnen will, kann man das einfach nur abschätzen. Oxfam unterschlägt in meiner Wahrnehmung diese Unschärfe ein Stück weit. Aber ich will auch betonen: Selbst wenn die Zahlen nicht ganz so exakt sind, die Botschaft dieser Zahlen, die Richtung, entspricht der Realität.» Sind also die Reichen schuld am Klimawandel? Ja, sagt Klimaethiker Dominic Roser. Er arbeitet an der Universität Freiburg. Roser findet deutliche Worte: «Schuld sind wir alle. Klimawandel ist im Alltag verwoben. Jede Dusche und jedes Stück Käse ist mit Emissionen verbunden.» Es gibt also nicht den Sündenbock. Schuldzuweisungen bringen laut Roser nicht viel. Denn die Emissionen in allen Ländern müssten auf null gehen, nicht nur die von den Superreichen. Ein weiteres Problem sei auch, dass die Menschen mit Reichtum diesen nicht einsetzen würden, um das Klimaproblem zu lösen. Zum reichsten Prozent gehören auch viele Schweizerinnen und Schweizer. Oxfam zählt alle Personen dazu, die im Jahr mehr als 140‘000 Dollar verdienen – das sind umgerechnet 123‘000 Franken im Jahr. Natürlich gibt es immer noch Reichere. So stossen gewisse Privatjets in drei Stunden so viel CO₂ aus, wie ein normaler Durchschnittsschweizer in einem ganzen Jahr. Umgekehrt geht der Vergleich aber auch, so Roser: «Schweizer brauchen in drei Tagen so viel Energie wie Menschen in der Zentralafrikanischen Republik in einem ganzen Jahr.» Im globalen Vergleich gehören also die Schweizerinnen und Schweizer zu denjenigen Menschen, die mehr verbrauchen als andere. Ein Grund, sich schuldig zu fühlen? In einem gewissen, sehr simplen Sinn seien wir schuldig, sor Roser. «Das CO₂ tötet Menschen. Es ist abstrakt. Das CO₂ sind Moleküle, die in die Atmosphäre gehen und sich dort vermischen. Das löst am anderen Ende des Globus in ein paar Jahrzehnten einen Sturm aus. Und der Sturm tötet Menschen. Und das ist mein CO₂. Ich weiss nichts anderes zu sagen, als da bin ich schuldig.» Nicht nur im Vergleich mit den Ärmsten trägt die Schweiz mehr zur Erderwärmung bei. Die Flugemissionen pro Kopf seien zum Beispiel in Deutschland halb so hoch wie in der Schweiz, sagt Dominic Roser. Schuld sei jedoch nicht der beste Motivator, um etwas zu verändern. Andere psychologische Mechanismen würden uns viel mehr anziehen. Zum Beispiel, wenn Menschen merken, dass eine gute Zukunft möglich und die Challenge zu lösen sei. Der Klimaethiker ist der Meinung, dass wir herausfinden müssen, wie wir ein aufblühendes Leben führen können, das nicht mit CO₂-Emissionen einhergeht – mehr Landwirtschaft, mehr Mobilität, Heizen ohne Treibhausgasemissionen. «Wir brauchen mehr saubere Technologien. Diese müssen billiger, attraktiver und verbreitet werden, um wirklich die globalen Emissionen zu senken.» Da könnten die Reichen mitwirken und den technologischen Fortschritt finanzieren. Doch auch da bleibt offen, wie das geschehen soll: freiwillig oder durch Gesetze? Die Entwicklungsorganisation Oxfam schlägt in ihrem Bericht zum Beispiel vor, dass die Reichen höher besteuert werden sollen. Die News und das Besondere. Wir erklären, was es sich über die Schlagzeilen hinaus zu wissen lohnt. Um diesen Podcast zu abonnieren, benötigen Sie eine Podcast-kompatible Software oder App. Wenn Ihre App in der obigen Liste nicht aufgeführt ist, können Sie einfach die Feed-URL in Ihre Podcast-App oder Software kopieren."
«Wir hatten drei Tage lang kein Wasser»,https://www.srf.ch/news/international/krieg-in-nahost-wir-hatten-drei-tage-lang-kein-wasser,"Mon, 20 Nov 2023 22:01:05 +0100","time.struct_time(tm_year=2023, tm_mon=11, tm_mday=20, tm_hour=21, tm_min=1, tm_sec=5, tm_wday=0, tm_yday=324, tm_isdst=0)","Nach drei Tagen taucht er endlich wieder auf: Der Tanklaster der Vereinten Nationen, der frisches Trinkwasser zu den Flüchtlingen in Khan Yunis bringt. Wasser ist hier, in der zweitgrössten Stadt des Gazastreifens, so wertvoll wie wohl noch nie.  Flüchtling Abdallah konnte soeben seinen gelben Kanister mit Wasser auffüllen. Er ist dankbar: «Wir hatten drei Tage lang kein Wasser. Nun mussten wir über eine halbe Stunde in der Schlange warten, um etwas zu bekommen.» Laut dem UNO-Amt für die Koordination humanitärer Angelegenheiten (Ocha) sind schätzungsweise 1.7 Millionen Menschen innerhalb des Gazastreifens geflüchtet. Zu Tausenden leben hier vertriebene Palästinenserinnen und Palästinenser in einer Schule des UNO-Palästinenserhilfswerks UNRWA und suchen Schutz vor dem Krieg. Viele von ihnen haben bei den israelischen Bombardierungen nach dem Hamas-Massaker vom 7. Oktober ihr Zuhause verloren. Aber auch hier ist weiterhin jeder Tag ein Kampf ums Überleben. Das Wasser ist dabei das grösste Problem. Denn ein Grossteil des Trinkwassers im Gazastreifen kommt von unter der Erde. Wegen der Abriegelung des Gazastreifens fehlt vielerorts der Treibstoff für die Pumpen – und so fehlt auch das Wasser. Der Lastwagen der UNO ist für viele der Geflüchteten derzeit die einzige Möglichkeit, an Wasser zu kommen – besonders für jene, die kein Geld haben.  Auf Bitten der USA hat Israels Kriegskabinett Ende letzter Woche zugestimmt, dass künftig wieder eine begrenzte Menge an Treibstoff in den südlichen Gazastreifen geliefert werden darf. Pro Tag sollen zwei Lastwagen Treibstoff für UNO-Organisationen einfahren dürfen.  Der Treibstoff darf etwa für die Wasseraufbereitung und -entsalzung, sanitäre Einrichtungen und den Betrieb von Abwasserpumpen verwendet werden. Damit solle auch die Ausbreitung von Seuchen verhindert werden, zitiert die israelische Zeitung «Times of Israel» einen Diplomaten. Dies begründet er damit, dass Seuchen auch israelische Soldaten im Gazastreifen treffen oder sich gar nach Israel ausbreiten könnten.  Das UNO-Kinderhilfswerk Unicef und das UNO-Palästinenserhilfswerk konnten am Sonntag ihre Generatoren im südlichen Gazastreifen wieder in Betrieb nehmen, die wegen Treibstoffmangels über eine Woche stillgestanden waren. Manchmal kommt es deshalb zu Streit unter den verzweifelten Flüchtlingen. Halima, die nach Khan Younis geflüchtet ist, erzählt: «Die Menschen drängeln, um an Wasser zu kommen. Wenn sie sehen, dass ich nicht mehr die Jüngste bin, kriege ich kaum eine Flasche voll. Es sind so viele Menschen – und nicht immer bekommen wir Wasser.» Das Gesundheitssystem im Gazastreifen ist grösstenteils zusammengebrochen. Hilfsorganisationen befürchten den Ausbruch von Seuchen. Die Weltgesundheitsorganisation WHO hat über 44'000 Fälle von Durchfall registriert – deutlich mehr als üblich. Auch in Khan Younis sind viele Menschen krank geworden, sagt Um Omar: «Alle Kinder leiden an Durchfall, Koliken, Bauchweh. Alle sind krank. Kinder wie Erwachsene.» Ein grosses Problem ist für die Flüchtlinge der anstehende Winter. Bereits letzte Woche gab es erste heftige Regenfälle. Der Regen verschärft die Situation zusätzlich, weil viele Flüchtlinge in Zelten schlafen müssen. Flüchtling Nadia erzählt: «Der nächtliche Regen hat alles überschwemmt. Wir mussten unsere Sachen auf Stühle legen und die Nacht sitzend verbringen. Wir konnten nirgends anders hin, weil alle Gebäude überfüllt waren.» Im Winter können die Temperaturen hier – trotz des mediterranen Klimas – auf unter zehn Grad fallen. Besonders schwierig für Ältere, Kranke und Familien mit Kindern. Für die Menschen, die nach Khan Yunis geflüchtet sind, hat der Krieg nach dem Hamas-Massaker alles verändert. Viele haben ihr Zuhause verloren. Auch wenn der Krieg irgendwann zu Ende sein sollte, haben sie keinen Ort mehr, an den sie zurückkehren können. Nach wie vor können Journalistinnen und Journalisten den Gazastreifen nicht von aussen betreten und sich unabhängig ein Bild der Lage machen. Für diesen Beitrag hat SRF mit einem lokalen Team in Khan Younis zusammengearbeitet. Dieses konnte kurz vor dem Zusammenbruch der meisten Kommunikationslinien Bilder und Interviews übermitteln."
Im Gazastreifen wird auch um die Wahrheit gekämpft,https://www.srf.ch/news/international/faktencheck-zu-nahostkonflikt-im-gazastreifen-wird-auch-um-die-wahrheit-gekaempft,"Mon, 20 Nov 2023 21:01:18 +0100","time.struct_time(tm_year=2023, tm_mon=11, tm_mday=20, tm_hour=20, tm_min=1, tm_sec=18, tm_wday=0, tm_yday=324, tm_isdst=0)","Seit Wochen behauptet die israelische Armee, dass sich unter dem grössten Spital Gazas eine Zentrale der radikal-islamischen Hamas befinde. Jüngst hat Israels Armee die Kontrolle über die Klink erlangt. Verschiedenste Kanäle auf den Sozialen Medien wollen diesen Fund beweisen. Darunter ein Video des israelischen Militärs (IDF), das offenbar auch von der israelischen Botschaft in Österreich veröffentlicht wurde. «Bei Videos vom IDF ist es wichtig, festzuhalten, dass dies die israelische Armee selber behauptet», erklärt Daniela Meyer vom Netzwerk Faktencheck von SRF. Die Informationen zum Krieg in Nahost sind zahlreich und zum Teil widersprüchlich. Die verlässlichsten Quellen sind unsere Korrespondentinnen und Korrespondenten vor Ort. Weitere wichtige Quellen neben Agenturmeldungen sind Augenzeugen, welche Informationen aus erster Hand liefern können. Wir verwenden grundsätzlich mindestens zwei voneinander unabhängige Quellen. Die Aussagen der verschiedenen Konfliktparteien ordnen wir entsprechend ein. Grundsätzlich gilt bei SRF: Je schwieriger und unzuverlässiger die Quellenlage, desto wichtiger ist Transparenz. Umstrittene Fakten und Informationen, die nicht unabhängig überprüfbar sind, werden als solche kenntlich gemacht.  Das Netzwerk Faktencheck von SRF bemüht sich zudem, zweifelhafte Inhalte auf Authentizität und Wahrheitsgehalt zu überprüfen. Hierbei spielen auch Plausibilitätschecks und die Arbeit mit international agierenden Fachgemeinschaften eine Rolle. Auch die BBC berichtete vor Ort: Lucy Williamson wurde im Anschluss an die mutmassliche Entdeckung durch die Räumlichkeiten geführt. Eigenen Angaben zufolge durfte sie weder mit dem Personal noch mit Patienten sprechen. Auffällig: Im Unterschied zum IDF-Video liegen die Waffen in den Aufnahmen der BBC teilweise nicht an der gleichen Stelle wie beim ursprünglichen Video. Fazit: «Zum Fund im Al-Schifa-Spital gibt es keine Bestätigung von unabhängiger Seite», so Meyer. Eine angebliche Pflegefrachfrau des Al-Schifa-Spitals in Gaza. Sie spricht von der Hamas, die Lebensmittel und Medikamente gestohlen haben soll – höchstwahrscheinlich eine Inszenierung. Der Fernsehsender France24 betrachtet das Video als «fake». Die Begründung: Zum einen klingen die Explosionen im Hintergrund des Videos immer gleich, was in der Realität nicht der Fall sei. Zum anderen spricht die Frau teils mit einem falschen Akzent. «Sie spricht auch grundsätzlich stark übertrieben», findet Meyer. «Das ganze Video wirkt unglaubwürdig.» Fazit: Hier ist von einem Fake auszugehen. Das israelische Militär hat nach eigenen Angaben Hinweise auf verschleppte Geiseln in einer Kinderklinik in Gaza-Stadt gefunden. Armeesprecher Daniel Hagari veröffentlichte kürzlich Bilder, die zeigen sollen, dass die Hamas im Keller des Rantisi-Spitals Geiseln festgehalten hat. Die Hamas bezeichnete die Aufnahmen als gefälscht.  Hagari verweise auf einen «zufälligen Kalender» als Beweis für eine Liste mit mutmasslichen Geiselnehmern, so Muhammad Shehada auf X. Er ist Journalist, lebt in den palästinensischen Gebieten und schreibt für internationale Medien sowie verschiedene Organisationen. «Kritisiert wird insbesondere, dass nur Wochentage auf dem Kalender stehen», erklärt Meyer vom SRF-Faktencheckteam. «Der Kalender beginnt zwar tatsächlich mit dem 7. Oktober, dem Tag des Angriffs auf Israel, aber ein Kalender mit Wochentagen ist wohl noch kein Beweis für das Festhalten von Entführten.» Fragwürdig sei der angebliche Fund im Keller trotzdem. Fazit: Der Kalender betrifft den Angriff auf Israel, aber nicht zwingend die Geiselnahmen. War die israelische Soldatin Ori Megidish tatsächlich Gefangene der Hamas? Der populistische Medienschaffende Jackson Hinkle aus den USA stellt dies infrage.  Das verschwommene Bild, das Hinke und@xpmov im Video als Beweis für eine freie Ori Megidish betrachten, stammt nicht zwingend von der betroffenen israelischen Soldatin. Zudem ist @xpmov eine fragwürdige Quelle, die sich auf X selbst zur islamistischen Organisation Hisbollah bekennt («With Hezbollah in word and deed»). Fazit: Das entsprechende Profil ist kein Beweis für eine falsche Darstellung Israels. Die Kämpfe in Israel und im Gazastreifen halten an. Hier finden Sie alle unsere Inhalte zur Eskalation im Nahen Osten. Die wichtigsten und spannendsten News jetzt bequem auf Whatsapp – einmal morgens (Montag bis Freitag), einmal abends (die ganze Woche): Abonnieren Sie den SRF-News-Kanal auf Ihrem Smartphone hier."
IKRK-Präsidentin trifft Hamas-Chef +++ 28 Frühchen evakuiert,https://www.srf.ch/news/international/krieg-im-nahen-osten-ikrk-praesidentin-trifft-hamas-chef-28-fruehchen-evakuiert,"Mon, 20 Nov 2023 22:59:25 +0100","time.struct_time(tm_year=2023, tm_mon=11, tm_mday=20, tm_hour=21, tm_min=59, tm_sec=25, tm_wday=0, tm_yday=324, tm_isdst=0)","Der Krieg im Nahen Osten hat bereits Tausende von Menschenleben gekostet, grösstenteils Zivilpersonen. Die Glückskette ruft zur Solidarität auf, um der Zivilbevölkerung zu helfen. Sie unterstützt ihre Schweizer Partnerorganisationen vor Ort – sie hilft dort, wo die humanitären Bedürfnisse am grössten sind. Zurzeit ist das Gaza. Spenden für die Sammlung «Humanitäre Krise im Nahen Osten» können auf der Webseite der Glückskette getätigt werden. Die Kämpfe in Israel und im Gazastreifen halten an. Hier finden Sie alle unsere Inhalte zum Krieg im Nahen Osten. Die Informationen zum Krieg in Nahost sind zahlreich und zum Teil widersprüchlich. Die verlässlichsten Quellen sind unsere Korrespondentinnen und Korrespondenten sowie Mitarbeiterinnen und Mitarbeiter vor Ort. Weitere wichtige Quellen sind Augenzeugen, welche Informationen aus erster Hand liefern können. Die Aussagen der verschiedenen Konfliktparteien ordnen wir entsprechend ein. Grundsätzlich gilt bei SRF: Je schwieriger und unzuverlässiger die Quellenlage, desto wichtiger ist Transparenz. Umstrittene Fakten und Informationen, die nicht unabhängig überprüfbar sind, werden als solche kenntlich gemacht."
FDP stellt Schulterschluss mit SVP infrage,https://www.srf.ch/news/schweiz/wahlen-2023/verluste-im-staenderat-fdp-stellt-schulterschluss-mit-svp-infrage,"Mon, 20 Nov 2023 15:29:36 +0100","time.struct_time(tm_year=2023, tm_mon=11, tm_mday=20, tm_hour=14, tm_min=29, tm_sec=36, tm_wday=0, tm_yday=324, tm_isdst=0)","Eine Lehre aus den Ständeratswahlgängen vom Sonntag ist schnell gezogen: «Im Zweifelsfall sollte man künftig eher selber antreten», sagt FDP-Präsident Thierry Burkart. Auch wenn dann das Risiko bestehe, dass sich die Stimmen auf mehrere bürgerliche Kandidierende aufsplitten.  Und noch etwas müsse man in Zukunft gemäss dem FDP-Präsidenten besser machen: «Die Rückzüge beziehungsweise Unterstützungen für andere Kandidaten sind in den Kantonalparteien der FDP vorgenommen worden. Hier gab es keine nationale Strategie.» Seine Forderung sei klar, sagt Burkart: «Künftig müssen wir uns als Partei und unter den Kantonalparteien besser absprechen.» Die Zusammenarbeit im bürgerlichen Lager bröckelte bei diesen zweiten Ständeratswahlgängen. Offiziell hat die FDP zwar sowohl in den Kantonen Zürich und Aargau wie auch im Kanton Solothurn den SVP-Kandidaten unterstützt. Einzelne FDP-Exponenten, wie auch die FDP-Frauen im Kanton Zürich, haben sich aber dieser Empfehlung nicht angeschlossen.  Die SVP hatte der FDP im Nachhinein denn auch vorgeworfen, sie habe ihre Kandidaten zu wenig konsequent unterstützt. Doch die FDP muss sich ganz grundsätzlich fragen: Wie konsequent soll sie überhaupt – beispielsweise bei solchen Ständeratswahlgängen – mit der SVP zusammenspannen? Hierzu gehen die Meinungen innerhalb der Partei auseinander. Der ehemalige Solothurner FDP-Nationalrat Kurt Fluri beispielsweise hatte sich in seinem Kanton von Anfang an dagegen ausgesprochen, den SVP-Kandidaten Christian Imark zu unterstützen.  Auch nach den Wahlen betont Fluri: «Die Mehrheit der Delegierten geht vom falschen Bild eines bürgerlichen Schulterschlusses aus, den es in Bern nie gab und auch nicht gibt. Es gibt zu viele Differenzen zwischen SVP und FDP, als dass man von einem rechten Block sprechen könnte.» Fluri ist zudem der Meinung, dass diese Zusammenarbeit mit der SVP für das Image der FDP nicht förderlich war: «Von mir aus schadet das ganz klar. In allen drei Kantonen war die FDP zusammen mit der SVP die Verliererin. Wir haben uns damit das Image einer unliberalen Gesellschaftspolitik eingehandelt, weil die SVP eine ebensolche betreibt.» Etwas anders sieht dies der Zürcher FDP-Nationalrat Hans-Peter Portmann. Er befürwortet grundsätzlich die Zusammenarbeit mit der SVP. Doch man müsse sich gegenseitig konsequenter unterstützen. Auch die Unterstützung der SVP für die FDP sei nicht konsequent, findet Portmann. Diese hätte auch zugunsten der FDP zurückstehen können – im Wissen, dass ihre Kandidaten im zweiten Wahlgang einen schwereren Stand haben. «Beide bürgerlichen Parteien müssen sich überlegen: Wenn man künftig wirklich bürgerliche Politik machen und eine Kooperation bei verschiedenen Themen will, dann muss man das anders angehen, als wir das in diesem Wahljahr gemacht haben», sagt Portmann. Wie nah sind sich FDP und SVP denn nun – und wie stark soll die FDP mit der SVP zusammenarbeiten? Dass es in der FDP bei diesen Fragen an Einigkeit mangelt, gibt auch Parteipräsident Burkart zu: «Das muss ich leider so zur Kenntnis nehmen. Hier müssen wir in Zukunft besser werden – auf die eine wie auch die andere Seite.» Die wichtigsten und spannendsten News jetzt bequem auf Whatsapp – einmal morgens (Montag bis Freitag), einmal abends (die ganze Woche): Abonnieren Sie den SRF-News-Kanal auf Ihrem Smartphone hier."
0:0 gegen Ukraine reicht: Titelverteidiger Italien fährt zur EURO,https://www.srf.ch/sport/fussball/em-qualifikation/em-qualifikation-round-up-0-0-gegen-ukraine-reicht-titelverteidiger-italien-faehrt-zur-euro,"Mon, 20 Nov 2023 23:00:56 +0100","time.struct_time(tm_year=2023, tm_mon=11, tm_mday=20, tm_hour=22, tm_min=0, tm_sec=56, tm_wday=0, tm_yday=324, tm_isdst=0)","Ohne Zittern ging es für den Titelverteidiger nicht. Italien musste im «Auswärtsspiel» in Leverkusen bis zur letzten Sekunde um sein EM-Ticket bangen. In der Nachspielzeit kam es im italienischen Sechzehner zu einem strittigen Zweikampf zwischen Bryan Cristante und Michailo Mudryk, die Pfeife des spanischen Schiedsrichters Jesus Gil Manzano blieb jedoch stumm. Kurz darauf erlöste der Unparteiische die «Squadra Azzurra» mit dem Schluspfiff. Die Italiener hatten die 1. Halbzeit dominiert und sich mit attraktivem Offensiv-Fussball mehrere gute Torchancen erspielt. Im Abschluss sündigte das Team von Trainer Luciano Spalletti jedoch wiederholt. Die Ukrainer tauchten seltener gefährlich vor dem gegnerischen Tor auf. Mudryk vergab die beste Möglichkeit in der 65. Minute, als der Chelsea-Akteur aus kurzer Distanz und spitzem Winkel an Gianluigi Donnarumma scheiterte. Den Ukrainern bleibt noch die Chance, sich über die Playoffs für die EM-Endrunde zu qualifizieren.  Die «Three Lions» standen bereits vor dem Quali-Abschluss in Nordmazedonien als Gruppensieger fest. Entsprechend liess England die letzte Konsequenz vermissen. Dank eines Eigentors von Jani Atanasow in der 59. Minute verhinderte England immerhin noch die erste Niederlage in der laufenden Kampagne. Enis Bardhi hatte Nordmazedonien vor der Pause per Nachschuss nach einem verschossenen Elfmeter in Führung gebracht. Tschechien konnte sich bislang immer für eine Europameisterschaft qualifizieren und ist nun auch definitiv an der EM 2024 in Deutschland dabei. Im entscheidenden Gruppenspiel zuhause gegen Moldawien hätte dem Team von Jaroslav Silhavy ein Remis genügt. Doch die Tschechen wollten es von Beginn an nicht darauf ankommen lassen.  Nach einer Viertelstunde traf Flügelspieler David Doudera in Olmütz nach einem schönen Alleingang zur Führung und öffnete damit die Tore früh bereits sehr weit. Nach einer gelb-roten Karte gegen Moldawiens Vladislav Babohlo (55.) war die Partie vorentschieden. Tomas Chory (72.) und Namensvetter Soucek (90.) legten noch zwei weitere Treffer zum verdienten 3:0 nach. Zum Gruppensieg reichte es Tschechien nicht mehr. Dies, weil Albanien in Tirana ein torloses Remis gegen die Färöer Inseln genügte, um Platz 1 zu verteidigen. Slowenien fährt erstmals seit 2000 an eine Europameisterschaft. Im letzten Gruppenspiel gegen Kasachstan hatten die Slowenen mindestens ein Remis gebraucht. Lange sah es auch danach aus, doch nach einem schönen Schlenzer von Benjamin Verbic in der 86. Minute zum 2:1 gelang sogar der Sieg. Zuvor waren Benjamin Sesko (41.) per Penalty und Ramazan Orazov (48.) erfolgreich gewesen. Slowenien holt sich damit den zweiten Gruppenrang, Kasachstan verpasst die direkte Quali und muss auf die Playoffs hoffen. Das bereits eliminierte Nordirland schaffte gegen Gruppensieger Dänemark die Überraschung und gewann zuhause mit 2:0. Isaac Price erwischte mit seinem Abschluss nach einer Stunde Keeper Kasper Schmeichel in der nahen Ecke und erzielte so die Führung, nach einem Konter in der Schlussphase sorgte Dion Charles für die Entscheidung. Eine Halbzeit lang hielt San Marino mit Finnland mit. Nach der Pause setzte sich die finnische Klasse dann doch noch durch. Pyry Soiri sorgte mit einem Doppelpack (50./58.) für die Tore der Finnen, die sich in der Gruppe auf dem 3. Platz wiederfinden und bereits vor der Partie keine Chance mehr auf die direkte Qualifikation hatten. In der Nachspielzeit verkürzte Filippo Berardi noch per Penalty für das Heimteam – das damit zum ersten Mal überhaupt dreimal in Serie trifft."
